Original Product Name,SKU,Product Title,SEO Title,Focus Keywords,SEO Meta Description
Vegan Vietnamese: Vibrant Plant-Based Recipes to Enjoy Every Day,P00353,Vegan Vietnamese: Vibrant Plant-Based Recipes to Enjoy Every Day - Books,Buy Vegan Vietnamese: Vibrant Plant-Based Recipes to Enjoy Every Day Online | Pay4more,"Vegan Vietnamese: Vibrant Plant-Based Recipes to Enjoy Every Day, Books, buy vegan vietnamese: vibrant plant-based recipes to enjoy every day",Shop for the best Vegan Vietnamese: Vibrant Plant-Based Recipes to Enjoy Every Day at Pay4more. High-quality vegan vietnamese: vibrant plant-based recipes to enjoy every day available with fast shipping. Order now!
General Electric Lighting,P00354,General Electric Lighting - Lighting,Buy General Electric Lighting Online | Pay4more,"General Electric Lighting, Lighting, buy general electric lighting",Shop for the best General Electric Lighting at Pay4more. High-quality general electric lighting available with fast shipping. Order now!
"GE 3.5W LED CAC Soft White Clear Bent Tip Decorative Bulbs - 2 Pk
",P00355,"GE 3.5W LED CAC Soft White Clear Bent Tip Decorative Bulbs - 2 Pk
 - Light Bulbs","Buy GE 3.5W LED CAC Soft White Clear Bent Tip Decorative Bulbs - 2 Pk
 Online | Pay4more","GE 3.5W LED CAC Soft White Clear Bent Tip Decorative Bulbs - 2 Pk
, Light Bulbs, buy ge 3.5w led cac soft white clear bent tip decorative bulbs - 2 pk
","Shop for the best GE 3.5W LED CAC Soft White Clear Bent Tip Decorative Bulbs - 2 Pk
 at Pay4more. High-quality ge 3.5w led cac soft white clear bent tip decorative bulbs - 2 pk
 available with fast shipping. Order now!"
Philips 471235 Led 50W PAR20 Glass Daylight (5000K) - 3 Pack,P00356,Philips 471235 Led 50W PAR20 Glass Daylight (5000K) - 3 Pack - Light Bulbs,Buy Philips 471235 Led 50W PAR20 Glass Daylight (5000K) - 3 Pack Online | Pay4more,"Philips 471235 Led 50W PAR20 Glass Daylight (5000K) - 3 Pack, Light Bulbs, buy philips 471235 led 50w par20 glass daylight (5000k) - 3 pack",Shop for the best Philips 471235 Led 50W PAR20 Glass Daylight (5000K) - 3 Pack at Pay4more. High-quality philips 471235 led 50w par20 glass daylight (5000k) - 3 pack available with fast shipping. Order now!
Point Last Seen: A Novel,P00357,Point Last Seen: A Novel - Books,Buy Point Last Seen: A Novel Online | Pay4more,"Point Last Seen: A Novel, Books, buy point last seen: a novel",Shop for the best Point Last Seen: A Novel at Pay4more. High-quality point last seen: a novel available with fast shipping. Order now!
Bluey: Big Backyard: A Colouring Book,P00358,Bluey: Big Backyard: A Colouring Book - Notebooks & Pads,Buy Bluey: Big Backyard: A Colouring Book Online | Pay4more,"Bluey: Big Backyard: A Colouring Book, Notebooks & Pads, buy bluey: big backyard: a colouring book",Shop for the best Bluey: Big Backyard: A Colouring Book at Pay4more. High-quality bluey: big backyard: a colouring book available with fast shipping. Order now!
Tell Me Lies: A Novel,P00359,Tell Me Lies: A Novel - Books,Buy Tell Me Lies: A Novel Online | Pay4more,"Tell Me Lies: A Novel, Books, buy tell me lies: a novel",Shop for the best Tell Me Lies: A Novel at Pay4more. High-quality tell me lies: a novel available with fast shipping. Order now!
The Game Master’s Handbook of Proactive Roleplaying: Guidelines and strategies for running PC-driven narratives in 5E adventures,P00360,The Game Master’s Handbook of Proactive Roleplaying: Guidelines and strategies for running PC-driven narratives in 5E adventures - Books,Buy The Game Master’s Handbook of Proactive Roleplaying: Guidelines and strategies for running PC-driven narratives in 5E adventures Online | Pay4more,"The Game Master’s Handbook of Proactive Roleplaying: Guidelines and strategies for running PC-driven narratives in 5E adventures, Books, buy the game master’s handbook of proactive roleplaying: guidelines and strategies for running pc-driven narratives in 5e adventures",Shop for the best The Game Master’s Handbook of Proactive Roleplaying: Guidelines and strategies for running PC-driven narratives in 5E adventures at Pay4more. High-quality the game master’s handbook of proactive roleplaying: guidelines and strategies for running pc-driven narratives in 5e adventures available with fast shipping. Order now!
Out on a Limb: A Novel,P00361,Out on a Limb: A Novel - Books,Buy Out on a Limb: A Novel Online | Pay4more,"Out on a Limb: A Novel, Books, buy out on a limb: a novel",Shop for the best Out on a Limb: A Novel at Pay4more. High-quality out on a limb: a novel available with fast shipping. Order now!
Timid: A Graphic Novel,P00362,Timid: A Graphic Novel - Books,Buy Timid: A Graphic Novel Online | Pay4more,"Timid: A Graphic Novel, Books, buy timid: a graphic novel",Shop for the best Timid: A Graphic Novel at Pay4more. High-quality timid: a graphic novel available with fast shipping. Order now!
A Court of Mist and Fury,P00363,A Court of Mist and Fury - Books,Buy A Court of Mist and Fury Online | Pay4more,"A Court of Mist and Fury, Books, buy a court of mist and fury",Shop for the best A Court of Mist and Fury at Pay4more. High-quality a court of mist and fury available with fast shipping. Order now!
"GE 2pk 60W Refresh A19 Aline LED Light Bulbs Daylight: Dimmable, 800 Lumens, Energy Star Certified, 13.7-Year Life",P00364,"GE 2pk 60W Refresh A19 Aline LED Light Bulbs Daylight: Dimmable, 800 Lumens, Energy Star Certified, 13.7-Year Life - Light Bulbs","Buy GE 2pk 60W Refresh A19 Aline LED Light Bulbs Daylight: Dimmable, 800 Lumens, Energy Star Certified, 13.7-Year Life Online | Pay4more","GE 2pk 60W Refresh A19 Aline LED Light Bulbs Daylight: Dimmable, 800 Lumens, Energy Star Certified, 13.7-Year Life, Light Bulbs, buy ge 2pk 60w refresh a19 aline led light bulbs daylight: dimmable, 800 lumens, energy star certified, 13.7-year life","Shop for the best GE 2pk 60W Refresh A19 Aline LED Light Bulbs Daylight: Dimmable, 800 Lumens, Energy Star Certified, 13.7-Year Life at Pay4more. High-quality ge 2pk 60w refresh a19 aline led light bulbs daylight: dimmable, 800 lumens, energy star certified, 13.7-year life available with fast shipping. Order now!"
"GE LED+ Color Lamp LED Light Bulbs,General Purpose, A19 Bulb, 9.5 Watts (1 Pack)",P00365,"GE LED+ Color Lamp LED Light Bulbs,General Purpose, A19 Bulb, 9.5 Watts (1 Pack) - Lighting Decor,Light Bulbs","Buy GE LED+ Color Lamp LED Light Bulbs,General Purpose, A19 Bulb, 9.5 Watts (1 Pack) Online | Pay4more","GE LED+ Color Lamp LED Light Bulbs,General Purpose, A19 Bulb, 9.5 Watts (1 Pack), Lighting Decor,Light Bulbs, buy ge led+ color lamp led light bulbs,general purpose, a19 bulb, 9.5 watts (1 pack)","Shop for the best GE LED+ Color Lamp LED Light Bulbs,General Purpose, A19 Bulb, 9.5 Watts (1 Pack) at Pay4more. High-quality ge led+ color lamp led light bulbs,general purpose, a19 bulb, 9.5 watts (1 pack) available with fast shipping. Order now!"
Konftel OCC Hub 900102149,P00366,Konftel OCC Hub 900102149 - Computer Accessories,Buy Konftel OCC Hub 900102149 Online | Pay4more,"Konftel OCC Hub 900102149, Computer Accessories, buy konftel occ hub 900102149",Shop for the best Konftel OCC Hub 900102149 at Pay4more. High-quality konftel occ hub 900102149 available with fast shipping. Order now!
Narwhalicorn and Jelly (A Narwhal and Jelly Book #7),P00367,Narwhalicorn and Jelly (A Narwhal and Jelly Book #7) - Books,Buy Narwhalicorn and Jelly (A Narwhal and Jelly Book #7) Online | Pay4more,"Narwhalicorn and Jelly (A Narwhal and Jelly Book #7), Books, buy narwhalicorn and jelly (a narwhal and jelly book #7)",Shop for the best Narwhalicorn and Jelly (A Narwhal and Jelly Book #7) at Pay4more. High-quality narwhalicorn and jelly (a narwhal and jelly book #7) available with fast shipping. Order now!
Window Stickies Ocean Friends,P00368,Window Stickies Ocean Friends - Books,Buy Window Stickies Ocean Friends Online | Pay4more,"Window Stickies Ocean Friends, Books, buy window stickies ocean friends",Shop for the best Window Stickies Ocean Friends at Pay4more. High-quality window stickies ocean friends available with fast shipping. Order now!
Spider-Man Avengers Paintbrush Marker Activity Book,P00369,"Spider-Man Avengers Paintbrush Marker Activity Book - Books,Arts & Crafts",Buy Spider-Man Avengers Paintbrush Marker Activity Book Online | Pay4more,"Spider-Man Avengers Paintbrush Marker Activity Book, Books,Arts & Crafts, buy spider-man avengers paintbrush marker activity book",Shop for the best Spider-Man Avengers Paintbrush Marker Activity Book at Pay4more. High-quality spider-man avengers paintbrush marker activity book available with fast shipping. Order now!
My Busy Construction Coloring Book,P00370,"My Busy Construction Coloring Book - Books,Arts & Crafts",Buy My Busy Construction Coloring Book Online | Pay4more,"My Busy Construction Coloring Book, Books,Arts & Crafts, buy my busy construction coloring book",Shop for the best My Busy Construction Coloring Book at Pay4more. High-quality my busy construction coloring book available with fast shipping. Order now!
The Mermaid with No Tail,P00371,The Mermaid with No Tail - Books,Buy The Mermaid with No Tail Online | Pay4more,"The Mermaid with No Tail, Books, buy the mermaid with no tail",Shop for the best The Mermaid with No Tail at Pay4more. High-quality the mermaid with no tail available with fast shipping. Order now!
"The Hardest Hidden Pictures Book Ever: The Hardest Hidden Pictures Book Ever (Highlights Hidden Pictures Puzzles) Over 1,500 Hidden Objects to Search and Find, Hardest Look-and-Find Book",P00372,"The Hardest Hidden Pictures Book Ever: The Hardest Hidden Pictures Book Ever (Highlights Hidden Pictures Puzzles) Over 1,500 Hidden Objects to Search and Find, Hardest Look-and-Find Book - Books,Puzzles","Buy The Hardest Hidden Pictures Book Ever: The Hardest Hidden Pictures Book Ever (Highlights Hidden Pictures Puzzles) Over 1,500 Hidden Objects to Search and Find, Hardest Look-and-Find Book Online | Pay4more","The Hardest Hidden Pictures Book Ever: The Hardest Hidden Pictures Book Ever (Highlights Hidden Pictures Puzzles) Over 1,500 Hidden Objects to Search and Find, Hardest Look-and-Find Book, Books,Puzzles, buy the hardest hidden pictures book ever: the hardest hidden pictures book ever (highlights hidden pictures puzzles) over 1,500 hidden objects to search and find, hardest look-and-find book","Shop for the best The Hardest Hidden Pictures Book Ever: The Hardest Hidden Pictures Book Ever (Highlights Hidden Pictures Puzzles) Over 1,500 Hidden Objects to Search and Find, Hardest Look-and-Find Book at Pay4more. High-quality the hardest hidden pictures book ever: the hardest hidden pictures book ever (highlights hidden pictures puzzles) over 1,500 hidden objects to search and find, hardest look-and-find book available with fast shipping. Order now!"
"Bluey: Hooray, It's Halloween!: A Coloring Book",P00373,"Bluey: Hooray, It's Halloween!: A Coloring Book - Books,Arts & Crafts","Buy Bluey: Hooray, It's Halloween!: A Coloring Book Online | Pay4more","Bluey: Hooray, It's Halloween!: A Coloring Book, Books,Arts & Crafts, buy bluey: hooray, it's halloween!: a coloring book","Shop for the best Bluey: Hooray, It's Halloween!: A Coloring Book at Pay4more. High-quality bluey: hooray, it's halloween!: a coloring book available with fast shipping. Order now!"
The Very Hungry Caterpillar (Exclusive Edition),P00374,The Very Hungry Caterpillar (Exclusive Edition) - Books,Buy The Very Hungry Caterpillar (Exclusive Edition) Online | Pay4more,"The Very Hungry Caterpillar (Exclusive Edition), Books, buy the very hungry caterpillar (exclusive edition)",Shop for the best The Very Hungry Caterpillar (Exclusive Edition) at Pay4more. High-quality the very hungry caterpillar (exclusive edition) available with fast shipping. Order now!
Jurassic World Big Book of Coloring Posters Book,P00375,"Jurassic World Big Book of Coloring Posters Book - Books,Arts & Crafts",Buy Jurassic World Big Book of Coloring Posters Book Online | Pay4more,"Jurassic World Big Book of Coloring Posters Book, Books,Arts & Crafts, buy jurassic world big book of coloring posters book",Shop for the best Jurassic World Big Book of Coloring Posters Book at Pay4more. High-quality jurassic world big book of coloring posters book available with fast shipping. Order now!
Outdoor Puzzles,P00376,"Outdoor Puzzles - Books,Puzzles",Buy Outdoor Puzzles Online | Pay4more,"Outdoor Puzzles, Books,Puzzles, buy outdoor puzzles",Shop for the best Outdoor Puzzles at Pay4more. High-quality outdoor puzzles available with fast shipping. Order now!
Pete The Cat Coloring Book with Crayons,P00377,"Pete The Cat Coloring Book with Crayons - Books,Arts & Crafts",Buy Pete The Cat Coloring Book with Crayons Online | Pay4more,"Pete The Cat Coloring Book with Crayons, Books,Arts & Crafts, buy pete the cat coloring book with crayons",Shop for the best Pete The Cat Coloring Book with Crayons at Pay4more. High-quality pete the cat coloring book with crayons available with fast shipping. Order now!
Create and Play Unicorns Activity Book,P00378,Create and Play Unicorns Activity Book - Books,Buy Create and Play Unicorns Activity Book Online | Pay4more,"Create and Play Unicorns Activity Book, Books, buy create and play unicorns activity book",Shop for the best Create and Play Unicorns Activity Book at Pay4more. High-quality create and play unicorns activity book available with fast shipping. Order now!
Craftsman CMHT77721 Pocket Laser Distance Measurer - 55ft Range with USB Rechargeable Battery,P00380,Craftsman CMHT77721 Pocket Laser Distance Measurer - 55ft Range with USB Rechargeable Battery - Hand Tools,Buy Craftsman CMHT77721 Pocket Laser Distance Measurer - 55ft Range with USB Rechargeable Battery Online | Pay4more,"Craftsman CMHT77721 Pocket Laser Distance Measurer - 55ft Range with USB Rechargeable Battery, Hand Tools, buy craftsman cmht77721 pocket laser distance measurer - 55ft range with usb rechargeable battery",Shop for the best Craftsman CMHT77721 Pocket Laser Distance Measurer - 55ft Range with USB Rechargeable Battery at Pay4more. High-quality craftsman cmht77721 pocket laser distance measurer - 55ft range with usb rechargeable battery available with fast shipping. Order now!
"Logitech Combo Touch iPad Pro 12.9-inch (5th, 6th gen - 2021, 2022) Keyboard Case - Detachable Backlit Keyboard with Kickstand, Click-Anywhere Trackpad, Smart Connector - Oxford Gray; USA Layout",P00381,"Logitech Combo Touch iPad Pro 12.9-inch (5th, 6th gen - 2021, 2022) Keyboard Case - Detachable Backlit Keyboard with Kickstand, Click-Anywhere Trackpad, Smart Connector - Oxford Gray; USA Layout - Computer Accessories","Buy Logitech Combo Touch iPad Pro 12.9-inch (5th, 6th gen - 2021, 2022) Keyboard Case - Detachable Backlit Keyboard with Kickstand, Click-Anywhere Trackpad, Smart Connector - Oxford Gray; USA Layout Online | Pay4more","Logitech Combo Touch iPad Pro 12.9-inch (5th, 6th gen - 2021, 2022) Keyboard Case - Detachable Backlit Keyboard with Kickstand, Click-Anywhere Trackpad, Smart Connector - Oxford Gray; USA Layout, Computer Accessories, buy logitech combo touch ipad pro 12.9-inch (5th, 6th gen - 2021, 2022) keyboard case - detachable backlit keyboard with kickstand, click-anywhere trackpad, smart connector - oxford gray; usa layout","Shop for the best Logitech Combo Touch iPad Pro 12.9-inch (5th, 6th gen - 2021, 2022) Keyboard Case - Detachable Backlit Keyboard with Kickstand, Click-Anywhere Trackpad, Smart Connector - Oxford Gray; USA Layout at Pay4more. High-quality logitech combo touch ipad pro 12.9-inch (5th, 6th gen - 2021, 2022) keyboard case - detachable backlit keyboard with kickstand, click-anywhere trackpad, smart connector - oxford gray; usa layout available with fast shipping. Order now!"
ROBERTO CAVALLIFloris Queen Duvet Cover In Multi,P00382,ROBERTO CAVALLIFloris Queen Duvet Cover In Multi - Bedding,Buy ROBERTO CAVALLIFloris Queen Duvet Cover In Multi Online | Pay4more,"ROBERTO CAVALLIFloris Queen Duvet Cover In Multi, Bedding, buy roberto cavallifloris queen duvet cover in multi",Shop for the best ROBERTO CAVALLIFloris Queen Duvet Cover In Multi at Pay4more. High-quality roberto cavallifloris queen duvet cover in multi available with fast shipping. Order now!
Sun Squad Inflatable Giant Pineapple,P00383,Sun Squad Inflatable Giant Pineapple - Pool Floats & Recreation,Buy Sun Squad Inflatable Giant Pineapple Online | Pay4more,"Sun Squad Inflatable Giant Pineapple, Pool Floats & Recreation, buy sun squad inflatable giant pineapple",Shop for the best Sun Squad Inflatable Giant Pineapple at Pay4more. High-quality sun squad inflatable giant pineapple available with fast shipping. Order now!
Ultimate Nutrition Shampoo,P00384,"Ultimate Nutrition Shampoo - Bathroom,Beauty & Personal Care",Buy Ultimate Nutrition Shampoo Online | Pay4more,"Ultimate Nutrition Shampoo, Bathroom,Beauty & Personal Care, buy ultimate nutrition shampoo",Shop for the best Ultimate Nutrition Shampoo at Pay4more. High-quality ultimate nutrition shampoo available with fast shipping. Order now!
Ultimate Nutrition Shampoo,P00385,"Ultimate Nutrition Shampoo - Bathroom,Beauty & Personal Care",Buy Ultimate Nutrition Shampoo Online | Pay4more,"Ultimate Nutrition Shampoo, Bathroom,Beauty & Personal Care, buy ultimate nutrition shampoo",Shop for the best Ultimate Nutrition Shampoo at Pay4more. High-quality ultimate nutrition shampoo available with fast shipping. Order now!
Stranger Things Demogorgon Pop It Fidget Toy from Sci Fi Netflix Series,P00386,Stranger Things Demogorgon Pop It Fidget Toy from Sci Fi Netflix Series - Toys & Games,Buy Stranger Things Demogorgon Pop It Fidget Toy from Sci Fi Netflix Series Online | Pay4more,"Stranger Things Demogorgon Pop It Fidget Toy from Sci Fi Netflix Series, Toys & Games, buy stranger things demogorgon pop it fidget toy from sci fi netflix series",Shop for the best Stranger Things Demogorgon Pop It Fidget Toy from Sci Fi Netflix Series at Pay4more. High-quality stranger things demogorgon pop it fidget toy from sci fi netflix series available with fast shipping. Order now!
Zak Designs 30 fl oz Stainless Steel Straw Tumbler,P00387,Zak Designs 30 fl oz Stainless Steel Straw Tumbler - Dinnerware,Buy Zak Designs 30 fl oz Stainless Steel Straw Tumbler Online | Pay4more,"Zak Designs 30 fl oz Stainless Steel Straw Tumbler, Dinnerware, buy zak designs 30 fl oz stainless steel straw tumbler",Shop for the best Zak Designs 30 fl oz Stainless Steel Straw Tumbler at Pay4more. High-quality zak designs 30 fl oz stainless steel straw tumbler available with fast shipping. Order now!
"Kasa Outdoor Smart Plug, Smart Home Wi-Fi Outlet with 2 Sockets, IP64 Weather Resistance, Compatible with Alexa, Google Home & IFTTT, No Hub Required, ETL Certified(EP40), Black",P00388,"Kasa Outdoor Smart Plug, Smart Home Wi-Fi Outlet with 2 Sockets, IP64 Weather Resistance, Compatible with Alexa, Google Home & IFTTT, No Hub Required, ETL Certified(EP40), Black - Smart home","Buy Kasa Outdoor Smart Plug, Smart Home Wi-Fi Outlet with 2 Sockets, IP64 Weather Resistance, Compatible with Alexa, Google Home & IFTTT, No Hub Required, ETL Certified(EP40), Black Online | Pay4more","Kasa Outdoor Smart Plug, Smart Home Wi-Fi Outlet with 2 Sockets, IP64 Weather Resistance, Compatible with Alexa, Google Home & IFTTT, No Hub Required, ETL Certified(EP40), Black, Smart home, buy kasa outdoor smart plug, smart home wi-fi outlet with 2 sockets, ip64 weather resistance, compatible with alexa, google home & ifttt, no hub required, etl certified(ep40), black","Shop for the best Kasa Outdoor Smart Plug, Smart Home Wi-Fi Outlet with 2 Sockets, IP64 Weather Resistance, Compatible with Alexa, Google Home & IFTTT, No Hub Required, ETL Certified(EP40), Black at Pay4more. High-quality kasa outdoor smart plug, smart home wi-fi outlet with 2 sockets, ip64 weather resistance, compatible with alexa, google home & ifttt, no hub required, etl certified(ep40), black available with fast shipping. Order now!"
Mini Bubble Blaster - Sun Squad™,P00389,Mini Bubble Blaster - Sun Squad™ - Bubble & Pool Toys,Buy Mini Bubble Blaster - Sun Squad™ Online | Pay4more,"Mini Bubble Blaster - Sun Squad™, Bubble & Pool Toys, buy mini bubble blaster - sun squad™",Shop for the best Mini Bubble Blaster - Sun Squad™ at Pay4more. High-quality mini bubble blaster - sun squad™ available with fast shipping. Order now!
Funko Pop ! Jeux : Pokémon - Jumbo Umbreon (exclusivité cible),P00390,Funko Pop ! Jeux : Pokémon - Jumbo Umbreon (exclusivité cible) - Collectible Toys,Buy Funko Pop ! Jeux : Pokémon - Jumbo Umbreon (exclusivité cible) Online | Pay4more,"Funko Pop ! Jeux : Pokémon - Jumbo Umbreon (exclusivité cible), Collectible Toys, buy funko pop ! jeux : pokémon - jumbo umbreon (exclusivité cible)",Shop for the best Funko Pop ! Jeux : Pokémon - Jumbo Umbreon (exclusivité cible) at Pay4more. High-quality funko pop ! jeux : pokémon - jumbo umbreon (exclusivité cible) available with fast shipping. Order now!
"XSHOT XS-11853-A_026384 Hand Held Games, S",P00391,"XSHOT XS-11853-A_026384 Hand Held Games, S - Water & Pool Toys","Buy XSHOT XS-11853-A_026384 Hand Held Games, S Online | Pay4more","XSHOT XS-11853-A_026384 Hand Held Games, S, Water & Pool Toys, buy xshot xs-11853-a_026384 hand held games, s","Shop for the best XSHOT XS-11853-A_026384 Hand Held Games, S at Pay4more. High-quality xshot xs-11853-a_026384 hand held games, s available with fast shipping. Order now!"
Sun Squad 2 Pack Squid LIGHT UP: 2 Pack Wiggler Divers. Green & Yellow. New,P00392,Sun Squad 2 Pack Squid LIGHT UP: 2 Pack Wiggler Divers. Green & Yellow. New - Water & Dive Toys,Buy Sun Squad 2 Pack Squid LIGHT UP: 2 Pack Wiggler Divers. Green & Yellow. New Online | Pay4more,"Sun Squad 2 Pack Squid LIGHT UP: 2 Pack Wiggler Divers. Green & Yellow. New, Water & Dive Toys, buy sun squad 2 pack squid light up: 2 pack wiggler divers. green & yellow. new",Shop for the best Sun Squad 2 Pack Squid LIGHT UP: 2 Pack Wiggler Divers. Green & Yellow. New at Pay4more. High-quality sun squad 2 pack squid light up: 2 pack wiggler divers. green & yellow. new available with fast shipping. Order now!
VR Headset Homido V2 for iPhone and Android,P00393,"VR Headset Homido V2 for iPhone and Android - Video Games,Smartphones & Accessories",Buy VR Headset Homido V2 for iPhone and Android Online | Pay4more,"VR Headset Homido V2 for iPhone and Android, Video Games,Smartphones & Accessories, buy vr headset homido v2 for iphone and android",Shop for the best VR Headset Homido V2 for iPhone and Android at Pay4more. High-quality vr headset homido v2 for iphone and android available with fast shipping. Order now!
NECA - Elvira - Body Knocker,P00394,NECA - Elvira - Body Knocker - Collectible Toys,Buy NECA - Elvira - Body Knocker Online | Pay4more,"NECA - Elvira - Body Knocker, Collectible Toys, buy neca - elvira - body knocker",Shop for the best NECA - Elvira - Body Knocker at Pay4more. High-quality neca - elvira - body knocker available with fast shipping. Order now!
"Classic SONIC The Hedgehog 2.5"" Inch Mini Action Figure Jakks Pacific 40687",P00395,"Classic SONIC The Hedgehog 2.5"" Inch Mini Action Figure Jakks Pacific 40687 - Collectible Toys","Buy Classic SONIC The Hedgehog 2.5"" Inch Mini Action Figure Jakks Pacific 40687 Online | Pay4more","Classic SONIC The Hedgehog 2.5"" Inch Mini Action Figure Jakks Pacific 40687, Collectible Toys, buy classic sonic the hedgehog 2.5"" inch mini action figure jakks pacific 40687","Shop for the best Classic SONIC The Hedgehog 2.5"" Inch Mini Action Figure Jakks Pacific 40687 at Pay4more. High-quality classic sonic the hedgehog 2.5"" inch mini action figure jakks pacific 40687 available with fast shipping. Order now!"
YuMe Marvel Spiderman Attack Series,P00396,YuMe Marvel Spiderman Attack Series - Collectible Toys,Buy YuMe Marvel Spiderman Attack Series Online | Pay4more,"YuMe Marvel Spiderman Attack Series, Collectible Toys, buy yume marvel spiderman attack series",Shop for the best YuMe Marvel Spiderman Attack Series at Pay4more. High-quality yume marvel spiderman attack series available with fast shipping. Order now!
Playground Turquoise Blue Metal School Mini Locker ,P00397,Playground Turquoise Blue Metal School Mini Locker  - Computer Accessories,Buy Playground Turquoise Blue Metal School Mini Locker  Online | Pay4more,"Playground Turquoise Blue Metal School Mini Locker , Computer Accessories, buy playground turquoise blue metal school mini locker ",Shop for the best Playground Turquoise Blue Metal School Mini Locker  at Pay4more. High-quality playground turquoise blue metal school mini locker  available with fast shipping. Order now!
The Marvels - Dar-Benn Pop! Vinyl Figure,P00398,The Marvels - Dar-Benn Pop! Vinyl Figure - Collectible Toys,Buy The Marvels - Dar-Benn Pop! Vinyl Figure Online | Pay4more,"The Marvels - Dar-Benn Pop! Vinyl Figure, Collectible Toys, buy the marvels - dar-benn pop! vinyl figure",Shop for the best The Marvels - Dar-Benn Pop! Vinyl Figure at Pay4more. High-quality the marvels - dar-benn pop! vinyl figure available with fast shipping. Order now!
NECA - Toony Terrors ,P00399,NECA - Toony Terrors  - Collectible Toys,Buy NECA - Toony Terrors  Online | Pay4more,"NECA - Toony Terrors , Collectible Toys, buy neca - toony terrors ",Shop for the best NECA - Toony Terrors  at Pay4more. High-quality neca - toony terrors  available with fast shipping. Order now!
"Monster Jam Zombie, Series 33",P00400,"Monster Jam Zombie, Series 33 - Collectible Toys,Toys & Games","Buy Monster Jam Zombie, Series 33 Online | Pay4more","Monster Jam Zombie, Series 33, Collectible Toys,Toys & Games, buy monster jam zombie, series 33","Shop for the best Monster Jam Zombie, Series 33 at Pay4more. High-quality monster jam zombie, series 33 available with fast shipping. Order now!"
