Original Product Name,SKU,Product Title,SEO Title,Focus Keywords,SEO Meta Description
"Logitech Combo Touch iPad Pro 12.9-inch (5th, 6th gen - 2021, 2022) Keyboard Case - Detachable Backlit Keyboard with Kickstand, Click-Anywhere Trackpad, Smart Connector - Oxford Gray; USA Layout",A00982,"Logitech Combo Touch iPad Pro 12.9-inch (5th, 6th gen - 2021, 2022) Keyboard Case - Detachable Backlit Keyboard with Kickstand, Click-Anywhere Trackpad, Smart Connector - Oxford Gray; USA Layout - Computer Accessories","Buy Logitech Combo Touch iPad Pro 12.9-inch (5th, 6th gen - 2021, 2022) Keyboard Case - Detachable Backlit Keyboard with Kickstand, Click-Anywhere Trackpad, Smart Connector - Oxford Gray; USA Layout Online | Pay4more","Logitech Combo Touch iPad Pro 12.9-inch (5th, 6th gen - 2021, 2022) Keyboard Case - Detachable Backlit Keyboard with Kickstand, Click-Anywhere Trackpad, Smart Connector - Oxford Gray; USA Layout, Computer Accessories, buy logitech combo touch ipad pro 12.9-inch (5th, 6th gen - 2021, 2022) keyboard case - detachable backlit keyboard with kickstand, click-anywhere trackpad, smart connector - oxford gray; usa layout","Shop for the best Logitech Combo Touch iPad Pro 12.9-inch (5th, 6th gen - 2021, 2022) Keyboard Case - Detachable Backlit Keyboard with Kickstand, Click-Anywhere Trackpad, Smart Connector - Oxford Gray; USA Layout at Pay4more. High-quality logitech combo touch ipad pro 12.9-inch (5th, 6th gen - 2021, 2022) keyboard case - detachable backlit keyboard with kickstand, click-anywhere trackpad, smart connector - oxford gray; usa layout available with fast shipping. Order now!"
"CRAFTSMAN Pocket Laser Distance Measurer 55-ft
",A00984,"CRAFTSMAN Pocket Laser Distance Measurer 55-ft
 - Construction Hardware","Buy CRAFTSMAN Pocket Laser Distance Measurer 55-ft
 Online | Pay4more","CRAFTSMAN Pocket Laser Distance Measurer 55-ft
, Construction Hardware, buy craftsman pocket laser distance measurer 55-ft
","Shop for the best CRAFTSMAN Pocket Laser Distance Measurer 55-ft
 at Pay4more. High-quality craftsman pocket laser distance measurer 55-ft
 available with fast shipping. Order now!"
Hampton Bay Edson 30-inch W x 30-inch H x 12.5-inch D Shaker Style Assembled Kitchen Wall Ca,P00001,"Hampton Bay Edson 30-inch W x 30-inch H x 12.5-inch D Shaker Style Assembled Kitchen Wall Ca - Kitchen & Bath,Cabinets",Buy Hampton Bay Edson 30-inch W x 30-inch H x 12.5-inch D Shaker Style Assembled Kitchen Wall Ca Online | Pay4more,"Hampton Bay Edson 30-inch W x 30-inch H x 12.5-inch D Shaker Style Assembled Kitchen Wall Ca, Kitchen & Bath,Cabinets, buy hampton bay edson 30-inch w x 30-inch h x 12.5-inch d shaker style assembled kitchen wall ca",Shop for the best Hampton Bay Edson 30-inch W x 30-inch H x 12.5-inch D Shaker Style Assembled Kitchen Wall Ca at Pay4more. High-quality hampton bay edson 30-inch w x 30-inch h x 12.5-inch d shaker style assembled kitchen wall ca available with fast shipping. Order now!
Hisense 30 inch W 21 cu. Ft French door Refrigerator,P00002,Hisense 30 inch W 21 cu. Ft French door Refrigerator - Kitchen Appliances,Buy Hisense 30 inch W 21 cu. Ft French door Refrigerator Online | Pay4more,"Hisense 30 inch W 21 cu. Ft French door Refrigerator, Kitchen Appliances, buy hisense 30 inch w 21 cu. ft french door refrigerator",Shop for the best Hisense 30 inch W 21 cu. Ft French door Refrigerator at Pay4more. High-quality hisense 30 inch w 21 cu. ft french door refrigerator available with fast shipping. Order now!
Unique Appliances Off-Grid 24-inch 6 cu. ft. Propane Top Freezer Counter Depth Refrigerator with,P00003,"Unique Appliances Off-Grid 24-inch 6 cu. ft. Propane Top Freezer Counter Depth Refrigerator with - Outdoor Recreation,Kitchen Appliances",Buy Unique Appliances Off-Grid 24-inch 6 cu. ft. Propane Top Freezer Counter Depth Refrigerator with Online | Pay4more,"Unique Appliances Off-Grid 24-inch 6 cu. ft. Propane Top Freezer Counter Depth Refrigerator with, Outdoor Recreation,Kitchen Appliances, buy unique appliances off-grid 24-inch 6 cu. ft. propane top freezer counter depth refrigerator with",Shop for the best Unique Appliances Off-Grid 24-inch 6 cu. ft. Propane Top Freezer Counter Depth Refrigerator with at Pay4more. High-quality unique appliances off-grid 24-inch 6 cu. ft. propane top freezer counter depth refrigerator with available with fast shipping. Order now!
Baxton Studio Landis Dresser in Ash Walnut and Gold,P00004,Baxton Studio Landis Dresser in Ash Walnut and Gold - Living Room,Buy Baxton Studio Landis Dresser in Ash Walnut and Gold Online | Pay4more,"Baxton Studio Landis Dresser in Ash Walnut and Gold, Living Room, buy baxton studio landis dresser in ash walnut and gold",Shop for the best Baxton Studio Landis Dresser in Ash Walnut and Gold at Pay4more. High-quality baxton studio landis dresser in ash walnut and gold available with fast shipping. Order now!
Laurel Foundry Modern Farmhouse Dash Solid Wood Coffee Table with Storage,P00006,Laurel Foundry Modern Farmhouse Dash Solid Wood Coffee Table with Storage - Living Room,Buy Laurel Foundry Modern Farmhouse Dash Solid Wood Coffee Table with Storage Online | Pay4more,"Laurel Foundry Modern Farmhouse Dash Solid Wood Coffee Table with Storage, Living Room, buy laurel foundry modern farmhouse dash solid wood coffee table with storage",Shop for the best Laurel Foundry Modern Farmhouse Dash Solid Wood Coffee Table with Storage at Pay4more. High-quality laurel foundry modern farmhouse dash solid wood coffee table with storage available with fast shipping. Order now!
"Husky Heavy-Duty 61"" W x 23"" D 10-Drawer Mobile Workbench with Flip-Up Pegboard - Matte Black",P00007,"Husky Heavy-Duty 61"" W x 23"" D 10-Drawer Mobile Workbench with Flip-Up Pegboard - Matte Black - Tools & Accessories","Buy Husky Heavy-Duty 61"" W x 23"" D 10-Drawer Mobile Workbench with Flip-Up Pegboard - Matte Black Online | Pay4more","Husky Heavy-Duty 61"" W x 23"" D 10-Drawer Mobile Workbench with Flip-Up Pegboard - Matte Black, Tools & Accessories, buy husky heavy-duty 61"" w x 23"" d 10-drawer mobile workbench with flip-up pegboard - matte black","Shop for the best Husky Heavy-Duty 61"" W x 23"" D 10-Drawer Mobile Workbench with Flip-Up Pegboard - Matte Black at Pay4more. High-quality husky heavy-duty 61"" w x 23"" d 10-drawer mobile workbench with flip-up pegboard - matte black available with fast shipping. Order now!"
"Husky Heavy-Duty 52"" W x 20"" D 15-Drawer Tool Storage Chest and Cabinet Combo - Matte Black",P00008,"Husky Heavy-Duty 52"" W x 20"" D 15-Drawer Tool Storage Chest and Cabinet Combo - Matte Black - Tools & Accessories","Buy Husky Heavy-Duty 52"" W x 20"" D 15-Drawer Tool Storage Chest and Cabinet Combo - Matte Black Online | Pay4more","Husky Heavy-Duty 52"" W x 20"" D 15-Drawer Tool Storage Chest and Cabinet Combo - Matte Black, Tools & Accessories, buy husky heavy-duty 52"" w x 20"" d 15-drawer tool storage chest and cabinet combo - matte black","Shop for the best Husky Heavy-Duty 52"" W x 20"" D 15-Drawer Tool Storage Chest and Cabinet Combo - Matte Black at Pay4more. High-quality husky heavy-duty 52"" w x 20"" d 15-drawer tool storage chest and cabinet combo - matte black available with fast shipping. Order now!"
"Husky Standard-Duty 52"" W x 18"" D 9-Drawer Mobile Workbench with Solid Wood Top - Gloss Gray",P00009,"Husky Standard-Duty 52"" W x 18"" D 9-Drawer Mobile Workbench with Solid Wood Top - Gloss Gray - Tools & Accessories","Buy Husky Standard-Duty 52"" W x 18"" D 9-Drawer Mobile Workbench with Solid Wood Top - Gloss Gray Online | Pay4more","Husky Standard-Duty 52"" W x 18"" D 9-Drawer Mobile Workbench with Solid Wood Top - Gloss Gray, Tools & Accessories, buy husky standard-duty 52"" w x 18"" d 9-drawer mobile workbench with solid wood top - gloss gray","Shop for the best Husky Standard-Duty 52"" W x 18"" D 9-Drawer Mobile Workbench with Solid Wood Top - Gloss Gray at Pay4more. High-quality husky standard-duty 52"" w x 18"" d 9-drawer mobile workbench with solid wood top - gloss gray available with fast shipping. Order now!"
"LG 10,000 BTU SACC (14,000 BTU ASHRAE) Dual Inverter Smart Wi-Fi Portable Air Conditioner - White",P00010,"LG 10,000 BTU SACC (14,000 BTU ASHRAE) Dual Inverter Smart Wi-Fi Portable Air Conditioner - White - Kitchen Appliances","Buy LG 10,000 BTU SACC (14,000 BTU ASHRAE) Dual Inverter Smart Wi-Fi Portable Air Conditioner - White Online | Pay4more","LG 10,000 BTU SACC (14,000 BTU ASHRAE) Dual Inverter Smart Wi-Fi Portable Air Conditioner - White, Kitchen Appliances, buy lg 10,000 btu sacc (14,000 btu ashrae) dual inverter smart wi-fi portable air conditioner - white","Shop for the best LG 10,000 BTU SACC (14,000 BTU ASHRAE) Dual Inverter Smart Wi-Fi Portable Air Conditioner - White at Pay4more. High-quality lg 10,000 btu sacc (14,000 btu ashrae) dual inverter smart wi-fi portable air conditioner - white available with fast shipping. Order now!"
Hampton Bay Dearstone 4-Piece All-Weather Wicker Patio Conversation Set with CushionGuard Beige Cushions,P00011,Hampton Bay Dearstone 4-Piece All-Weather Wicker Patio Conversation Set with CushionGuard Beige Cushions - Outdoor Furniture,Buy Hampton Bay Dearstone 4-Piece All-Weather Wicker Patio Conversation Set with CushionGuard Beige Cushions Online | Pay4more,"Hampton Bay Dearstone 4-Piece All-Weather Wicker Patio Conversation Set with CushionGuard Beige Cushions, Outdoor Furniture, buy hampton bay dearstone 4-piece all-weather wicker patio conversation set with cushionguard beige cushions",Shop for the best Hampton Bay Dearstone 4-Piece All-Weather Wicker Patio Conversation Set with CushionGuard Beige Cushions at Pay4more. High-quality hampton bay dearstone 4-piece all-weather wicker patio conversation set with cushionguard beige cushions available with fast shipping. Order now!
Hampton Bay Harmony Hill 3-Piece Black Steel Outdoor Patio Sectional Sofa with CushionGuard Almond Biscotti Cushions,P00012,Hampton Bay Harmony Hill 3-Piece Black Steel Outdoor Patio Sectional Sofa with CushionGuard Almond Biscotti Cushions - Outdoor Furniture,Buy Hampton Bay Harmony Hill 3-Piece Black Steel Outdoor Patio Sectional Sofa with CushionGuard Almond Biscotti Cushions Online | Pay4more,"Hampton Bay Harmony Hill 3-Piece Black Steel Outdoor Patio Sectional Sofa with CushionGuard Almond Biscotti Cushions, Outdoor Furniture, buy hampton bay harmony hill 3-piece black steel outdoor patio sectional sofa with cushionguard almond biscotti cushions",Shop for the best Hampton Bay Harmony Hill 3-Piece Black Steel Outdoor Patio Sectional Sofa with CushionGuard Almond Biscotti Cushions at Pay4more. High-quality hampton bay harmony hill 3-piece black steel outdoor patio sectional sofa with cushionguard almond biscotti cushions available with fast shipping. Order now!
Hampton Bay Ellington 4-Piece Steel Outdoor Patio Seating Set with CushionGuard Malachite Green Cushions,P00013,"Hampton Bay Ellington 4-Piece Steel Outdoor Patio Seating Set with CushionGuard Malachite Green Cushions - Outdoor & Garden,Outdoor Furniture,Apparel & Accessories",Buy Hampton Bay Ellington 4-Piece Steel Outdoor Patio Seating Set with CushionGuard Malachite Green Cushions Online | Pay4more,"Hampton Bay Ellington 4-Piece Steel Outdoor Patio Seating Set with CushionGuard Malachite Green Cushions, Outdoor & Garden,Outdoor Furniture,Apparel & Accessories, buy hampton bay ellington 4-piece steel outdoor patio seating set with cushionguard malachite green cushions",Shop for the best Hampton Bay Ellington 4-Piece Steel Outdoor Patio Seating Set with CushionGuard Malachite Green Cushions at Pay4more. High-quality hampton bay ellington 4-piece steel outdoor patio seating set with cushionguard malachite green cushions available with fast shipping. Order now!
AirPods Pro ,P00014,AirPods Pro  - Audio,Buy AirPods Pro  Online | Pay4more,"AirPods Pro , Audio, buy airpods pro ",Shop for the best AirPods Pro  at Pay4more. High-quality airpods pro  available with fast shipping. Order now!
GoPro HERO11 Black 5.7K UHD Action Camera,P00015,GoPro HERO11 Black 5.7K UHD Action Camera - Cameras & Photography,Buy GoPro HERO11 Black 5.7K UHD Action Camera Online | Pay4more,"GoPro HERO11 Black 5.7K UHD Action Camera, Cameras & Photography, buy gopro hero11 black 5.7k uhd action camera",Shop for the best GoPro HERO11 Black 5.7K UHD Action Camera at Pay4more. High-quality gopro hero11 black 5.7k uhd action camera available with fast shipping. Order now!
Bose SoundLink Flex Portable Bluetooth Speaker Waterproof Limited Edition Lilac,P00016,Bose SoundLink Flex Portable Bluetooth Speaker Waterproof Limited Edition Lilac - Audio,Buy Bose SoundLink Flex Portable Bluetooth Speaker Waterproof Limited Edition Lilac Online | Pay4more,"Bose SoundLink Flex Portable Bluetooth Speaker Waterproof Limited Edition Lilac, Audio, buy bose soundlink flex portable bluetooth speaker waterproof limited edition lilac",Shop for the best Bose SoundLink Flex Portable Bluetooth Speaker Waterproof Limited Edition Lilac at Pay4more. High-quality bose soundlink flex portable bluetooth speaker waterproof limited edition lilac available with fast shipping. Order now!
Milwaukee Tool 18V M18 Lithium-Ion Battery PACKOUT 6-Port Rapid Charger,P00017,Milwaukee Tool 18V M18 Lithium-Ion Battery PACKOUT 6-Port Rapid Charger - Power Tools,Buy Milwaukee Tool 18V M18 Lithium-Ion Battery PACKOUT 6-Port Rapid Charger Online | Pay4more,"Milwaukee Tool 18V M18 Lithium-Ion Battery PACKOUT 6-Port Rapid Charger, Power Tools, buy milwaukee tool 18v m18 lithium-ion battery packout 6-port rapid charger",Shop for the best Milwaukee Tool 18V M18 Lithium-Ion Battery PACKOUT 6-Port Rapid Charger at Pay4more. High-quality milwaukee tool 18v m18 lithium-ion battery packout 6-port rapid charger available with fast shipping. Order now!
Google Nest Learning Thermostat (4th gen) in Polished Gold,P00018,Google Nest Learning Thermostat (4th gen) in Polished Gold - Smart Thermostats & Climate Control,Buy Google Nest Learning Thermostat (4th gen) in Polished Gold Online | Pay4more,"Google Nest Learning Thermostat (4th gen) in Polished Gold, Smart Thermostats & Climate Control, buy google nest learning thermostat (4th gen) in polished gold",Shop for the best Google Nest Learning Thermostat (4th gen) in Polished Gold at Pay4more. High-quality google nest learning thermostat (4th gen) in polished gold available with fast shipping. Order now!
Deep Tissue Massager Variable Therapy Sharper Image Power Percussion,P00019,Deep Tissue Massager Variable Therapy Sharper Image Power Percussion - Personal Care,Buy Deep Tissue Massager Variable Therapy Sharper Image Power Percussion Online | Pay4more,"Deep Tissue Massager Variable Therapy Sharper Image Power Percussion, Personal Care, buy deep tissue massager variable therapy sharper image power percussion",Shop for the best Deep Tissue Massager Variable Therapy Sharper Image Power Percussion at Pay4more. High-quality deep tissue massager variable therapy sharper image power percussion available with fast shipping. Order now!
"LEGO Sonic The Hedgehog: Super Sonic vs. Egg Drillster Gaming Toy with Shadow and Dr. Eggman, Super Sonic Toy Building Set (76999)",P00020,"LEGO Sonic The Hedgehog: Super Sonic vs. Egg Drillster Gaming Toy with Shadow and Dr. Eggman, Super Sonic Toy Building Set (76999) - Building Toys","Buy LEGO Sonic The Hedgehog: Super Sonic vs. Egg Drillster Gaming Toy with Shadow and Dr. Eggman, Super Sonic Toy Building Set (76999) Online | Pay4more","LEGO Sonic The Hedgehog: Super Sonic vs. Egg Drillster Gaming Toy with Shadow and Dr. Eggman, Super Sonic Toy Building Set (76999), Building Toys, buy lego sonic the hedgehog: super sonic vs. egg drillster gaming toy with shadow and dr. eggman, super sonic toy building set (76999)","Shop for the best LEGO Sonic The Hedgehog: Super Sonic vs. Egg Drillster Gaming Toy with Shadow and Dr. Eggman, Super Sonic Toy Building Set (76999) at Pay4more. High-quality lego sonic the hedgehog: super sonic vs. egg drillster gaming toy with shadow and dr. eggman, super sonic toy building set (76999) available with fast shipping. Order now!"
12 Cup Programmable Coffee Maker Gray – Figmint™,P00021,12 Cup Programmable Coffee Maker Gray – Figmint™ - Kitchen Appliances,Buy 12 Cup Programmable Coffee Maker Gray – Figmint™ Online | Pay4more,"12 Cup Programmable Coffee Maker Gray – Figmint™, Kitchen Appliances, buy 12 cup programmable coffee maker gray – figmint™",Shop for the best 12 Cup Programmable Coffee Maker Gray – Figmint™ at Pay4more. High-quality 12 cup programmable coffee maker gray – figmint™ available with fast shipping. Order now!
Ninja SLUSHi 72 oz 3 Programs Professional Frozen Drink Maker FS300,P00022,Ninja SLUSHi 72 oz 3 Programs Professional Frozen Drink Maker FS300 - Kitchen Appliances,Buy Ninja SLUSHi 72 oz 3 Programs Professional Frozen Drink Maker FS300 Online | Pay4more,"Ninja SLUSHi 72 oz 3 Programs Professional Frozen Drink Maker FS300, Kitchen Appliances, buy ninja slushi 72 oz 3 programs professional frozen drink maker fs300",Shop for the best Ninja SLUSHi 72 oz 3 Programs Professional Frozen Drink Maker FS300 at Pay4more. High-quality ninja slushi 72 oz 3 programs professional frozen drink maker fs300 available with fast shipping. Order now!
"HP DeskJet 2855e All-in-One Inkjet Printer, Color Mobile Print, Copy, Scan Up to",P00024,"HP DeskJet 2855e All-in-One Inkjet Printer, Color Mobile Print, Copy, Scan Up to - Printers & Scanners","Buy HP DeskJet 2855e All-in-One Inkjet Printer, Color Mobile Print, Copy, Scan Up to Online | Pay4more","HP DeskJet 2855e All-in-One Inkjet Printer, Color Mobile Print, Copy, Scan Up to, Printers & Scanners, buy hp deskjet 2855e all-in-one inkjet printer, color mobile print, copy, scan up to","Shop for the best HP DeskJet 2855e All-in-One Inkjet Printer, Color Mobile Print, Copy, Scan Up to at Pay4more. High-quality hp deskjet 2855e all-in-one inkjet printer, color mobile print, copy, scan up to available with fast shipping. Order now!"
"Keurig K-Mini Go, Violet, Multicup Reservoir Single-Serve K-Cup Pod",P00025,"Keurig K-Mini Go, Violet, Multicup Reservoir Single-Serve K-Cup Pod - Kitchen Appliances","Buy Keurig K-Mini Go, Violet, Multicup Reservoir Single-Serve K-Cup Pod Online | Pay4more","Keurig K-Mini Go, Violet, Multicup Reservoir Single-Serve K-Cup Pod, Kitchen Appliances, buy keurig k-mini go, violet, multicup reservoir single-serve k-cup pod","Shop for the best Keurig K-Mini Go, Violet, Multicup Reservoir Single-Serve K-Cup Pod at Pay4more. High-quality keurig k-mini go, violet, multicup reservoir single-serve k-cup pod available with fast shipping. Order now!"
Tiki Brand Convertible Torch Multi Useage,P00026,Tiki Brand Convertible Torch Multi Useage - Outdoor Lighting,Buy Tiki Brand Convertible Torch Multi Useage Online | Pay4more,"Tiki Brand Convertible Torch Multi Useage, Outdoor Lighting, buy tiki brand convertible torch multi useage",Shop for the best Tiki Brand Convertible Torch Multi Useage at Pay4more. High-quality tiki brand convertible torch multi useage available with fast shipping. Order now!
Farini Dining Chair Set of 2,P00027,Farini Dining Chair Set of 2 - Dining Room,Buy Farini Dining Chair Set of 2 Online | Pay4more,"Farini Dining Chair Set of 2, Dining Room, buy farini dining chair set of 2",Shop for the best Farini Dining Chair Set of 2 at Pay4more. High-quality farini dining chair set of 2 available with fast shipping. Order now!
Blue Tumbler w/Snack Bowl 31.55oz,P00028,Blue Tumbler w/Snack Bowl 31.55oz - Kitchen & Dining,Buy Blue Tumbler w/Snack Bowl 31.55oz Online | Pay4more,"Blue Tumbler w/Snack Bowl 31.55oz, Kitchen & Dining, buy blue tumbler w/snack bowl 31.55oz",Shop for the best Blue Tumbler w/Snack Bowl 31.55oz at Pay4more. High-quality blue tumbler w/snack bowl 31.55oz available with fast shipping. Order now!
"5-Section Serving Platter Set Light Gray - Room Essentials™ Recycled Plastic, Microwave & Dishwasher Safe",P00029,"5-Section Serving Platter Set Light Gray - Room Essentials™ Recycled Plastic, Microwave & Dishwasher Safe - Dinnerware","Buy 5-Section Serving Platter Set Light Gray - Room Essentials™ Recycled Plastic, Microwave & Dishwasher Safe Online | Pay4more","5-Section Serving Platter Set Light Gray - Room Essentials™ Recycled Plastic, Microwave & Dishwasher Safe, Dinnerware, buy 5-section serving platter set light gray - room essentials™ recycled plastic, microwave & dishwasher safe","Shop for the best 5-Section Serving Platter Set Light Gray - Room Essentials™ Recycled Plastic, Microwave & Dishwasher Safe at Pay4more. High-quality 5-section serving platter set light gray - room essentials™ recycled plastic, microwave & dishwasher safe available with fast shipping. Order now!"
Home Decorators Collection 72-inch Ellia Vanity in White,P00030,Home Decorators Collection 72-inch Ellia Vanity in White - Kitchen & Bath,Buy Home Decorators Collection 72-inch Ellia Vanity in White Online | Pay4more,"Home Decorators Collection 72-inch Ellia Vanity in White, Kitchen & Bath, buy home decorators collection 72-inch ellia vanity in white",Shop for the best Home Decorators Collection 72-inch Ellia Vanity in White at Pay4more. High-quality home decorators collection 72-inch ellia vanity in white available with fast shipping. Order now!
Bestier Bakers Rack,P00031,Bestier Bakers Rack - Kitchen & Dining,Buy Bestier Bakers Rack Online | Pay4more,"Bestier Bakers Rack, Kitchen & Dining, buy bestier bakers rack",Shop for the best Bestier Bakers Rack at Pay4more. High-quality bestier bakers rack available with fast shipping. Order now!
"Signature Sleep Signature Sleep Queen Wall Bed, Ivory Oak",P00032,"Signature Sleep Signature Sleep Queen Wall Bed, Ivory Oak - Bedroom","Buy Signature Sleep Signature Sleep Queen Wall Bed, Ivory Oak Online | Pay4more","Signature Sleep Signature Sleep Queen Wall Bed, Ivory Oak, Bedroom, buy signature sleep signature sleep queen wall bed, ivory oak","Shop for the best Signature Sleep Signature Sleep Queen Wall Bed, Ivory Oak at Pay4more. High-quality signature sleep signature sleep queen wall bed, ivory oak available with fast shipping. Order now!"
Evolve Satin Edge Pocket Bonnet,P00033,Evolve Satin Edge Pocket Bonnet - Hair Care,Buy Evolve Satin Edge Pocket Bonnet Online | Pay4more,"Evolve Satin Edge Pocket Bonnet, Hair Care, buy evolve satin edge pocket bonnet",Shop for the best Evolve Satin Edge Pocket Bonnet at Pay4more. High-quality evolve satin edge pocket bonnet available with fast shipping. Order now!
"Tangle Teezer Ultimate Detangler Brush for Wet & Dry Hair, Eliminates Knots & Reduces Breakage for All Hair Types, Millennial Pink",P00034,"Tangle Teezer Ultimate Detangler Brush for Wet & Dry Hair, Eliminates Knots & Reduces Breakage for All Hair Types, Millennial Pink - Hair Care","Buy Tangle Teezer Ultimate Detangler Brush for Wet & Dry Hair, Eliminates Knots & Reduces Breakage for All Hair Types, Millennial Pink Online | Pay4more","Tangle Teezer Ultimate Detangler Brush for Wet & Dry Hair, Eliminates Knots & Reduces Breakage for All Hair Types, Millennial Pink, Hair Care, buy tangle teezer ultimate detangler brush for wet & dry hair, eliminates knots & reduces breakage for all hair types, millennial pink","Shop for the best Tangle Teezer Ultimate Detangler Brush for Wet & Dry Hair, Eliminates Knots & Reduces Breakage for All Hair Types, Millennial Pink at Pay4more. High-quality tangle teezer ultimate detangler brush for wet & dry hair, eliminates knots & reduces breakage for all hair types, millennial pink available with fast shipping. Order now!"
"Tangle Teezer Ultimate Detangler Brush for Wet & Dry Hair, Eliminates Knots & Reduces Breakage for All Hair Types, Baby Pink & Mint",P00035,"Tangle Teezer Ultimate Detangler Brush for Wet & Dry Hair, Eliminates Knots & Reduces Breakage for All Hair Types, Baby Pink & Mint - Hair Care","Buy Tangle Teezer Ultimate Detangler Brush for Wet & Dry Hair, Eliminates Knots & Reduces Breakage for All Hair Types, Baby Pink & Mint Online | Pay4more","Tangle Teezer Ultimate Detangler Brush for Wet & Dry Hair, Eliminates Knots & Reduces Breakage for All Hair Types, Baby Pink & Mint, Hair Care, buy tangle teezer ultimate detangler brush for wet & dry hair, eliminates knots & reduces breakage for all hair types, baby pink & mint","Shop for the best Tangle Teezer Ultimate Detangler Brush for Wet & Dry Hair, Eliminates Knots & Reduces Breakage for All Hair Types, Baby Pink & Mint at Pay4more. High-quality tangle teezer ultimate detangler brush for wet & dry hair, eliminates knots & reduces breakage for all hair types, baby pink & mint available with fast shipping. Order now!"
"Firstline Firstline evolve fuchsia satin wide edge bonnet, Pink",P00037,"Firstline Firstline evolve fuchsia satin wide edge bonnet, Pink - Hair Care","Buy Firstline Firstline evolve fuchsia satin wide edge bonnet, Pink Online | Pay4more","Firstline Firstline evolve fuchsia satin wide edge bonnet, Pink, Hair Care, buy firstline firstline evolve fuchsia satin wide edge bonnet, pink","Shop for the best Firstline Firstline evolve fuchsia satin wide edge bonnet, Pink at Pay4more. High-quality firstline firstline evolve fuchsia satin wide edge bonnet, pink available with fast shipping. Order now!"
Room Essentials Silicone Novelty Ice Cube Tray with Lid ,P00038,Room Essentials Silicone Novelty Ice Cube Tray with Lid  - Kitchen & Dining,Buy Room Essentials Silicone Novelty Ice Cube Tray with Lid  Online | Pay4more,"Room Essentials Silicone Novelty Ice Cube Tray with Lid , Kitchen & Dining, buy room essentials silicone novelty ice cube tray with lid ",Shop for the best Room Essentials Silicone Novelty Ice Cube Tray with Lid  at Pay4more. High-quality room essentials silicone novelty ice cube tray with lid  available with fast shipping. Order now!
