Original Product Name,SKU,Product Title,SEO Title,Focus Keywords,SEO Meta Description
"Apple Magic Keyboard for 12.9-inch iPad Pro 5th 6th Gen, iPad Air 13"" NEW SEALED",P00169,"Apple Magic Keyboard for 12.9-inch iPad Pro 5th 6th Gen, iPad Air 13"" NEW SEALED - Computer Accessories","Buy Apple Magic Keyboard for 12.9-inch iPad Pro 5th 6th Gen, iPad Air 13"" NEW SEALED Online | Pay4more","Apple Magic Keyboard for 12.9-inch iPad Pro 5th 6th Gen, iPad Air 13"" NEW SEALED, Computer Accessories, buy apple magic keyboard for 12.9-inch ipad pro 5th 6th gen, ipad air 13"" new sealed","Shop for the best Apple Magic Keyboard for 12.9-inch iPad Pro 5th 6th Gen, iPad Air 13"" NEW SEALED at Pay4more. High-quality apple magic keyboard for 12.9-inch ipad pro 5th 6th gen, ipad air 13"" new sealed available with fast shipping. Order now!"
"Geeni Freebird Wireless Indoor/Outdoor WiFi Security Camera, Rechargeable Battery-Powered Home Security Camera, 1080P Night Vision/Waterproof, Motion Detection, 2-Way Audio, Works with Alexa (1 Pack)",P00170,"Geeni Freebird Wireless Indoor/Outdoor WiFi Security Camera, Rechargeable Battery-Powered Home Security Camera, 1080P Night Vision/Waterproof, Motion Detection, 2-Way Audio, Works with Alexa (1 Pack) - Electronics","Buy Geeni Freebird Wireless Indoor/Outdoor WiFi Security Camera, Rechargeable Battery-Powered Home Security Camera, 1080P Night Vision/Waterproof, Motion Detection, 2-Way Audio, Works with Alexa (1 Pack) Online | Pay4more","Geeni Freebird Wireless Indoor/Outdoor WiFi Security Camera, Rechargeable Battery-Powered Home Security Camera, 1080P Night Vision/Waterproof, Motion Detection, 2-Way Audio, Works with Alexa (1 Pack), Electronics, buy geeni freebird wireless indoor/outdoor wifi security camera, rechargeable battery-powered home security camera, 1080p night vision/waterproof, motion detection, 2-way audio, works with alexa (1 pack)","Shop for the best Geeni Freebird Wireless Indoor/Outdoor WiFi Security Camera, Rechargeable Battery-Powered Home Security Camera, 1080P Night Vision/Waterproof, Motion Detection, 2-Way Audio, Works with Alexa (1 Pack) at Pay4more. High-quality geeni freebird wireless indoor/outdoor wifi security camera, rechargeable battery-powered home security camera, 1080p night vision/waterproof, motion detection, 2-way audio, works with alexa (1 pack) available with fast shipping. Order now!"
"Marshall Motif True Wireless Noise Canceling Headphones, Black",P00171,"Marshall Motif True Wireless Noise Canceling Headphones, Black - Electronics","Buy Marshall Motif True Wireless Noise Canceling Headphones, Black Online | Pay4more","Marshall Motif True Wireless Noise Canceling Headphones, Black, Electronics, buy marshall motif true wireless noise canceling headphones, black","Shop for the best Marshall Motif True Wireless Noise Canceling Headphones, Black at Pay4more. High-quality marshall motif true wireless noise canceling headphones, black available with fast shipping. Order now!"
PetSafe 3 in 1 Dog Harness with Two Point Control Leash - Front D-Ring Helps Stop Pulling - Double-Ended Dog Leash Redirects Pulling - Self-Adjusting Padded Handle - Swivel Hardware Prevents Tangles,P00172,PetSafe 3 in 1 Dog Harness with Two Point Control Leash - Front D-Ring Helps Stop Pulling - Double-Ended Dog Leash Redirects Pulling - Self-Adjusting Padded Handle - Swivel Hardware Prevents Tangles - Pet Supplies,Buy PetSafe 3 in 1 Dog Harness with Two Point Control Leash - Front D-Ring Helps Stop Pulling - Double-Ended Dog Leash Redirects Pulling - Self-Adjusting Padded Handle - Swivel Hardware Prevents Tangles Online | Pay4more,"PetSafe 3 in 1 Dog Harness with Two Point Control Leash - Front D-Ring Helps Stop Pulling - Double-Ended Dog Leash Redirects Pulling - Self-Adjusting Padded Handle - Swivel Hardware Prevents Tangles, Pet Supplies, buy petsafe 3 in 1 dog harness with two point control leash - front d-ring helps stop pulling - double-ended dog leash redirects pulling - self-adjusting padded handle - swivel hardware prevents tangles",Shop for the best PetSafe 3 in 1 Dog Harness with Two Point Control Leash - Front D-Ring Helps Stop Pulling - Double-Ended Dog Leash Redirects Pulling - Self-Adjusting Padded Handle - Swivel Hardware Prevents Tangles at Pay4more. High-quality petsafe 3 in 1 dog harness with two point control leash - front d-ring helps stop pulling - double-ended dog leash redirects pulling - self-adjusting padded handle - swivel hardware prevents tangles available with fast shipping. Order now!
Rokinon 135mm F2.0 ED UMC Telephoto Lens for Canon Digital SLR Cameras,P00173,Rokinon 135mm F2.0 ED UMC Telephoto Lens for Canon Digital SLR Cameras - Cameras & Photography,Buy Rokinon 135mm F2.0 ED UMC Telephoto Lens for Canon Digital SLR Cameras Online | Pay4more,"Rokinon 135mm F2.0 ED UMC Telephoto Lens for Canon Digital SLR Cameras, Cameras & Photography, buy rokinon 135mm f2.0 ed umc telephoto lens for canon digital slr cameras",Shop for the best Rokinon 135mm F2.0 ED UMC Telephoto Lens for Canon Digital SLR Cameras at Pay4more. High-quality rokinon 135mm f2.0 ed umc telephoto lens for canon digital slr cameras available with fast shipping. Order now!
Anker USB C Docking Station,P00174,Anker USB C Docking Station - Computer Accessories,Buy Anker USB C Docking Station Online | Pay4more,"Anker USB C Docking Station, Computer Accessories, buy anker usb c docking station",Shop for the best Anker USB C Docking Station at Pay4more. High-quality anker usb c docking station available with fast shipping. Order now!
"NXT Technologies UC-5100 Speakerphone, Blk NX55446",P00175,"NXT Technologies UC-5100 Speakerphone, Blk NX55446 - Power Tools","Buy NXT Technologies UC-5100 Speakerphone, Blk NX55446 Online | Pay4more","NXT Technologies UC-5100 Speakerphone, Blk NX55446, Power Tools, buy nxt technologies uc-5100 speakerphone, blk nx55446","Shop for the best NXT Technologies UC-5100 Speakerphone, Blk NX55446 at Pay4more. High-quality nxt technologies uc-5100 speakerphone, blk nx55446 available with fast shipping. Order now!"
Ridgid18V 6.0Ah Battery,P00176,Ridgid18V 6.0Ah Battery - Power Tools,Buy Ridgid18V 6.0Ah Battery Online | Pay4more,"Ridgid18V 6.0Ah Battery, Power Tools, buy ridgid18v 6.0ah battery",Shop for the best Ridgid18V 6.0Ah Battery at Pay4more. High-quality ridgid18v 6.0ah battery available with fast shipping. Order now!
"CRAFTSMAN V20 Craftsman Battery, 9.0-Ah (CMCB209)",P00177,"CRAFTSMAN V20 Craftsman Battery, 9.0-Ah (CMCB209) - Pet Supplies","Buy CRAFTSMAN V20 Craftsman Battery, 9.0-Ah (CMCB209) Online | Pay4more","CRAFTSMAN V20 Craftsman Battery, 9.0-Ah (CMCB209), Pet Supplies, buy craftsman v20 craftsman battery, 9.0-ah (cmcb209)","Shop for the best CRAFTSMAN V20 Craftsman Battery, 9.0-Ah (CMCB209) at Pay4more. High-quality craftsman v20 craftsman battery, 9.0-ah (cmcb209) available with fast shipping. Order now!"
"Dog Bark Collar with 5 Adjustable Sensitivity, PB20 Automatic Anti Barking Training Collar for Dogs Fluorescent Green",P00178,"Dog Bark Collar with 5 Adjustable Sensitivity, PB20 Automatic Anti Barking Training Collar for Dogs Fluorescent Green - Electronics","Buy Dog Bark Collar with 5 Adjustable Sensitivity, PB20 Automatic Anti Barking Training Collar for Dogs Fluorescent Green Online | Pay4more","Dog Bark Collar with 5 Adjustable Sensitivity, PB20 Automatic Anti Barking Training Collar for Dogs Fluorescent Green, Electronics, buy dog bark collar with 5 adjustable sensitivity, pb20 automatic anti barking training collar for dogs fluorescent green","Shop for the best Dog Bark Collar with 5 Adjustable Sensitivity, PB20 Automatic Anti Barking Training Collar for Dogs Fluorescent Green at Pay4more. High-quality dog bark collar with 5 adjustable sensitivity, pb20 automatic anti barking training collar for dogs fluorescent green available with fast shipping. Order now!"
"Jawbone UP24 Wireless Activity and Sleep Tracking Wristband for iOS and Android Phones (Large, Onyx)",P00179,"Jawbone UP24 Wireless Activity and Sleep Tracking Wristband for iOS and Android Phones (Large, Onyx) - Sports & Outdoors","Buy Jawbone UP24 Wireless Activity and Sleep Tracking Wristband for iOS and Android Phones (Large, Onyx) Online | Pay4more","Jawbone UP24 Wireless Activity and Sleep Tracking Wristband for iOS and Android Phones (Large, Onyx), Sports & Outdoors, buy jawbone up24 wireless activity and sleep tracking wristband for ios and android phones (large, onyx)","Shop for the best Jawbone UP24 Wireless Activity and Sleep Tracking Wristband for iOS and Android Phones (Large, Onyx) at Pay4more. High-quality jawbone up24 wireless activity and sleep tracking wristband for ios and android phones (large, onyx) available with fast shipping. Order now!"
Speedo Fun Retro Dive Mask,P00180,Speedo Fun Retro Dive Mask - Electronics,Buy Speedo Fun Retro Dive Mask Online | Pay4more,"Speedo Fun Retro Dive Mask, Electronics, buy speedo fun retro dive mask",Shop for the best Speedo Fun Retro Dive Mask at Pay4more. High-quality speedo fun retro dive mask available with fast shipping. Order now!
"RCA RCR313BE Big Button Three-Device Universal Remote, Black",P00181,"RCA RCR313BE Big Button Three-Device Universal Remote, Black - Electronics","Buy RCA RCR313BE Big Button Three-Device Universal Remote, Black Online | Pay4more","RCA RCR313BE Big Button Three-Device Universal Remote, Black, Electronics, buy rca rcr313be big button three-device universal remote, black","Shop for the best RCA RCR313BE Big Button Three-Device Universal Remote, Black at Pay4more. High-quality rca rcr313be big button three-device universal remote, black available with fast shipping. Order now!"
WeTek Hub Android Box 4K,P00182,WeTek Hub Android Box 4K - Computer Accessories,Buy WeTek Hub Android Box 4K Online | Pay4more,"WeTek Hub Android Box 4K, Computer Accessories, buy wetek hub android box 4k",Shop for the best WeTek Hub Android Box 4K at Pay4more. High-quality wetek hub android box 4k available with fast shipping. Order now!
MIMOBOT USB Flash Drive Star Wars 4Gb C-3PO,P00183,MIMOBOT USB Flash Drive Star Wars 4Gb C-3PO - Toys & Games,Buy MIMOBOT USB Flash Drive Star Wars 4Gb C-3PO Online | Pay4more,"MIMOBOT USB Flash Drive Star Wars 4Gb C-3PO, Toys & Games, buy mimobot usb flash drive star wars 4gb c-3po",Shop for the best MIMOBOT USB Flash Drive Star Wars 4Gb C-3PO at Pay4more. High-quality mimobot usb flash drive star wars 4gb c-3po available with fast shipping. Order now!
LEGO Minifigures Series 26 Space Toy 71046,P00184,LEGO Minifigures Series 26 Space Toy 71046 - Building Toys,Buy LEGO Minifigures Series 26 Space Toy 71046 Online | Pay4more,"LEGO Minifigures Series 26 Space Toy 71046, Building Toys, buy lego minifigures series 26 space toy 71046",Shop for the best LEGO Minifigures Series 26 Space Toy 71046 at Pay4more. High-quality lego minifigures series 26 space toy 71046 available with fast shipping. Order now!
TERK Universal Remote Open,P00185,TERK Universal Remote Open - Computer Accessories,Buy TERK Universal Remote Open Online | Pay4more,"TERK Universal Remote Open, Computer Accessories, buy terk universal remote open",Shop for the best TERK Universal Remote Open at Pay4more. High-quality terk universal remote open available with fast shipping. Order now!
Mimoco 8GB flash driver,P00186,Mimoco 8GB flash driver - Computer Accessories,Buy Mimoco 8GB flash driver Online | Pay4more,"Mimoco 8GB flash driver, Computer Accessories, buy mimoco 8gb flash driver",Shop for the best Mimoco 8GB flash driver at Pay4more. High-quality mimoco 8gb flash driver available with fast shipping. Order now!
"Donner Headphone Amplifier DC 5V-1A, 3.5mm Rechargeable Portable in-Ear Monitor Amplifier with 8Ω to 250Ω Impedance, with 2 XLR and 1/4"" TRS Inputs",P00188,"Donner Headphone Amplifier DC 5V-1A, 3.5mm Rechargeable Portable in-Ear Monitor Amplifier with 8Ω to 250Ω Impedance, with 2 XLR and 1/4"" TRS Inputs - Electronics","Buy Donner Headphone Amplifier DC 5V-1A, 3.5mm Rechargeable Portable in-Ear Monitor Amplifier with 8Ω to 250Ω Impedance, with 2 XLR and 1/4"" TRS Inputs Online | Pay4more","Donner Headphone Amplifier DC 5V-1A, 3.5mm Rechargeable Portable in-Ear Monitor Amplifier with 8Ω to 250Ω Impedance, with 2 XLR and 1/4"" TRS Inputs, Electronics, buy donner headphone amplifier dc 5v-1a, 3.5mm rechargeable portable in-ear monitor amplifier with 8ω to 250ω impedance, with 2 xlr and 1/4"" trs inputs","Shop for the best Donner Headphone Amplifier DC 5V-1A, 3.5mm Rechargeable Portable in-Ear Monitor Amplifier with 8Ω to 250Ω Impedance, with 2 XLR and 1/4"" TRS Inputs at Pay4more. High-quality donner headphone amplifier dc 5v-1a, 3.5mm rechargeable portable in-ear monitor amplifier with 8ω to 250ω impedance, with 2 xlr and 1/4"" trs inputs available with fast shipping. Order now!"
"Jesebang Bluetooth In-Ear Headphones, Wireless Bluetooth 5.3, Ultralight Earphones with HD Microphone, Outstanding Sound Music Streaming up to 30 Hours, LED Display, IP7 Waterproof, White",P00189,"Jesebang Bluetooth In-Ear Headphones, Wireless Bluetooth 5.3, Ultralight Earphones with HD Microphone, Outstanding Sound Music Streaming up to 30 Hours, LED Display, IP7 Waterproof, White - Smartphones & Accessories","Buy Jesebang Bluetooth In-Ear Headphones, Wireless Bluetooth 5.3, Ultralight Earphones with HD Microphone, Outstanding Sound Music Streaming up to 30 Hours, LED Display, IP7 Waterproof, White Online | Pay4more","Jesebang Bluetooth In-Ear Headphones, Wireless Bluetooth 5.3, Ultralight Earphones with HD Microphone, Outstanding Sound Music Streaming up to 30 Hours, LED Display, IP7 Waterproof, White, Smartphones & Accessories, buy jesebang bluetooth in-ear headphones, wireless bluetooth 5.3, ultralight earphones with hd microphone, outstanding sound music streaming up to 30 hours, led display, ip7 waterproof, white","Shop for the best Jesebang Bluetooth In-Ear Headphones, Wireless Bluetooth 5.3, Ultralight Earphones with HD Microphone, Outstanding Sound Music Streaming up to 30 Hours, LED Display, IP7 Waterproof, White at Pay4more. High-quality jesebang bluetooth in-ear headphones, wireless bluetooth 5.3, ultralight earphones with hd microphone, outstanding sound music streaming up to 30 hours, led display, ip7 waterproof, white available with fast shipping. Order now!"
CHAR-BROIL 3-piece Non-Stick BBQ Topper Set-Distributes Heat Evenly,P00190,CHAR-BROIL 3-piece Non-Stick BBQ Topper Set-Distributes Heat Evenly - Pet Supplies,Buy CHAR-BROIL 3-piece Non-Stick BBQ Topper Set-Distributes Heat Evenly Online | Pay4more,"CHAR-BROIL 3-piece Non-Stick BBQ Topper Set-Distributes Heat Evenly, Pet Supplies, buy char-broil 3-piece non-stick bbq topper set-distributes heat evenly",Shop for the best CHAR-BROIL 3-piece Non-Stick BBQ Topper Set-Distributes Heat Evenly at Pay4more. High-quality char-broil 3-piece non-stick bbq topper set-distributes heat evenly available with fast shipping. Order now!
"WIGZI - 2025 Edition - 2 Dog Retractable Leash with Light (L.E.D), No Tangle 360 Technology, Independent Braking Each Dog up to 50lbs Each Dog with 10 ft Reflective Leads for Safety",P00191,"WIGZI - 2025 Edition - 2 Dog Retractable Leash with Light (L.E.D), No Tangle 360 Technology, Independent Braking Each Dog up to 50lbs Each Dog with 10 ft Reflective Leads for Safety - Electronics","Buy WIGZI - 2025 Edition - 2 Dog Retractable Leash with Light (L.E.D), No Tangle 360 Technology, Independent Braking Each Dog up to 50lbs Each Dog with 10 ft Reflective Leads for Safety Online | Pay4more","WIGZI - 2025 Edition - 2 Dog Retractable Leash with Light (L.E.D), No Tangle 360 Technology, Independent Braking Each Dog up to 50lbs Each Dog with 10 ft Reflective Leads for Safety, Electronics, buy wigzi - 2025 edition - 2 dog retractable leash with light (l.e.d), no tangle 360 technology, independent braking each dog up to 50lbs each dog with 10 ft reflective leads for safety","Shop for the best WIGZI - 2025 Edition - 2 Dog Retractable Leash with Light (L.E.D), No Tangle 360 Technology, Independent Braking Each Dog up to 50lbs Each Dog with 10 ft Reflective Leads for Safety at Pay4more. High-quality wigzi - 2025 edition - 2 dog retractable leash with light (l.e.d), no tangle 360 technology, independent braking each dog up to 50lbs each dog with 10 ft reflective leads for safety available with fast shipping. Order now!"
"MyKronoz Fitness Tracker, Brown",P00192,"MyKronoz Fitness Tracker, Brown - Office & School Supplies","Buy MyKronoz Fitness Tracker, Brown Online | Pay4more","MyKronoz Fitness Tracker, Brown, Office & School Supplies, buy mykronoz fitness tracker, brown","Shop for the best MyKronoz Fitness Tracker, Brown at Pay4more. High-quality mykronoz fitness tracker, brown available with fast shipping. Order now!"
Canon PGI-5BK Original Black Ink Cartridge (0628B002),P00193,Canon PGI-5BK Original Black Ink Cartridge (0628B002) - Office & School Supplies,Buy Canon PGI-5BK Original Black Ink Cartridge (0628B002) Online | Pay4more,"Canon PGI-5BK Original Black Ink Cartridge (0628B002), Office & School Supplies, buy canon pgi-5bk original black ink cartridge (0628b002)",Shop for the best Canon PGI-5BK Original Black Ink Cartridge (0628B002) at Pay4more. High-quality canon pgi-5bk original black ink cartridge (0628b002) available with fast shipping. Order now!
Canon CLI-8Y Ink Cartridge - Yellow,P00194,Canon CLI-8Y Ink Cartridge - Yellow - Office & School Supplies,Buy Canon CLI-8Y Ink Cartridge - Yellow Online | Pay4more,"Canon CLI-8Y Ink Cartridge - Yellow, Office & School Supplies, buy canon cli-8y ink cartridge - yellow",Shop for the best Canon CLI-8Y Ink Cartridge - Yellow at Pay4more. High-quality canon cli-8y ink cartridge - yellow available with fast shipping. Order now!
"Original HP 910 Yellow Ink Cartridge | Works with HP OfficeJet 8010, 8020 Series, HP OfficeJet Pro 8020, 8030 Series | Eligible for Instant Ink | 3YL60AN",P00195,"Original HP 910 Yellow Ink Cartridge | Works with HP OfficeJet 8010, 8020 Series, HP OfficeJet Pro 8020, 8030 Series | Eligible for Instant Ink | 3YL60AN - Office & School Supplies","Buy Original HP 910 Yellow Ink Cartridge | Works with HP OfficeJet 8010, 8020 Series, HP OfficeJet Pro 8020, 8030 Series | Eligible for Instant Ink | 3YL60AN Online | Pay4more","Original HP 910 Yellow Ink Cartridge | Works with HP OfficeJet 8010, 8020 Series, HP OfficeJet Pro 8020, 8030 Series | Eligible for Instant Ink | 3YL60AN, Office & School Supplies, buy original hp 910 yellow ink cartridge | works with hp officejet 8010, 8020 series, hp officejet pro 8020, 8030 series | eligible for instant ink | 3yl60an","Shop for the best Original HP 910 Yellow Ink Cartridge | Works with HP OfficeJet 8010, 8020 Series, HP OfficeJet Pro 8020, 8030 Series | Eligible for Instant Ink | 3YL60AN at Pay4more. High-quality original hp 910 yellow ink cartridge | works with hp officejet 8010, 8020 series, hp officejet pro 8020, 8030 series | eligible for instant ink | 3yl60an available with fast shipping. Order now!"
"Canon Genuine Canon PG-245XL HIGH Yield Twin Ink Cartridge Value Pack, Black, 2-Pack",P00196,"Canon Genuine Canon PG-245XL HIGH Yield Twin Ink Cartridge Value Pack, Black, 2-Pack - Electronics","Buy Canon Genuine Canon PG-245XL HIGH Yield Twin Ink Cartridge Value Pack, Black, 2-Pack Online | Pay4more","Canon Genuine Canon PG-245XL HIGH Yield Twin Ink Cartridge Value Pack, Black, 2-Pack, Electronics, buy canon genuine canon pg-245xl high yield twin ink cartridge value pack, black, 2-pack","Shop for the best Canon Genuine Canon PG-245XL HIGH Yield Twin Ink Cartridge Value Pack, Black, 2-Pack at Pay4more. High-quality canon genuine canon pg-245xl high yield twin ink cartridge value pack, black, 2-pack available with fast shipping. Order now!"
"Beats Powerbeats Pro 2 Wireless Bluetooth Earbuds - Noise Cancelling, Heart Rate Monitor, IPX4, Up to 45H Battery & Charging Case, Works with Apple & Android - Jet Black",P00207,"Beats Powerbeats Pro 2 Wireless Bluetooth Earbuds - Noise Cancelling, Heart Rate Monitor, IPX4, Up to 45H Battery & Charging Case, Works with Apple & Android - Jet Black - Audio","Buy Beats Powerbeats Pro 2 Wireless Bluetooth Earbuds - Noise Cancelling, Heart Rate Monitor, IPX4, Up to 45H Battery & Charging Case, Works with Apple & Android - Jet Black Online | Pay4more","Beats Powerbeats Pro 2 Wireless Bluetooth Earbuds - Noise Cancelling, Heart Rate Monitor, IPX4, Up to 45H Battery & Charging Case, Works with Apple & Android - Jet Black, Audio, buy beats powerbeats pro 2 wireless bluetooth earbuds - noise cancelling, heart rate monitor, ipx4, up to 45h battery & charging case, works with apple & android - jet black","Shop for the best Beats Powerbeats Pro 2 Wireless Bluetooth Earbuds - Noise Cancelling, Heart Rate Monitor, IPX4, Up to 45H Battery & Charging Case, Works with Apple & Android - Jet Black at Pay4more. High-quality beats powerbeats pro 2 wireless bluetooth earbuds - noise cancelling, heart rate monitor, ipx4, up to 45h battery & charging case, works with apple & android - jet black available with fast shipping. Order now!"
Novopal 1500 watt Pure Sine Wave Power Inverter DC 12V to 110V/120V Converter 4 AC Outlets Car Inverters with USB Port 16.4 Feet Remote Control and LCD Display,P00208,Novopal 1500 watt Pure Sine Wave Power Inverter DC 12V to 110V/120V Converter 4 AC Outlets Car Inverters with USB Port 16.4 Feet Remote Control and LCD Display - Batteries,Buy Novopal 1500 watt Pure Sine Wave Power Inverter DC 12V to 110V/120V Converter 4 AC Outlets Car Inverters with USB Port 16.4 Feet Remote Control and LCD Display Online | Pay4more,"Novopal 1500 watt Pure Sine Wave Power Inverter DC 12V to 110V/120V Converter 4 AC Outlets Car Inverters with USB Port 16.4 Feet Remote Control and LCD Display, Batteries, buy novopal 1500 watt pure sine wave power inverter dc 12v to 110v/120v converter 4 ac outlets car inverters with usb port 16.4 feet remote control and lcd display",Shop for the best Novopal 1500 watt Pure Sine Wave Power Inverter DC 12V to 110V/120V Converter 4 AC Outlets Car Inverters with USB Port 16.4 Feet Remote Control and LCD Display at Pay4more. High-quality novopal 1500 watt pure sine wave power inverter dc 12v to 110v/120v converter 4 ac outlets car inverters with usb port 16.4 feet remote control and lcd display available with fast shipping. Order now!
"Novopal Power Inverter Pure Sine Wave-1000 Watt 12V DC to 110V/120V AC Converter- 4 AC Outlets Car Inverter with 1 USB Port-16.4 feet Remote Control,Two Cooling Fans and LCD Display",P00209,"Novopal Power Inverter Pure Sine Wave-1000 Watt 12V DC to 110V/120V AC Converter- 4 AC Outlets Car Inverter with 1 USB Port-16.4 feet Remote Control,Two Cooling Fans and LCD Display - Batteries","Buy Novopal Power Inverter Pure Sine Wave-1000 Watt 12V DC to 110V/120V AC Converter- 4 AC Outlets Car Inverter with 1 USB Port-16.4 feet Remote Control,Two Cooling Fans and LCD Display Online | Pay4more","Novopal Power Inverter Pure Sine Wave-1000 Watt 12V DC to 110V/120V AC Converter- 4 AC Outlets Car Inverter with 1 USB Port-16.4 feet Remote Control,Two Cooling Fans and LCD Display, Batteries, buy novopal power inverter pure sine wave-1000 watt 12v dc to 110v/120v ac converter- 4 ac outlets car inverter with 1 usb port-16.4 feet remote control,two cooling fans and lcd display","Shop for the best Novopal Power Inverter Pure Sine Wave-1000 Watt 12V DC to 110V/120V AC Converter- 4 AC Outlets Car Inverter with 1 USB Port-16.4 feet Remote Control,Two Cooling Fans and LCD Display at Pay4more. High-quality novopal power inverter pure sine wave-1000 watt 12v dc to 110v/120v ac converter- 4 ac outlets car inverter with 1 usb port-16.4 feet remote control,two cooling fans and lcd display available with fast shipping. Order now!"
HoMedics Fitness Stretching Mat with Air Compression 3 Intensity Levels,P00210,HoMedics Fitness Stretching Mat with Air Compression 3 Intensity Levels - Smart Health & Wellness,Buy HoMedics Fitness Stretching Mat with Air Compression 3 Intensity Levels Online | Pay4more,"HoMedics Fitness Stretching Mat with Air Compression 3 Intensity Levels, Smart Health & Wellness, buy homedics fitness stretching mat with air compression 3 intensity levels",Shop for the best HoMedics Fitness Stretching Mat with Air Compression 3 Intensity Levels at Pay4more. High-quality homedics fitness stretching mat with air compression 3 intensity levels available with fast shipping. Order now!
HP DeskJet 4132e All-in-One Printer White,P00211,HP DeskJet 4132e All-in-One Printer White - Printers & Scanners,Buy HP DeskJet 4132e All-in-One Printer White Online | Pay4more,"HP DeskJet 4132e All-in-One Printer White, Printers & Scanners, buy hp deskjet 4132e all-in-one printer white",Shop for the best HP DeskJet 4132e All-in-One Printer White at Pay4more. High-quality hp deskjet 4132e all-in-one printer white available with fast shipping. Order now!
"Organize Makeup Egg-Shaped Vanity Organizer Preppy Design Large Capacity and Grab and Go Handle,White",P00212,"Organize Makeup Egg-Shaped Vanity Organizer Preppy Design Large Capacity and Grab and Go Handle,White - Makeup","Buy Organize Makeup Egg-Shaped Vanity Organizer Preppy Design Large Capacity and Grab and Go Handle,White Online | Pay4more","Organize Makeup Egg-Shaped Vanity Organizer Preppy Design Large Capacity and Grab and Go Handle,White, Makeup, buy organize makeup egg-shaped vanity organizer preppy design large capacity and grab and go handle,white","Shop for the best Organize Makeup Egg-Shaped Vanity Organizer Preppy Design Large Capacity and Grab and Go Handle,White at Pay4more. High-quality organize makeup egg-shaped vanity organizer preppy design large capacity and grab and go handle,white available with fast shipping. Order now!"
