Original Product Name,SKU,Product Title,SEO Title,Focus Keywords,SEO Meta Description
"Ooly Note Pals Sticky Tabs (Bookmarks, Note taking) - NEW - Cute Dinos",P00481,"Ooly Note Pals Sticky Tabs (Bookmarks, Note taking) - NEW - Cute Dinos - Office & School Supplies","Buy Ooly Note Pals Sticky Tabs (Bookmarks, Note taking) - NEW - Cute Dinos Online | Pay4more","Ooly Note Pals Sticky Tabs (Bookmarks, Note taking) - NEW - Cute Dinos, Office & School Supplies, buy ooly note pals sticky tabs (bookmarks, note taking) - new - cute dinos","Shop for the best Ooly Note Pals Sticky Tabs (Bookmarks, Note taking) - NEW - Cute Dinos at Pay4more. High-quality ooly note pals sticky tabs (bookmarks, note taking) - new - cute dinos available with fast shipping. Order now!"
MicroDiamond Poly kite Shark 10 inch Skytails (Pack of 2),P00482,MicroDiamond Poly kite Shark 10 inch Skytails (Pack of 2) - Outdoor Play,Buy MicroDiamond Poly kite Shark 10 inch Skytails (Pack of 2) Online | Pay4more,"MicroDiamond Poly kite Shark 10 inch Skytails (Pack of 2), Outdoor Play, buy microdiamond poly kite shark 10 inch skytails (pack of 2)",Shop for the best MicroDiamond Poly kite Shark 10 inch Skytails (Pack of 2) at Pay4more. High-quality microdiamond poly kite shark 10 inch skytails (pack of 2) available with fast shipping. Order now!
MicroDiamond Poly kite Astronaut 10 inch Skytails (Pack of 2),P00483,MicroDiamond Poly kite Astronaut 10 inch Skytails (Pack of 2) - Outdoor Play,Buy MicroDiamond Poly kite Astronaut 10 inch Skytails (Pack of 2) Online | Pay4more,"MicroDiamond Poly kite Astronaut 10 inch Skytails (Pack of 2), Outdoor Play, buy microdiamond poly kite astronaut 10 inch skytails (pack of 2)",Shop for the best MicroDiamond Poly kite Astronaut 10 inch Skytails (Pack of 2) at Pay4more. High-quality microdiamond poly kite astronaut 10 inch skytails (pack of 2) available with fast shipping. Order now!
Python Patrol Trooper G.I. Joe Super 7 Reaction Action Figure,P00487,"Python Patrol Trooper G.I. Joe Super 7 Reaction Action Figure - Action Figures,Collectible Toys",Buy Python Patrol Trooper G.I. Joe Super 7 Reaction Action Figure Online | Pay4more,"Python Patrol Trooper G.I. Joe Super 7 Reaction Action Figure, Action Figures,Collectible Toys, buy python patrol trooper g.i. joe super 7 reaction action figure",Shop for the best Python Patrol Trooper G.I. Joe Super 7 Reaction Action Figure at Pay4more. High-quality python patrol trooper g.i. joe super 7 reaction action figure available with fast shipping. Order now!
Funko POP TV: Stranger Things Robin & Steve Black Light Vinyl Figures - 2pk 2024 Target Con Excluisve,P00488,Funko POP TV: Stranger Things Robin & Steve Black Light Vinyl Figures - 2pk 2024 Target Con Excluisve - Collectible Toys,Buy Funko POP TV: Stranger Things Robin & Steve Black Light Vinyl Figures - 2pk 2024 Target Con Excluisve Online | Pay4more,"Funko POP TV: Stranger Things Robin & Steve Black Light Vinyl Figures - 2pk 2024 Target Con Excluisve, Collectible Toys, buy funko pop tv: stranger things robin & steve black light vinyl figures - 2pk 2024 target con excluisve",Shop for the best Funko POP TV: Stranger Things Robin & Steve Black Light Vinyl Figures - 2pk 2024 Target Con Excluisve at Pay4more. High-quality funko pop tv: stranger things robin & steve black light vinyl figures - 2pk 2024 target con excluisve available with fast shipping. Order now!
Super7 Thundercats Deluxe Wave 01 - Lion-O Action Figure,P00489,"Super7 Thundercats Deluxe Wave 01 - Lion-O Action Figure - Action Figures,Collectible Toys",Buy Super7 Thundercats Deluxe Wave 01 - Lion-O Action Figure Online | Pay4more,"Super7 Thundercats Deluxe Wave 01 - Lion-O Action Figure, Action Figures,Collectible Toys, buy super7 thundercats deluxe wave 01 - lion-o action figure",Shop for the best Super7 Thundercats Deluxe Wave 01 - Lion-O Action Figure at Pay4more. High-quality super7 thundercats deluxe wave 01 - lion-o action figure available with fast shipping. Order now!
FUNKO POP! STAR WARS BO-KATAN KRYZE ,P00490,FUNKO POP! STAR WARS BO-KATAN KRYZE  - Collectible Toys,Buy FUNKO POP! STAR WARS BO-KATAN KRYZE  Online | Pay4more,"FUNKO POP! STAR WARS BO-KATAN KRYZE , Collectible Toys, buy funko pop! star wars bo-katan kryze ",Shop for the best FUNKO POP! STAR WARS BO-KATAN KRYZE  at Pay4more. High-quality funko pop! star wars bo-katan kryze  available with fast shipping. Order now!
Funko Pop! Comic Covers: Marvel - The Unbeatable Squirrel Girl #6 (Target Exclusive),P00491,Funko Pop! Comic Covers: Marvel - The Unbeatable Squirrel Girl #6 (Target Exclusive) - Collectible Toys,Buy Funko Pop! Comic Covers: Marvel - The Unbeatable Squirrel Girl #6 (Target Exclusive) Online | Pay4more,"Funko Pop! Comic Covers: Marvel - The Unbeatable Squirrel Girl #6 (Target Exclusive), Collectible Toys, buy funko pop! comic covers: marvel - the unbeatable squirrel girl #6 (target exclusive)",Shop for the best Funko Pop! Comic Covers: Marvel - The Unbeatable Squirrel Girl #6 (Target Exclusive) at Pay4more. High-quality funko pop! comic covers: marvel - the unbeatable squirrel girl #6 (target exclusive) available with fast shipping. Order now!
Funko Pop Comic Cover! Marvel: Avengers - Scarlet Witch (Exc) Collectable Vinyl Figure - Gift Idea - Official Merchandise - Toys for Kids & Adults - Model Figure for Collectors and Display,P00492,Funko Pop Comic Cover! Marvel: Avengers - Scarlet Witch (Exc) Collectable Vinyl Figure - Gift Idea - Official Merchandise - Toys for Kids & Adults - Model Figure for Collectors and Display - Collectible Toys,Buy Funko Pop Comic Cover! Marvel: Avengers - Scarlet Witch (Exc) Collectable Vinyl Figure - Gift Idea - Official Merchandise - Toys for Kids & Adults - Model Figure for Collectors and Display Online | Pay4more,"Funko Pop Comic Cover! Marvel: Avengers - Scarlet Witch (Exc) Collectable Vinyl Figure - Gift Idea - Official Merchandise - Toys for Kids & Adults - Model Figure for Collectors and Display, Collectible Toys, buy funko pop comic cover! marvel: avengers - scarlet witch (exc) collectable vinyl figure - gift idea - official merchandise - toys for kids & adults - model figure for collectors and display",Shop for the best Funko Pop Comic Cover! Marvel: Avengers - Scarlet Witch (Exc) Collectable Vinyl Figure - Gift Idea - Official Merchandise - Toys for Kids & Adults - Model Figure for Collectors and Display at Pay4more. High-quality funko pop comic cover! marvel: avengers - scarlet witch (exc) collectable vinyl figure - gift idea - official merchandise - toys for kids & adults - model figure for collectors and display available with fast shipping. Order now!
Funko Pop Comic Covers Marvel: X-Men - 42 All New Wolverine (Exclusive),P00493,Funko Pop Comic Covers Marvel: X-Men - 42 All New Wolverine (Exclusive) - Collectible Toys,Buy Funko Pop Comic Covers Marvel: X-Men - 42 All New Wolverine (Exclusive) Online | Pay4more,"Funko Pop Comic Covers Marvel: X-Men - 42 All New Wolverine (Exclusive), Collectible Toys, buy funko pop comic covers marvel: x-men - 42 all new wolverine (exclusive)",Shop for the best Funko Pop Comic Covers Marvel: X-Men - 42 All New Wolverine (Exclusive) at Pay4more. High-quality funko pop comic covers marvel: x-men - 42 all new wolverine (exclusive) available with fast shipping. Order now!
Unicorn Unique Puzzle ,P00495,Unicorn Unique Puzzle  - Toys & Games,Buy Unicorn Unique Puzzle  Online | Pay4more,"Unicorn Unique Puzzle , Toys & Games, buy unicorn unique puzzle ",Shop for the best Unicorn Unique Puzzle  at Pay4more. High-quality unicorn unique puzzle  available with fast shipping. Order now!
Box of Crafts DIY Art Kit - Mondo Llama,P00496,Box of Crafts DIY Art Kit - Mondo Llama - Arts & Crafts,Buy Box of Crafts DIY Art Kit - Mondo Llama Online | Pay4more,"Box of Crafts DIY Art Kit - Mondo Llama, Arts & Crafts, buy box of crafts diy art kit - mondo llama",Shop for the best Box of Crafts DIY Art Kit - Mondo Llama at Pay4more. High-quality box of crafts diy art kit - mondo llama available with fast shipping. Order now!
Inflatable Duck Sprinkler - Sun Squad™ Colorful 3 Ft 4 Inches Long Summer Fun,P00497,Inflatable Duck Sprinkler - Sun Squad™ Colorful 3 Ft 4 Inches Long Summer Fun - Pool Floats & Recreation,Buy Inflatable Duck Sprinkler - Sun Squad™ Colorful 3 Ft 4 Inches Long Summer Fun Online | Pay4more,"Inflatable Duck Sprinkler - Sun Squad™ Colorful 3 Ft 4 Inches Long Summer Fun, Pool Floats & Recreation, buy inflatable duck sprinkler - sun squad™ colorful 3 ft 4 inches long summer fun",Shop for the best Inflatable Duck Sprinkler - Sun Squad™ Colorful 3 Ft 4 Inches Long Summer Fun at Pay4more. High-quality inflatable duck sprinkler - sun squad™ colorful 3 ft 4 inches long summer fun available with fast shipping. Order now!
Hasbro Twister Splash Water Game for Kids Backyard Sprinkler Outdoor Games,P00498,Hasbro Twister Splash Water Game for Kids Backyard Sprinkler Outdoor Games - Toys & Games,Buy Hasbro Twister Splash Water Game for Kids Backyard Sprinkler Outdoor Games Online | Pay4more,"Hasbro Twister Splash Water Game for Kids Backyard Sprinkler Outdoor Games, Toys & Games, buy hasbro twister splash water game for kids backyard sprinkler outdoor games",Shop for the best Hasbro Twister Splash Water Game for Kids Backyard Sprinkler Outdoor Games at Pay4more. High-quality hasbro twister splash water game for kids backyard sprinkler outdoor games available with fast shipping. Order now!
Bubble Kazoo,P00499,Bubble Kazoo - Toys & Games,Buy Bubble Kazoo Online | Pay4more,"Bubble Kazoo, Toys & Games, buy bubble kazoo",Shop for the best Bubble Kazoo at Pay4more. High-quality bubble kazoo available with fast shipping. Order now!
NERF Super Soaker Blast Water Slide - 12 Ft Kids Water Slide for Outdoor Summer Fun,P00501,NERF Super Soaker Blast Water Slide - 12 Ft Kids Water Slide for Outdoor Summer Fun - Toys & Games,Buy NERF Super Soaker Blast Water Slide - 12 Ft Kids Water Slide for Outdoor Summer Fun Online | Pay4more,"NERF Super Soaker Blast Water Slide - 12 Ft Kids Water Slide for Outdoor Summer Fun, Toys & Games, buy nerf super soaker blast water slide - 12 ft kids water slide for outdoor summer fun",Shop for the best NERF Super Soaker Blast Water Slide - 12 Ft Kids Water Slide for Outdoor Summer Fun at Pay4more. High-quality nerf super soaker blast water slide - 12 ft kids water slide for outdoor summer fun available with fast shipping. Order now!
NEW Nerf Super Soaker Hydro Battle Ride-On Cruiser – Inflatable Pool Float [B1],P00502,NEW Nerf Super Soaker Hydro Battle Ride-On Cruiser – Inflatable Pool Float [B1] - Pool Floats & Recreation,Buy NEW Nerf Super Soaker Hydro Battle Ride-On Cruiser – Inflatable Pool Float [B1] Online | Pay4more,"NEW Nerf Super Soaker Hydro Battle Ride-On Cruiser – Inflatable Pool Float [B1], Pool Floats & Recreation, buy new nerf super soaker hydro battle ride-on cruiser – inflatable pool float [b1]",Shop for the best NEW Nerf Super Soaker Hydro Battle Ride-On Cruiser – Inflatable Pool Float [B1] at Pay4more. High-quality new nerf super soaker hydro battle ride-on cruiser – inflatable pool float [b1] available with fast shipping. Order now!
Zuru X-Shot Small Stealth Soaker Water Blaster,P00503,Zuru X-Shot Small Stealth Soaker Water Blaster - Water & Pool Toys,Buy Zuru X-Shot Small Stealth Soaker Water Blaster Online | Pay4more,"Zuru X-Shot Small Stealth Soaker Water Blaster, Water & Pool Toys, buy zuru x-shot small stealth soaker water blaster",Shop for the best Zuru X-Shot Small Stealth Soaker Water Blaster at Pay4more. High-quality zuru x-shot small stealth soaker water blaster available with fast shipping. Order now!
Halloween candy bag ,P00504,Halloween candy bag  - Halloween,Buy Halloween candy bag  Online | Pay4more,"Halloween candy bag , Halloween, buy halloween candy bag ",Shop for the best Halloween candy bag  at Pay4more. High-quality halloween candy bag  available with fast shipping. Order now!
Baby Disney Hat Minnie Mouse Fruit lemons J6,P00505,"Baby Disney Hat Minnie Mouse Fruit lemons J6 - Kids' Clothing,Apparel & Accessories",Buy Baby Disney Hat Minnie Mouse Fruit lemons J6 Online | Pay4more,"Baby Disney Hat Minnie Mouse Fruit lemons J6, Kids' Clothing,Apparel & Accessories, buy baby disney hat minnie mouse fruit lemons j6",Shop for the best Baby Disney Hat Minnie Mouse Fruit lemons J6 at Pay4more. High-quality baby disney hat minnie mouse fruit lemons j6 available with fast shipping. Order now!
Thermos 8x10 Lunch Bag Antimicrobial Liner,P00506,Thermos 8x10 Lunch Bag Antimicrobial Liner - Backpacks and Lunch Bags,Buy Thermos 8x10 Lunch Bag Antimicrobial Liner Online | Pay4more,"Thermos 8x10 Lunch Bag Antimicrobial Liner, Backpacks and Lunch Bags, buy thermos 8x10 lunch bag antimicrobial liner",Shop for the best Thermos 8x10 Lunch Bag Antimicrobial Liner at Pay4more. High-quality thermos 8x10 lunch bag antimicrobial liner available with fast shipping. Order now!
Bullseye's Playground,P00507,Bullseye's Playground - Backpacks and Lunch Bags,Buy Bullseye's Playground Online | Pay4more,"Bullseye's Playground, Backpacks and Lunch Bags, buy bullseye's playground",Shop for the best Bullseye's Playground at Pay4more. High-quality bullseye's playground available with fast shipping. Order now!
Lime lunch bag ,P00508,Lime lunch bag  - Backpacks and Lunch Bags,Buy Lime lunch bag  Online | Pay4more,"Lime lunch bag , Backpacks and Lunch Bags, buy lime lunch bag ",Shop for the best Lime lunch bag  at Pay4more. High-quality lime lunch bag  available with fast shipping. Order now!
Kind kids club lunch ,P00509,Kind kids club lunch  - Backpacks and Lunch Bags,Buy Kind kids club lunch  Online | Pay4more,"Kind kids club lunch , Backpacks and Lunch Bags, buy kind kids club lunch ",Shop for the best Kind kids club lunch  at Pay4more. High-quality kind kids club lunch  available with fast shipping. Order now!
Mint kind kids club ,P00510,Mint kind kids club  - Backpacks and Lunch Bags,Buy Mint kind kids club  Online | Pay4more,"Mint kind kids club , Backpacks and Lunch Bags, buy mint kind kids club ",Shop for the best Mint kind kids club  at Pay4more. High-quality mint kind kids club  available with fast shipping. Order now!
Kind kids club ,P00511,Kind kids club  - Backpacks and Lunch Bags,Buy Kind kids club  Online | Pay4more,"Kind kids club , Backpacks and Lunch Bags, buy kind kids club ",Shop for the best Kind kids club  at Pay4more. High-quality kind kids club  available with fast shipping. Order now!
NWT Kids Purple Lunch Bag With Lightning Bolt,P00512,NWT Kids Purple Lunch Bag With Lightning Bolt - Backpacks and Lunch Bags,Buy NWT Kids Purple Lunch Bag With Lightning Bolt Online | Pay4more,"NWT Kids Purple Lunch Bag With Lightning Bolt, Backpacks and Lunch Bags, buy nwt kids purple lunch bag with lightning bolt",Shop for the best NWT Kids Purple Lunch Bag With Lightning Bolt at Pay4more. High-quality nwt kids purple lunch bag with lightning bolt available with fast shipping. Order now!
Flower mini bag ,P00513,Flower mini bag  - Backpacks and Lunch Bags,Buy Flower mini bag  Online | Pay4more,"Flower mini bag , Backpacks and Lunch Bags, buy flower mini bag ",Shop for the best Flower mini bag  at Pay4more. High-quality flower mini bag  available with fast shipping. Order now!
Star Wars Binder Zip Case ,P00514,Star Wars Binder Zip Case  - Toys & Games,Buy Star Wars Binder Zip Case  Online | Pay4more,"Star Wars Binder Zip Case , Toys & Games, buy star wars binder zip case ",Shop for the best Star Wars Binder Zip Case  at Pay4more. High-quality star wars binder zip case  available with fast shipping. Order now!
Mondo LLama Paint Rolling Kit With Tray,P00515,Mondo LLama Paint Rolling Kit With Tray - Arts & Crafts,Buy Mondo LLama Paint Rolling Kit With Tray Online | Pay4more,"Mondo LLama Paint Rolling Kit With Tray, Arts & Crafts, buy mondo llama paint rolling kit with tray",Shop for the best Mondo LLama Paint Rolling Kit With Tray at Pay4more. High-quality mondo llama paint rolling kit with tray available with fast shipping. Order now!
Mondo Llama Create-Your-Own Pennant Kit,P00516,Mondo Llama Create-Your-Own Pennant Kit - Arts & Crafts,Buy Mondo Llama Create-Your-Own Pennant Kit Online | Pay4more,"Mondo Llama Create-Your-Own Pennant Kit, Arts & Crafts, buy mondo llama create-your-own pennant kit",Shop for the best Mondo Llama Create-Your-Own Pennant Kit at Pay4more. High-quality mondo llama create-your-own pennant kit available with fast shipping. Order now!
Mondo Llama Create-Your-Own Shadow Art Kit,P00517,Mondo Llama Create-Your-Own Shadow Art Kit - Arts & Crafts,Buy Mondo Llama Create-Your-Own Shadow Art Kit Online | Pay4more,"Mondo Llama Create-Your-Own Shadow Art Kit, Arts & Crafts, buy mondo llama create-your-own shadow art kit",Shop for the best Mondo Llama Create-Your-Own Shadow Art Kit at Pay4more. High-quality mondo llama create-your-own shadow art kit available with fast shipping. Order now!
AX1800 Whole Home Mesh Wi-Fi 6 System,P00518,AX1800 Whole Home Mesh Wi-Fi 6 System - Electronics,Buy AX1800 Whole Home Mesh Wi-Fi 6 System Online | Pay4more,"AX1800 Whole Home Mesh Wi-Fi 6 System, Electronics, buy ax1800 whole home mesh wi-fi 6 system",Shop for the best AX1800 Whole Home Mesh Wi-Fi 6 System at Pay4more. High-quality ax1800 whole home mesh wi-fi 6 system available with fast shipping. Order now!
"SwimWays Spring Float Premium SunSeat Pool Chairs, Inflatable Pool Floats Adult with Fast Inflation for Ages 15 & Up, Sky Blue",P00519,"SwimWays Spring Float Premium SunSeat Pool Chairs, Inflatable Pool Floats Adult with Fast Inflation for Ages 15 & Up, Sky Blue - Pool Floats & Recreation","Buy SwimWays Spring Float Premium SunSeat Pool Chairs, Inflatable Pool Floats Adult with Fast Inflation for Ages 15 & Up, Sky Blue Online | Pay4more","SwimWays Spring Float Premium SunSeat Pool Chairs, Inflatable Pool Floats Adult with Fast Inflation for Ages 15 & Up, Sky Blue, Pool Floats & Recreation, buy swimways spring float premium sunseat pool chairs, inflatable pool floats adult with fast inflation for ages 15 & up, sky blue","Shop for the best SwimWays Spring Float Premium SunSeat Pool Chairs, Inflatable Pool Floats Adult with Fast Inflation for Ages 15 & Up, Sky Blue at Pay4more. High-quality swimways spring float premium sunseat pool chairs, inflatable pool floats adult with fast inflation for ages 15 & up, sky blue available with fast shipping. Order now!"
Mesh Shower Bag Hanging Toiletry Bag College Dorm Essentials Bag Portable Wash Bag Quick Dry Cosmetic Bag Shower Organizer for Bathroom Dorms Beach Camping Shopping Travelling,P00521,Mesh Shower Bag Hanging Toiletry Bag College Dorm Essentials Bag Portable Wash Bag Quick Dry Cosmetic Bag Shower Organizer for Bathroom Dorms Beach Camping Shopping Travelling - Toiletries,Buy Mesh Shower Bag Hanging Toiletry Bag College Dorm Essentials Bag Portable Wash Bag Quick Dry Cosmetic Bag Shower Organizer for Bathroom Dorms Beach Camping Shopping Travelling Online | Pay4more,"Mesh Shower Bag Hanging Toiletry Bag College Dorm Essentials Bag Portable Wash Bag Quick Dry Cosmetic Bag Shower Organizer for Bathroom Dorms Beach Camping Shopping Travelling, Toiletries, buy mesh shower bag hanging toiletry bag college dorm essentials bag portable wash bag quick dry cosmetic bag shower organizer for bathroom dorms beach camping shopping travelling",Shop for the best Mesh Shower Bag Hanging Toiletry Bag College Dorm Essentials Bag Portable Wash Bag Quick Dry Cosmetic Bag Shower Organizer for Bathroom Dorms Beach Camping Shopping Travelling at Pay4more. High-quality mesh shower bag hanging toiletry bag college dorm essentials bag portable wash bag quick dry cosmetic bag shower organizer for bathroom dorms beach camping shopping travelling available with fast shipping. Order now!
pink rainbow lunch bag,P00522,pink rainbow lunch bag - Backpacks and Lunch Bags,Buy pink rainbow lunch bag Online | Pay4more,"pink rainbow lunch bag, Backpacks and Lunch Bags, buy pink rainbow lunch bag",Shop for the best pink rainbow lunch bag at Pay4more. High-quality pink rainbow lunch bag available with fast shipping. Order now!
Kids' Lunch Bag Strawberry - Cat & Jack,P00525,Kids' Lunch Bag Strawberry - Cat & Jack - Backpacks and Lunch Bags,Buy Kids' Lunch Bag Strawberry - Cat & Jack Online | Pay4more,"Kids' Lunch Bag Strawberry - Cat & Jack, Backpacks and Lunch Bags, buy kids' lunch bag strawberry - cat & jack",Shop for the best Kids' Lunch Bag Strawberry - Cat & Jack at Pay4more. High-quality kids' lunch bag strawberry - cat & jack available with fast shipping. Order now!
Girls bucket hat ,P00526,"Girls bucket hat  - Kids' Clothing,Apparel & Accessories",Buy Girls bucket hat  Online | Pay4more,"Girls bucket hat , Kids' Clothing,Apparel & Accessories, buy girls bucket hat ",Shop for the best Girls bucket hat  at Pay4more. High-quality girls bucket hat  available with fast shipping. Order now!
Sun Squad Polka Dots Kids' Garden Tote Recycled Polyester Unstructured Handbag,P00527,Sun Squad Polka Dots Kids' Garden Tote Recycled Polyester Unstructured Handbag - Pool Floats & Recreation,Buy Sun Squad Polka Dots Kids' Garden Tote Recycled Polyester Unstructured Handbag Online | Pay4more,"Sun Squad Polka Dots Kids' Garden Tote Recycled Polyester Unstructured Handbag, Pool Floats & Recreation, buy sun squad polka dots kids' garden tote recycled polyester unstructured handbag",Shop for the best Sun Squad Polka Dots Kids' Garden Tote Recycled Polyester Unstructured Handbag at Pay4more. High-quality sun squad polka dots kids' garden tote recycled polyester unstructured handbag available with fast shipping. Order now!
Disney Kids Lunch Box Pail Bag Purple Wish with Gold,P00528,Disney Kids Lunch Box Pail Bag Purple Wish with Gold - Backpacks and Lunch Bags,Buy Disney Kids Lunch Box Pail Bag Purple Wish with Gold Online | Pay4more,"Disney Kids Lunch Box Pail Bag Purple Wish with Gold, Backpacks and Lunch Bags, buy disney kids lunch box pail bag purple wish with gold",Shop for the best Disney Kids Lunch Box Pail Bag Purple Wish with Gold at Pay4more. High-quality disney kids lunch box pail bag purple wish with gold available with fast shipping. Order now!
Backpack - Universal Thread,P00529,Backpack - Universal Thread - Backpacks and Lunch Bags,Buy Backpack - Universal Thread Online | Pay4more,"Backpack - Universal Thread, Backpacks and Lunch Bags, buy backpack - universal thread",Shop for the best Backpack - Universal Thread at Pay4more. High-quality backpack - universal thread available with fast shipping. Order now!
Round Seat Cushion - up&up™,P00530,"Round Seat Cushion - up&up™ - Living Room,Furniture",Buy Round Seat Cushion - up&up™ Online | Pay4more,"Round Seat Cushion - up&up™, Living Room,Furniture, buy round seat cushion - up&up™",Shop for the best Round Seat Cushion - up&up™ at Pay4more. High-quality round seat cushion - up&up™ available with fast shipping. Order now!
Pilot 3pk VBoard Master Dry Erase Markers Chisel Tip Black Ink with Bonus Refills: Refillable Whiteboard Markers Set,P00531,Pilot 3pk VBoard Master Dry Erase Markers Chisel Tip Black Ink with Bonus Refills: Refillable Whiteboard Markers Set - Office & School Supplies,Buy Pilot 3pk VBoard Master Dry Erase Markers Chisel Tip Black Ink with Bonus Refills: Refillable Whiteboard Markers Set Online | Pay4more,"Pilot 3pk VBoard Master Dry Erase Markers Chisel Tip Black Ink with Bonus Refills: Refillable Whiteboard Markers Set, Office & School Supplies, buy pilot 3pk vboard master dry erase markers chisel tip black ink with bonus refills: refillable whiteboard markers set",Shop for the best Pilot 3pk VBoard Master Dry Erase Markers Chisel Tip Black Ink with Bonus Refills: Refillable Whiteboard Markers Set at Pay4more. High-quality pilot 3pk vboard master dry erase markers chisel tip black ink with bonus refills: refillable whiteboard markers set available with fast shipping. Order now!
"Command Large Universal Frame Hanger, 3 Picture Hangers with 6 Command Strips and 6 Frame Stabilizer Strips, Decorate Damage-Free",P00532,"Command Large Universal Frame Hanger, 3 Picture Hangers with 6 Command Strips and 6 Frame Stabilizer Strips, Decorate Damage-Free - Hardware","Buy Command Large Universal Frame Hanger, 3 Picture Hangers with 6 Command Strips and 6 Frame Stabilizer Strips, Decorate Damage-Free Online | Pay4more","Command Large Universal Frame Hanger, 3 Picture Hangers with 6 Command Strips and 6 Frame Stabilizer Strips, Decorate Damage-Free, Hardware, buy command large universal frame hanger, 3 picture hangers with 6 command strips and 6 frame stabilizer strips, decorate damage-free","Shop for the best Command Large Universal Frame Hanger, 3 Picture Hangers with 6 Command Strips and 6 Frame Stabilizer Strips, Decorate Damage-Free at Pay4more. High-quality command large universal frame hanger, 3 picture hangers with 6 command strips and 6 frame stabilizer strips, decorate damage-free available with fast shipping. Order now!"
