Category,Parent Category,Photo,Description,SEO Title,SEO Meta description,Focus keyword
Diapering,babies,Diapering.png (https://v5.airtableusercontent.com/v3/u/43/43/1753113600000/y4277oD1nKd8BO62v53UdA/5Gd5tsBYjRMHJVCu2fLS7DdMjqyTndU32ZCeiLXwK5xFw14v7PCV5LWbBRjxQbPQR0m7HIabU26AFOXzhKqe3ZvC_pdOE_x44gh7VDNknHoAVSVLoY9x6CznYa9whvQCXbvkMe_UY5YdX7of2oBIgEwQn57aYbvSagNTSHFqUIc/3UHq-z3deZ7W1afTO8-3aEUoHrKjku2wdN4vBDBLKcU),Discover a wide range of Diapering within our diapering selection. Browse the best Diapering available.,Shop Diapering | Latest Trends & Affordable Prices,"Browse our premium collection of diapering. Shop top styles, quality brands, and exclusive deals online today!","diapering,buy diapering,diapering online"
Nursing & Feeding,babies,Nursing & Feeding.png (https://v5.airtableusercontent.com/v3/u/43/43/1753113600000/UDGPSD5b2asxOZ02FzJ6ag/n6yxkThxVCWryWAQtmC4U6Cs3PMfx2yyM9M7u25h0IDm8QMmFsclnEAxA29F-a96_cRCAMAmervJ0XLjCIG7mkqPX5oG9g1eWGk2vM986runyemAblJSKujc30WW1nS6wGeuEGF7sEvEouMYZQYDgc1_Aipj4wuNPiBnKOxHcPY/9PZVf7t0mI7ICUr92JIXPAv4B1XuZERt-STZQxeVEHo),Discover a wide range of Nursing &amp; Feeding within our nursing-and-feeding selection. Browse the best Nursing &amp; Feeding available.,Shop Nursing & Feeding | Latest Trends & Affordable Prices,"Browse our premium collection of nursing & feeding. Shop top styles, quality brands, and exclusive deals online today!","nursing & feeding,buy nursing & feeding,nursing & feeding online"
Bath & Potty,babies,Bath & Potty.png (https://v5.airtableusercontent.com/v3/u/43/43/1753113600000/Lvl8ORU6p6Tai80iayEPkA/8U29s8H5hjSSKd5Q7il1AMdMi46C9G3Z6R_wob02QIT7FT1Z0gg5uSDR2MDkZHcV_2ZDxmO0VL9HdOEwKeEH0r1Z1KNBm_4RGGFzk-9m2I3USWUyp8vLrvgHcXr7fzuLoiIoXy3vn-MHzC3JFlyy99qYl4dIWO7ay1TGeoo9NDY/oGu4XsCXquP-KvAf147aev1GvTdbTvMWM4Bq1o4g5RI),Discover a wide range of Bath &amp; Potty within our bath-and-potty selection. Browse the best Bath &amp; Potty available.,Shop Bath & Potty | Latest Trends & Affordable Prices,"Browse our premium collection of bath & potty. Shop top styles, quality brands, and exclusive deals online today!","bath & potty,buy bath & potty,bath & potty online"
Car Seats,babies,Car Seats (2).png (https://v5.airtableusercontent.com/v3/u/43/43/1753113600000/Jjbr1knv5gDaK4i2Dekh9w/fXUFNNA-E2LjHCoshJZ6bLU1Go0ihVyDPJ_-Fw0lqL0gcOPD3MZWseUfldIjjyLxmCHaA-FsPdueWvH8iLgA_xEpVES6DOfZD0sKijyJ123kd4UveQBx9MCjTL-YKr82IxCIGRk1UIgZ-oXrb3j3aOlVA6n5NkhG0EXkU3QVBy0/S0bp3bJkBE1K-hVmi35a5emr4-laDoWWdD6J2eCIjCA),Discover a wide range of Car Seats within our car-seats selection. Browse the best Car Seats available.,Shop Car Seats | Latest Trends & Affordable Prices,"Browse our premium collection of car seats. Shop top styles, quality brands, and exclusive deals online today!","car seats,buy car seats,car seats online"
Baby Saftey,babies,Baby Saftey.png (https://v5.airtableusercontent.com/v3/u/43/43/1753113600000/0YdLOidI9PH91R4J0Eqkjg/2yxp0WYIq_ENygRZcdyO6yoE1cCLSKY2MHEeyJ8kkE7L3j-lmgTM38CeBMO5HCgQGf1uOeLtok9t487BQnmSayqEaUfmMkGweym5XckVK13a2SQ4XyMvUgnprETvJlqCbNzQDsFJZzkrw_mzWtrM8pn0hJ6lXs2864C1AFKtMhQ/8ZTaK_BnG2m1xyCrFd_p4k6xb3jzuQSRXOM08d2PFRA),Discover a wide range of Baby Saftey within our baby-saftey selection. Browse the best Baby Saftey available.,Shop Baby Saftey | Latest Trends & Affordable Prices,"Browse our premium collection of baby saftey. Shop top styles, quality brands, and exclusive deals online today!","baby saftey,buy baby saftey,baby saftey online"
Baby Toiletries,babies,Baby Toiletries.png (https://v5.airtableusercontent.com/v3/u/43/43/1753113600000/920g4aR9Wyb0uOd9GLrGpQ/m5xJbt3-CbXeMsGbf2ybZjRyzzQRRloijTdx-Z5z0LmFofhk7xCGmJIPxXESeCwlRg3DwtnSAluij9lv3IyncMqEv2-OZ-F1nCqdd-ZiqCvQ8HN4Czm7vF355RdQUGxXRJIdPaoRL61KqXsLeLSCIkDHgyhHZ61RqDdi0BQ-WHk/Fwh-NTiS8L109yCvqW0RExwGBLfv6HsDE0ZEGseWX-U),Discover a wide range of Baby Toiletries within our baby-toiletries selection. Browse the best Baby Toiletries available.,Shop Baby Toiletries | Latest Trends & Affordable Prices,"Browse our premium collection of baby toiletries. Shop top styles, quality brands, and exclusive deals online today!","baby toiletries,buy baby toiletries,baby toiletries online"
Nursery,babies,Nursery.png (https://v5.airtableusercontent.com/v3/u/43/43/1753113600000/mWbsCqkz_CijLws8ehZhhA/fu7RG0_Eo16gFjMaBtrOLtSsTlF5iE3XCJucCHQib77nrAcZsCgFna24qQQzj2ttT7okZteHJJfTU7UxkgYW2YcZjlNJbeL1hOWE9V2POrAm4pjEGIXDcdMn8xuT_sNp-Hh5i2rRZX3vJWwuhw_CA7Pq0Ez1ejwAm7HrxdQ01Jk/Qoq0hnXIoXL_G1srrPQQb1JDZYNIKJ0yRjYVLPKi104),Discover a wide range of Nursery within our nursery selection. Browse the best Nursery available.,Shop Nursery | Latest Trends & Affordable Prices,"Browse our premium collection of nursery. Shop top styles, quality brands, and exclusive deals online today!","nursery,buy nursery,nursery online"
Strollers,babies,Strollers.png (https://v5.airtableusercontent.com/v3/u/43/43/1753113600000/OzTuqb7zIJL1s0lEER-flA/4GJcw8Ki4Zc5Z_uGyc71FE-ukF3pgTOlCpAth3EES55JdNb2JNIsWk1IE3fHunIohIGyvvhLNgMZ4MsBaFNtvVbEgkvqsSMZOARhfIvHIAcLDx-7GMIG_B789vsBEtnFxOeAsQI_oRXtq_5jPkK8OqVY8TXTdHo7do9LpZG27o8/JDA34RpVC3a9VGql10kemmwxxk68b4T_c_kwC99VtYw),Discover a wide range of Strollers within our strollers selection. Browse the best Strollers available.,Shop Strollers | Latest Trends & Affordable Prices,"Browse our premium collection of strollers. Shop top styles, quality brands, and exclusive deals online today!","strollers,buy strollers,strollers online"
Baby Toys,babies,Baby Toys.png (https://v5.airtableusercontent.com/v3/u/43/43/1753113600000/ZYl5lZUukRM2QsN0xbtpig/VbP24Ot4G8aeFdH8tmBdp6CpRJJo3RGWaYpKLwYOfg2xhwlsGMb4FOCoZ8MgN70Oaqzo5MPxNDKxHmeekqUF_pxLsd1p4KXmqiBoC7ez7VlhH66k17CICijwJkfs8wQiZfd565Dvh5jCQ8z9RX2Df5ZyjKPOOfavAxRsWD0xPOc/6hWvQ6kkLKwQfsIu81ji9Xb_I_gjo4eZKB3DR8WLBUw),Discover a wide range of Baby Toys within our baby-toys selection. Browse the best Baby Toys available.,Shop Baby Toys | Latest Trends & Affordable Prices,"Browse our premium collection of baby toys. Shop top styles, quality brands, and exclusive deals online today!","baby toys,buy baby toys,baby toys online"
Emergency Supplies,Safety Gear & Equipment,Emergency Supplies.png (https://v5.airtableusercontent.com/v3/u/43/43/1753113600000/ZQuN4halEV9JUI4XJzkYiQ/7lHjuxFyH2lmRli6K1h7gzDcID7UYGGrZvo__oWbuX_WPxZv-slKxfyZM7PoAd0VyKWrt4dwmCr_ijUrLyOgR0Buw4OggptuGoV4C9RKvJi4MzgYxpvwBOajKth8gitbdbfC-g9wyiY7VgtCscCGkL-laY2PzyZ3KpOV_-u_wbQ/r_F0a9NGIp-KgY3AHUIyDeVixnZa-MR4TO4fnI6_L4E),Discover a wide range of Emergency Supplies within our Safety &amp; First Aid selection. Browse the best Emergency Supplies available.,Shop Emergency Supplies | Latest Trends & Affordable Prices,"Browse our premium collection of emergency supplies. Shop top styles, quality brands, and exclusive deals online today!","emergency supplies,buy emergency supplies,emergency supplies online"
Hard Hats,Safety Gear & Equipment,Hard Hats.png (https://v5.airtableusercontent.com/v3/u/43/43/1753113600000/SozaI3O7cPnC24YEaWelOQ/89OWwg-nbZhkVEgHIdAnJ6RzdPP1qbXuQrOMdlPTXJdsDAUan7llC8Gr3R0P-9qijG6HZzI6bzhBbq5sHJ3Xdb9skVSNzF2Xb05_lvhkEIN4CEXZdtZKYZIimzO4wNIYPgFV4TYJxHoLsnEfr6Bi0qvRTPnA8Yjab9JRDw4cmNg/5MigsOmlbZEoKt4n5Hu9ZO4rt4dVjgX5GfgZ6uptVxw),Discover a wide range of Hard Hats within our Safety Equipment selection. Browse the best Hard Hats available.,Shop Hard Hats | Latest Trends & Affordable Prices,"Browse our premium collection of hard hats. Shop top styles, quality brands, and exclusive deals online today!","hard hats,buy hard hats,hard hats online"
First Aid Kits,Safety Gear & Equipment,First Aid Kits (2).png (https://v5.airtableusercontent.com/v3/u/43/43/1753113600000/7bJAGKgIyBJKcuTndZy1aw/mXR1_i_vzFUXI_Kamb4usxz21DC8G0_a2JX18TzrM4IvEgOndMCw9ci1MoOR427Jr96rU3bU_BH5zbSE8uxZT4DleXJEozBhXAnDt5FePa3xfIqne0SJ-RKuLcEMR8ZBwMJIROZyomSSQJ247yrwwv94TXmrOgop0vR2F8sGyD4/r6UeSDP0qSw7qsPmmDqbV0k-bb0vFTkoBno0qWUXI3g),Discover a wide range of First Aid Kits within our Safety &amp; First Aid selection. Browse the best First Aid Kits available.,Shop First Aid Kits | Latest Trends & Affordable Prices,"Browse our premium collection of first aid kits. Shop top styles, quality brands, and exclusive deals online today!","first aid kits,buy first aid kits,first aid kits online"
Safety Glasses,Safety Gear & Equipment,Safety Glasses.png (https://v5.airtableusercontent.com/v3/u/43/43/1753113600000/ykG7Dgv8LXggILjxeaMcGg/NdhNJnGLD04rdLkN-NI5pVLjE4Xt3rxWWx0eLMPFL6rGdbO4FSUBvUCcCy0JcQ6Y57jb5QqTFdytCQkXMnB1I8BslP9zZaNawJN0ts2cFWKjzRYEGEcUUUClAul3t-Qo_nFSmvrGekbYHwXhYu1dGw5uweszY4xhSCojQsjUntw/5dUZuMpR_iF__7rB7M8DJXIlGSttfhZfMM_2HXTa_VY),Discover a wide range of Safety Glasses within our Safety Equipment selection. Browse the best Safety Glasses available.,Shop Safety Glasses | Latest Trends & Affordable Prices,"Browse our premium collection of safety glasses. Shop top styles, quality brands, and exclusive deals online today!","safety glasses,buy safety glasses,safety glasses online"
Gloves,Safety Gear & Equipment,Gloves.png (https://v5.airtableusercontent.com/v3/u/43/43/1753113600000/Krrs-GMRo-kx12ZqlRLAGg/C6o2QIkq7dVsx74VJ2XfJNP-D0aS4zqjjYWV3gYw13mDKa-b3X1o61sx__vJHnR9D7dQhBjWY9rs3yz6KOTOHq72R1OTB9qCwMgFoMoiuty6bSawdhdvM6fG2h939xkQ_P-KkQ5b34FnX4gqGEobjRuF2ZuEUfxabDXcAl-fMHc/nLka4pfQU0JOsDeTS-ZuZnEQuhx2nNXKUM1PPuQIUPo),Discover a wide range of Gloves within our Safety Equipment selection. Browse the best Gloves available.,Shop Gloves | Latest Trends & Affordable Prices,"Browse our premium collection of gloves. Shop top styles, quality brands, and exclusive deals online today!","gloves,buy gloves,gloves online"
"Disinfectants & Sanitizers (Sprays, Wipes)",General Household Cleaning,"""Disinfectants & Sanitizers (Sprays, Wipes).png (https://v5.airtableusercontent.com/v3/u/43/43/1753113600000/d5QOPYhZP9gyTNO7Olk2Ag/K67dv48rN3UDp0PMukoClcO_peLvYR_gE-upSnXXTI5r0yxBVpyjCHa5POcJl_tdDVnU4eQLxYQJfcvBj98fECxRGICobyUmOFnA1IDDksRsEspj8ihOkPkI0zV_Za7GFEYp_d1nslIFxYQpzJYp6s1-O-qA4ceDZfK-m0R0Lo0n0sknjk9s3Iugnpqb9I3R/z3HovMyMzeTtR2J_3DeWOhV_kRKr_DW665iFy9TmyEY)""",Discover a wide range of Bathroom Toilet Cleaners within our Household Cleaners selection. Browse the best Bathroom Toilet Cleaners available.,Glass & Window Cleaners - Shop Now,Shop Glass & Window Cleaners and more. Discover a wide range of Bathroom Toilet Cleaners within our Household Cleaners selection. Browse the best Bathroom Toilet Cleaners available.,glass*&*window_cleaners
Furniture Cleaners & Dusting Products,General Household Cleaning,Furniture Cleaners & Dusting Products.png (https://v5.airtableusercontent.com/v3/u/43/43/1753113600000/4GctHZWfHVohk9lWlQ75Uw/Q7S8SlH-Rwalw8ipvB1LOb84e4GldD3WKWe-SppPUVBaqYz71_MgNRFb19cY1AXb0AI3YSNvZ5cx9K9EL-KqGlUhdiebMOzNW6WiKQj__5bZIGDvha75XfC2hdOqE0ORjUav41jFLFBCFzFshahxJMDkyT-uf0rHvDOA2a4ZFFiBc9E6j6wbd2pUV0Vd9LgF/kV0NaU0rhYqVAsdTuXNz0CUdcs2nB3ofzLECqEfSkk8),Discover a wide range of Tile & Grout Cleaners within our Household Cleaners selection. Browse the best Tile & Grout Cleaners available.,"Disinfectants & Sanitizers (Sprays, Wipes) - Shop Now","Shop Disinfectants & Sanitizers (Sprays, Wipes) and more. Discover a wide range of Tile & Grout Cleaners within our Household Cleaners selection. Browse the best Tile & Grout Cleaners available.","disinfectants\*&*sanitizers*(sprays,\_wipes)"
Glass & Window Cleaners,General Household Cleaning,Glass cleaner.png (https://v5.airtableusercontent.com/v3/u/43/43/1753113600000/-UJJjxengOnbPuB57db8dg/bec3f9bRqeZAhuBUdGWSXl_DWi45Alv8U3Rk5fYMaNzqJKp_JXNMa91jApKwawGVnnu8eFcRQmgS_xOrMiMXohAOrtQNsml_Vt4qHuLsEGrXUOeK6RVztedopQ_lhbnrXt-iQxGOCzI5RF2Sy52ibug7sw71J7_JlasxJ7ZOyDM/9jPYYHL6tLx1hNmZ_cxCEffBobNNG_MtfbnPTEWDH-0),Discover a wide range of All-Purpose Cleaners within our Household Cleaners selection. Browse the best All-Purpose Cleaners available.,All-Purpose & Multi-Surface Cleaners - Shop Now,Shop All-Purpose & Multi-Surface Cleaners and more. Discover a wide range of All-Purpose Cleaners within our Household Cleaners selection. Browse the best All-Purpose Cleaners available.,all-purpose_&*multi-surface_cleaners
All-Purpose & Multi-Surface Cleaners,General Household Cleaning,General Household Cleaning.png (https://v5.airtableusercontent.com/v3/u/43/43/1753113600000/_2u8xgpgqDPIGxjc4HyUSQ/79d1cBOjTb5RsgweovArirBSoAEgQXkY_rSI75ydAd7g03IqulkJ_a_ygGUtc5PxpMjXMuxY495UHBgJayr5Q34Aj0UaUQX9_HBh1ll8Xq4HhSO9XP3kOtjU_IB_6-5AL1k06nL4voygt3zVQ3wMAkyCWKsAzDlX5PUHrUlrd9vQClnjZuAhUNxAqztTZPui/M59ARVc-bVZ2GRXnxIXFbWBeA9fIbTDm7tTjF6tggLY),Discover a wide range of Household Cleaners within our Cleaning Products selection. Browse the best Household Cleaners available.,General Household Cleaning - Shop Now,Shop General Household Cleaning and more. Discover a wide range of Household Cleaners within our Cleaning Products selection. Browse the best Household Cleaners available.,general_household_cleaning
Dishwashing (Hand & Dishwasher),Kitchen Cleaning,Dishwashing (Hand & Dishwasher).png (https://v5.airtableusercontent.com/v3/u/43/43/1753113600000/dYOjROZE74d6NNKBd5UwRw/hb0erzfrb9YU6Gb5DIfDa0XR7vbV9qrYvXejRlqR-ymd2771k9MqQIw1zO8ByrLJhRIC1Z6zif6JJnsHhPzUc6jY6wV63uT0oqkFwzGCBuQy7PVKg0iof68UDk0o82FiNQvNmBrBqXHYxlSXmArx6P5vcxUY151ndcscZqvUvpDqWGHQvj0c9CkP1rQDYNbe/SghfNrc1NOpLCbmCwqauvS6XtNJWPeEa1WmLSJs5yio),Discover a wide range of Oven Cleaners within our Household Cleaners selection. Browse the best Oven Cleaners available.,Best Dishwashing Soaps & Detergents (2025) | Hand & Machine,"Discover the best dish soap for handwashing and top dishwasher detergents (pods, powders, & gels) of 2025. Get tips for a spotless, sanitized clean every time.","dishwashing soap,best dishwasher detergent,dishwasher pods,rinse aid,what does rinse aid do,how to wash dishes,hand dishwashing vs dishwasher,eco-friendly dish soap."
Degreasers,Kitchen Cleaning,Degreasers (2).png (https://v5.airtableusercontent.com/v3/u/43/43/1753113600000/W7bJCkreo0TMS-_4vfwhIA/OM31kUmVwZR127FIGR7m5wuNgHbcPXsOBvU9JtZnu5VFzWJ7-vcXZF6JZrl_98I6A3bALPWpiF8JJbQMqZLJAVNvBWaSkpmOX1cYMZaH4d_kHxV4S4qhjwAQhsbptlg_RBjiFp8vBzsihdE35zqCD8EMP-NOsUDHYjj14IwuzgI/Isnzy5UKVBRQvUykVxZIylFSLei2qcXBqKuRg9rG8jA),Discover a wide range of Countertop Cleaners within our Household Cleaners selection. Browse the best Countertop Cleaners available.,How to Choose & Use the Best Degreaser for Any Job | 2025,"Find the best kitchen and heavy-duty degreasers of 2025. Learn how to cut through tough grease on cabinets, grills, stovetops, and engines with our expert tips.","kitchen degreaser,best degreaser for grease,heavy-duty degreaser,how to use a degreaser,food-safe degreaser,BBQ grill cleaner,degreaser for cabinets."
Kitchen & Appliance Cleaners (including Countertop & Oven),Kitchen Cleaning,Kitchen & Appliance Cleaners (including Countertop & Oven) (2).png (https://v5.airtableusercontent.com/v3/u/43/43/1753113600000/NNwr92gTzslVk63N6QYlAA/rzouNDV6UnIKpL7oNGzk7-KAqElW1fuYQ57unyOY6TE5VAAEQjf59n5mqy_uK9Q08gGs5TlsNJxA4-4Qde29Sjx_Wm9BzAFDE_v2QMh0gxlRX1Y_BZiWzthdkwX_1ByNmGdHJcPLPIBDpsdl1-pgZ7Cv3bC45iTdZLOV_cOQV312UdJ33C5PXDhvNcSD62HTqn1aKV3E4IzBQ4AAliLyDA/D3Q7KRdf0vIZRlw61EiJt3cw17lwMViEropi89bAeBI),Discover a wide range of Degreasers within our Household Cleaners selection. Browse the best Degreasers available.,Best Cleaners for Kitchen Appliances & Counters | 2025 Guide,"From tough oven grease to shiny stainless steel and food-safe countertop sprays, find the best cleaner for every kitchen appliance and surface in our 2025 guide.","kitchen appliance cleaner,best oven cleaner,granite countertop cleaner,stainless steel cleaner,ceramic cooktop cleaner,food-safe kitchen cleaner,kitchen degreaser"
"Bathroom & Toilet Cleaners (including Shower, Tile & Grout)",Bathroom Cleaning,"""Bathroom & Toilet Cleaners (including Shower, Tile & Grout).png (https://v5.airtableusercontent.com/v3/u/43/43/1753113600000/KAc8dGlguKIBggKZT-udgQ/dtoX2d6WQ2hyAS_WfS5JWrNBKtCQ6RwX-t2-VVoa0nGV40KsjM-if6B8emfbarSQ-5bVN7_RTD_7I3QCe171lHulhVVLGZQnWhXwO9tDYL2XXg2pIHjZeLvJbQDzTUd2SrJcBSeo2kgl_6UWbYY5Hqilz2VqgKlgK7RDSbj8JlBFDTythZ_AHVTz4JkDZ09bXYq4O8qgZe03oTB2ueCKug/ky2QmG3Kky2hWNddOENfU1lwoRVlIq0MSMzrfK2O3pk)""",Discover a wide range of Hardwood Floor Cleaners within our Household Cleaners selection. Browse the best Hardwood Floor Cleaners available.,"Bathroom & Toilet Cleaners (including Shower, Tile & Grout)","Tackle soap scum, hard water stains, and mildew with our 2025 guide. Find the best cleaners for your toilet, shower, tile, and grout for a sparkling clean.","bathroom cleaner,best toilet bowl cleaner,shower cleaner,how to clean grout,tile cleaner,soap scum remover,mold and mildew remover,disinfecting bathroom spray"
Mold & Mildew Removers,Bathroom Cleaning,Mold & Mildew Removers.png (https://v5.airtableusercontent.com/v3/u/43/43/1753113600000/9FDZyM0Hcd3cNeBccMB21w/5wZrxlAaqBW1q76MPrdal7_M5gtFN1RjwA4OxGIyOTGrSkvBL05lpF5l1xd9WoNHkZGjWvTTkkNpgt61bEohfFzkZzBUxzZWOuVjwqxZRkwf51W0O7h1VAzOrO3PMouR9cJTYT_EXCHlkLv6BMNUjQKrvHYmarDrtqFFmTSEkRI/QyCTXQ6bRlDuIAJLv1OpTZJTTNLZpfO20Q208Gl5dZE),Discover a wide range of Tile Floor Cleaners within our Household Cleaners selection. Browse the best Tile Floor Cleaners available.,Best Bathroom & Toilet Cleaners for 2025 | A Guide,"Tackle soap scum, hard water stains, and mildew with our 2025 guide. Find the best cleaners for your toilet, shower, tile, and grout for a sparkling clean.","bathroom cleaner,best toilet bowl cleaner,shower cleaner,how to clean grout,tile cleaner,soap scum remover,mold and mildew remover,disinfecting bathroom spray"
Carpet & Upholstery Cleaners,Floor & Fabric Care,Carpet & Upholstery Cleaners.png (https://v5.airtableusercontent.com/v3/u/43/43/1753113600000/cE8J44SFGi0aG7r8BbUXPQ/9wiC8XfyK8WQvYAWtJ29vJLkEFX_dYMz7GKOYUErXjLoWIkKsquQE25tPg86Q04aPs-g3gjl8JmLK5g54jQF5IaEFFjq-Tdyt3KVtfCD1zDZE9JN3Ukpdzwthlt322Y0n490bN_ZH38yeA_xkvVAHMUAohD4y7QadHIhE5vFstpB5hStSxSPYezxqHDKoKwE/Pk5QFtVziZ70bm8_MQ87fAMd8RBBgrwwzpbof5G5Qcg),Discover a wide range of Furniture Cleaners &amp; Polish within our Household Cleaners selection. Browse the best Furniture Cleaners &amp; Polish available.,Best Carpet & Upholstery Cleaners for Any Stain (2025),"From pet stain removers to deep cleaning shampoos, discover the best carpet and upholstery cleaners of 2025. Learn how to treat any fabric or stain at home.","carpet cleaner,upholstery cleaner,best stain remover for carpet,sofa cleaner,how to clean upholstery,pet stain and odor remover,enzymatic cleaner,furniture cleaning codes."
"Floor Cleaners (Hardwood, Tile, etc.)",Floor & Fabric Care,"""Floor Cleaners (Hardwood, Tile, etc.).png (https://v5.airtableusercontent.com/v3/u/43/43/1753113600000/_S5U_rtiZiXdcdjf5xqCTA/FH6ptOHoBnrnEEWFEguxcnnhDm2QadWd_tHSvEoe6L6apEn2I8H7BcSl87p8BKoGW5CsVercFWcoVfIpsoxNepYAeUJHGTC2dKWiPcUaizEQyO-LOk9hrC9Wk39uVuyPuolbhxmdBsdisdYpO5BdPNBVm12KP9qtU1_veggu-PakrjtJhxWUXF4Rbn_m9DkM/tSAMktG1lhTSBJzDD19iqAVNZ0JEQBrvCtgvwiKr1rI)""",Discover a wide range of Glass &amp; Window Cleaners within our Household Cleaners selection. Browse the best Glass &amp; Window Cleaners available.,Best Floor Cleaners for Every Surface (2025) | A Guide,"Find the best cleaner for your hardwood, tile, laminate, or vinyl floors. Our 2025 guide helps you choose the right product to protect and shine your floors.","hardwood floor cleaner,tile floor cleaner,laminate floor cleaner,best floor cleaner,multi-surface floor cleaner,how to clean floors,vinyl floor cleaner,pH-neutral floor cleaner."
"Laundry Care (Detergents, Fabric Softeners, Stain Removers)",Floor & Fabric Care,"""Laundry Care (Detergents, Fabric Softeners, Stain Removers).png (https://v5.airtableusercontent.com/v3/u/43/43/1753113600000/zuLPCw07EIKKP1caN1iRIg/wB99fzUDIBgU4MCUFiHl604N1hYBbqnbRUXwvWflxr1IVvI8wa5zMEfMe4q2Y_jjZd5OjgALjtWe-itIU8xQHXvBSkuklwom9oBG-wQcoWhpQY6n1tTN_Yo3MPXVY9ZxGURbyqcMYhILgcDCUxx6_yVT1gENd675zrGc1DyjOmuG4f6hJ504bj36N9NjkNEpLLMBmLWEiK88gPqgqyv-AQ/zdiu7wWr1WfhYqQT2VTbGfk8i2BvHC6MOqGV-RuEKgA)""",Discover a wide range of Dusting products within our Household Cleaners selection. Browse the best Dusting products available.,A Complete Guide to Laundry Care Products (2025),"From choosing the best detergent (liquid, powder, or pods) to using fabric softeners and stain removers, our 2025 guide covers everything for cleaner laundry.","laundry detergent,best laundry detergent,fabric softener,how to remove stains,laundry stain remover,liquid vs powder detergent,laundry pods,HE detergent,laundry care"
"Specialty Cleaners (Drain, Car, etc.)",Specialty & Heavy-Duty Cleaning,specialty cleaner.png (https://v5.airtableusercontent.com/v3/u/43/43/1753113600000/tMVZ8DWCDwfDS5UtmFvSDA/yMr-Hz8IuKIVz4fNe9SkjE9kZmckoZQ4--k2B3SCrCYCc2QELrYrI2lqj4xsEYP75B_w6socDVWAaWX7VDXfk9ysfwibMEXeI6Br_gmacuAzhtMdMQIJNykXLU39MlUhgeAWCkdjjeoX5_rYk-p2hstVyMLzQ3yAFB-gF8ldtCk/eSqSmXtTTC4JJ83W8gur_h3p6iMxd2g4RDSy2msE474),Discover a wide range of Liquid Detergents within our Household Cleaners selection. Browse the best Liquid Detergents available.,A Guide to Specialty Cleaners for Tough Jobs (2025),"From clogged drains and car detailing to mold and hard water stains, our 2025 guide explains the best specialty cleaners for every tough job around the house.","specialty cleaners,drain cleaner,car cleaning products,mold and mildew remover,hard water stain remover,adhesive remover,outdoor cleaner,how to unclog a drain"
Outdoor & Pressure Washer Solutions,Specialty & Heavy-Duty Cleaning,Pressure washer.png (https://v5.airtableusercontent.com/v3/u/43/43/1753113600000/KK03Q1iqdQ1FKP0FPu0PVw/WraPM_QOmrdpsWSzLBBIjUu-AHxWxqVJZgZmt_kccX4E-6kRXo0AvEqppSS-3NH759s0myFyNLQg0ADkCn3NW32rYr345jBxDHe6HJxb04Bxi-Mtt_ferBC0lOHhqnhHe4zGAIkOx5-hDXzbdcZ2ZLdEHarre73ZMt93xQiylxY/T1yvw0Jiy5CgejF4xnztgR7fDQNYUl_DkDd3ehzcnWM),Discover a wide range of Powder Detergents within our Household Cleaners selection. Browse the best Powder Detergents available.,Best Outdoor & Pressure Washer Cleaners (2025),"From deck cleaners and house wash to concrete degreasers, discover the best outdoor and pressure washer solutions of 2025. Learn how to choose and use them safely.","pressure washer detergent,outdoor cleaner,deck cleaner,house wash,concrete cleaner,best pressure washer soap,how to use pressure washer with soap,siding cleaner"
Waste Management (Trash Cans & Liners),Cleaning Tools & Equipment,Waste Management (Trash Cans & Liners).png (https://v5.airtableusercontent.com/v3/u/43/43/1753113600000/X3FSvPe_p3aTXpEHdsnPvA/KB9jAY24Tp0kUyVmjAn0NptnIqtVssn6TJc2lzPEan0nt8Hc-NkJGScZ4Zi2vVwCl_iFxISlT06PHSo72FC_D090XmdjwWXcGiyWQUSRSSZWKyeUufwhcyPyr882x9h4A-YGTEQt3jG-3odXqmnRusO3lNk6zELr-HKF4rwB-fOJyHok4QkAZYo4n8mdiikM/yTclbS6xS9r9QB3Kmlk6gIqddFUkjV8S6Xyz9WJISNo),Discover a wide range of Stain Removers within our Household Cleaners selection. Browse the best Stain Removers available.,A Guide to Trash Cans & Liners in Oakville & Halton (2025),"Find the best kitchen trash cans, recycling bins, and compost pails for your home. Our 2025 guide helps Oakville & Halton residents choose the right products.","kitchen trash can,recycling bin,compost bin,trash can liners,best trash bags,dual compartment trash can,waste management Halton Region,compostable bags Oakville"
Vacuum Cleaners & Floor Cleaning Machines,Cleaning Tools & Equipment,Vacuum Cleaners & Floor Cleaning Machines.png (https://v5.airtableusercontent.com/v3/u/43/43/1753113600000/-ihbhpyzHVeISRZMs1RVkA/dElU3JdZJSM7q6RJn-jvQjFoZO3ehzEJ6JdJeVMrvC_eZC7NxqdAGfTZdInxL78PPdtlBTWCmYhkPz3jTVFu3EjzcR0NXaBnHJqUJHleYUFM2LiZ7l1BR-JaMZGZHGisUofFHH3iVAQwVG2l0FjbPviqTwbL0vcLrpHeYghvSRgHCI3UFnH_x2Uzppggi-VR/ZSJB7aGnQQVbNExh1j_YMaFL08UxsKinFRa0SMuOI-c),Discover a wide range of Bleach within our Household Cleaners selection. Browse the best Bleach available.,The Ultimate Guide to Vacuum Cleaners & Floor Machines (2025),"From upright and robotic vacuums to carpet cleaners and steam mops, our 2025 guide helps you choose the best floor cleaning machine for your home.","best vacuum cleaner,upright vs canister vacuum,cordless stick vacuum,robotic vacuum,carpet cleaner machine,steam mop,HEPA filter vacuum,vacuum cleaner for pet hair"
"Manual Cleaning Tools (Mops, Brooms, Sponges, Cloths)",Cleaning Tools & Equipment,"""Manual Cleaning Tools (Mops, Brooms, Sponges, Cloths).png (https://v5.airtableusercontent.com/v3/u/43/43/1753113600000/FVfwXYd1APv10OxileY_ag/DXeZPi1-eHNc_PWl00xXKJCQst42afWs_eNLAEzIrtDPPcH9fDkUYC-SXc_hKEfX42EJvIFJoSr1abjfU3BcE61HLjQedSpO5bHngvs3Jf0sji_qQTsQEaR2y1ic1oX5wtbRD1SjDzBUsvxuKfBeJfoQzyWbStg8ONZwyLeBbW_M1lfWbZ7gBSlx4t2qMGQic3zJAb6fR9GU-QAD-6itOQ/wUHc35QnUnhhZKPHruEKRhXrfkkcjGr9iFLgDTjmhsY)""",Discover a wide range of Fabric Softeners within our Household Cleaners selection. Browse the best Fabric Softeners available.,Essential Manual Cleaning Tools | A Buyer's Guide (2025),"From microfiber cloths and mops to the right broom for your floors, our 2025 guide covers the essential manual cleaning tools every home needs for a perfect clean.","manual cleaning tools,types of mops,microfiber cloths,best broom,kitchen sponges,how to choose a mop,cleaning tools list,household cleaning supplies"
Hand Sanitizers,Personal Hygiene,Hand Sanitizers.png (https://v5.airtableusercontent.com/v3/u/43/43/1753113600000/si8CyyaWFPnC24q5zNWxUQ/H0VW2qk2iciBGKnblyTYMvcoS2_UYePg01UkSC9p__taff-5o4lPXw_OnXJrRtVWRRvlAvM4FeXQUg1WbthxA4vo64IkOPJdhpIgYMvcu6bsNfjbSPL-gbVUBCcWN6gHuHyhx7KKsD2RjaH8sC-0WZjDKBi_IajeARfUt1Y9wvs/d0bmyYX5FTUMBiJGUxUXoJVM69ChB1yBdPhvvD4k_ak),Discover a wide range of Dishwasher Detergents within our Household Cleaners selection. Browse the best Dishwasher Detergents available.,A Complete Guide to Hand Sanitizers in Canada (2025),"Learn how to choose and use the best hand sanitizer. Our 2025 guide covers alcohol content, Health Canada approval, and safety tips for Canadians.","hand sanitizer,best hand sanitizer,alcohol based hand sanitizer,how to use hand sanitizer,hand sanitizer Canada,Health Canada approved sanitizer,NPN hand sanitizer"
