Category,Parent Category,Photo,Description,SEO Title,SEO Meta description,Focus keyword
Camping Tents & Shelters,Camping,camping-tents-shelters (2).png (https://v5.airtableusercontent.com/v3/u/43/43/1753113600000/UGUtBm-MxrvaD0BgJtS0Vw/3ymQPjzfjVt546yoWpXvMDzm3hMxuvy5ScU53OuF72w9R5GiwarfTXR1p-io2jkINhC-gOWZZ2tiij77TAeiqV4iHdD8lZlzEII1oPER3dOYJZEFYHc-9_cJk0dll3OnlrquKmeIYiE-8TtxxD3f-ZVhT6DRz17h9xPzGhzfCTP-aPyqp7WwiYw5NBqUlgu0/JNehHCqZjP4n2oYSXBJ6MndAUvyUF2VP9qTEW0N3vPg),"Escape the everyday and embrace the wild with our extensive collection of high-performance tents and shelters. Whether you're a solo backpacker seeking an ultralight haven, a family looking for a spacious and durable basecamp, or an adventurer needing a rugged, all-season shelter, we have the perfect home away from home for you. Discover innovative features like rapid-pitch systems for effortless setup, weatherproof materials to shield you from the elements, and superior ventilation for a comfortable night's sleep under the stars. From breezy summer nights to challenging mountain expeditions, our tents are engineered for reliability, comfort, and a seamless outdoor experience.",Camping Tents & Shelters | Waterproof & Easy Setup Tents,"Find the perfect camping tent for your next adventure. We offer a wide range of waterproof, easy-setup tents and shelters for solo hikers, families, and all-season explorers. Shop now!","Camping Tents,Backpacking Tents,Family Tents,Waterproof Tents,Pop-up Tents"
Camping Sleeping Gear,Camping,sleeping bags.png (https://v5.airtableusercontent.com/v3/u/43/43/1753113600000/rKJZRx0B_p5TsJ0c1HjGHA/AjE8PRCFqv_1I_lcfYE4etxFnBxju3CzNko8a0vim1aMgTYjwfMHG1V6S9DhPLKn2rUkgCFKG12bFFrPmaf30bR8cJ3BQZqVdduMOM3ewWu4rbJckiD766uBiWych0O8AOoUWsfVAeULqMW8K65z1KbbX7y91Kkx00vioFheuF0/e6eGTxYpjPF8_smWMEvVywmj_EgN2AYci6_79bN_w14),"A great day on the trail starts with a good night's sleep. Our premium sleeping gear collection ensures you wake up refreshed and ready for whatever the day holds. Choose from a variety of temperature-rated sleeping bags, from lightweight summer options to insulated winter bags designed for extreme cold. Pair your bag with one of our comfortable and supportive sleeping pads or air mattresses to create the ultimate sleep system. We also offer plush camping pillows and cozy blankets for that extra touch of comfort. Don't let a restless night compromise your adventure – invest in quality sleeping gear and dream bigger.","Camping Sleeping Bags, Pads & Air Mattresses | Shop Now","Get a great night's sleep outdoors with our range of sleeping bags, sleeping pads, and air mattresses. Find the perfect temperature rating and comfort level for your next camping trip.",Sleeping Bags
Camping Furniture,Camping,camping-furniture.png (https://v5.airtableusercontent.com/v3/u/43/43/1753113600000/vvI5OVUZu-wf8zk67N5M5g/pI27cdyHTe-FFHGFKzLRuPeU3Kj2id4VPT2-HL66CujY4A37bMdbXD6JVuAGvoG58nVXWqRA6AKuuuoU-rCDQ0GnvlaBQmmMxQQSjBfces1WKzO9lFMMlvulzezWnIL3-KQ-dqsOLabIUnaa-NL-ZDF_G3kXcjxecXefYvLrNf0/EhQCfAAHrYypKmTYE8O2zf_ClyEx360uVcfIk9Mb1V4),"Create a comfortable and inviting campsite with our durable and portable camp furniture. Unwind after a day of exploration in one of our supportive and easy-to-fold camping chairs. Gather for meals and games around a sturdy and spacious camping table. For the ultimate in relaxation, our camping hammocks provide the perfect spot to sway in the breeze. Lightweight, compact, and built to last, our camp furniture is designed to enhance your outdoor living space and make your campsite feel like a true retreat.","Camping Furniture | Chairs, Tables & Hammocks","Relax in comfort with our durable and portable camping furniture. Discover a wide selection of camping chairs, tables, and hammocks to complete your campsite.",Camp Furniture
Camping Lighting & Electronics,Camping,Camping Lighting & Electronics.png (https://v5.airtableusercontent.com/v3/u/43/43/1753113600000/MyXq0FeR94vs-6EkUe0kwA/7sD8qgzCUGq3QcTL19eYTiN2-quYwbK0krwrYIQcUs144T7uqzu99tPD8e9oF4cyF5fGCMDKhxoXzcRFlR7g5AHTB8nae-OjUphu7FBBqcs0OaJYJ5tGQwMPhfWjHgYuAwZL8SX7nGAZvLeAPv2amWiEhCHDqdxLyvhXhX6DJ7YCo3gvmtSgJkqXq-5IPDmN/7pcY2cnJlbmtAoQCedRx8YEzLx_dClLPkE6azCRCmJI),"Extend your adventures after dark and stay connected with our reliable camping lighting and electronics. Brighten up your campsite with our powerful and long-lasting lanterns and headlamps, offering various brightness levels to suit your needs. Keep your essential devices charged and ready with our portable power banks, solar chargers, and power stations. For navigation and communication in remote areas, explore our selection of GPS devices and two-way radios. Don't let a lack of light or power cut your adventure short.","Camping Lighting & Portable Power | Lanterns, Headlamps & Chargers","Illuminate your campsite and keep your devices charged with our selection of camping lighting and electronics. Shop lanterns, headlamps, portable power banks, and solar chargers.",Camping Lighting
Camping Essentials & Safety,Camping,Camping Essentials & Safety (2).png (https://v5.airtableusercontent.com/v3/u/43/43/1753113600000/A6fkS_6hnVbl3BAE82RTPg/kHQtVQOUNmjQJoG8gyyHNzCh9hsEJhEukfWiIKpgiWcekNpD_ojJyXKFWqMf7oPTbP-0l6rpnx9HPmmLbHo7dpgNUahygfWGQCISVKsLnbZOtUB67QpNHAbyguNMGVM4kpEDelmHN-i5iohXKVL1G5h5ksKZuna-xaFE8sa8gY_09GwfXUY8hsXH4rC3O_0W/jrX0ZiptXvizjrC7SKddkqoO2r5-yBebjlC1iw4pWh0),"Confidence in the outdoors comes from being prepared. Our collection of camp essentials and safety gear provides the peace of mind you need to fully enjoy your trip. From comprehensive first-aid kits and emergency shelters to reliable fire starters and multi-tools, we have the gear to handle unexpected situations. Stay protected from the elements and insects with our range of sun protection, insect repellents, and rain gear. With these essentials packed, you can focus on making memories, knowing you're ready for whatever nature throws your way."," Camping Essentials & Safety Gear | First-Aid, Navigation & More","Be prepared for any adventure with our camping essentials and safety gear. Shop first-aid kits, navigation tools, fire starters, and more to ensure a safe and enjoyable trip.","First-Aid Kits,Camping Safety,Multi-tools,Fire Starters,Bear Safety"
Camping Activities & Specialty Gear,Camping,Camping Camping Activities & Specialty Gear.png (https://v5.airtableusercontent.com/v3/u/43/43/1753113600000/fDEeVODUiXBobeP_PflRTQ/RuDwNXqjxvPiigFMX4aRD2jSmV2l0t9sKyVNbShS1fI6YqYF15AyBW1GmWD0HXXsCB6IBNuTMYfXSYh-tZZAZjsrhANnJILX0NpQVTrFYY5ra2S3G3AWOZ1zA328FS0e_7mcuYeI4DM7Nb9lE2_KY07ZFeaMGQqIg4fjVDD2zfAM2ITnWXULk2Ru4MemKjXJ/dpr1ksjYeTypdGE7ChmtYEY0Z_4HkaPsfsUDSInxbdM),"Make your next camping trip unforgettable with our exciting range of camping activities and specialty gear. Whether you're looking to relax by the water with our portable hammocks and comfortable camp chairs, or seeking thrills with our slacklines and outdoor games, we have something for every type of adventurer. Explore our selection of specialized gear for bird watching, fishing, and stargazing to enhance your outdoor hobbies. From family fun to solo pursuits, our activity and specialty gear will help you make the most of your time in nature.","Camping Activities & Outdoor Gear | Games, Hammocks & More","Enhance your camping experience with our selection of fun activities and specialty gear. Find hammocks, outdoor games, and equipment for all your favorite camping pastimes.",Camping Activities
Women's Clothing,Apparel & Accessories,woman Clothing.png (https://v5.airtableusercontent.com/v3/u/43/43/1753113600000/ZseUfzxaYfBuCs5Fzcf-8Q/HX6ViCrJFe6Ixns01bj73SpBtKXBTrYdHx9dp8QKnHeGP918xkHwhvkwED-z8br9yeaR1fkhMf304enG8B95UdSqBHVQh9s-nYc4UllarxFoMz2MbmYOLky8qjdql0s0RCcKOf69lZPvOqR2AePuQ8ZQhTrtEEibQHK4skH9qeQ/iYX2k5YaPQ0biHFEXamgHQgP8Z4cRWa-hGNrh0BFOcM),Discover a wide range of Women's Clothing within our Apparel &amp; Accessories selection. Browse the best Women's Clothing available.,Shop Women's Clothing | Latest Trends & Affordable Prices,"Browse our premium collection of women's clothing. Shop top styles, quality brands, and exclusive deals online today!","women's clothing,buy women's clothing,women's clothing online"
Men's Clothing,Apparel & Accessories,Men Clothing.png (https://v5.airtableusercontent.com/v3/u/43/43/1753113600000/jRb2-NGmX1wyWMaC4-BCkA/8DUM25Qd98Z5nGv7WQMACqj3OiJ1PIqki4kT4URL5L7UpEUTUxP3ciDGwI539Pn3nF1GN4kord6hmSfkoXMO7ZGs5C8b3OTurRLKBqSACtMXUIaDdY_qf5FcrhCK13dOA1Qf7yynEto5cp8iXv28884SMwq8YYRDOKtcDtLOLIU/Br5c8jIW-eQ2ylt3B0HIjQr79pDDzdphko2ZLNPk_-w),Discover a wide range of Men's Clothing within our Apparel &amp; Accessories selection. Browse the best Men's Clothing available.,Shop Men's Clothing | Latest Trends & Affordable Prices,"Browse our premium collection of men's clothing. Shop top styles, quality brands, and exclusive deals online today!","men's clothing,buy men's clothing,men's clothing online"
Accessories,Apparel & Accessories,accessories Clothing.png (https://v5.airtableusercontent.com/v3/u/43/43/1753113600000/rNTyVFmGb67rGH_ruuEekg/dJQHnXl6gJDtkgy9TnvH53xDILeOASGtF3G7gFDzkTihgPZ4h-oz1S03OFKZprKUo3UvN0nZU9DVQ8dS2TKc3PwuZ5qCPQQWb8_Rjdy5GrTB5Gky4sSxLo8wm-ytcPYKNwJwktNkUn-IA6MKnSlyhaDxiEHZv2Ya8kRHfeMwObw/lhJIu9zj6f7oH9pxgorhf8Su7xfhXFf141FJVh0K-ow),Discover a wide range of Accessories within our Apparel &amp; Accessories selection. Browse the best Accessories available.,Shop Accessories | Latest Trends & Affordable Prices,"Browse our premium collection of accessories. Shop top styles, quality brands, and exclusive deals online today!","accessories,buy accessories,accessories online"
Kids' Clothing,Apparel & Accessories,kids Clothing.png (https://v5.airtableusercontent.com/v3/u/43/43/1753113600000/IdkiaWz_8ch0tJuvILothw/SemFR8sazvrQZd8ZWK8R3GAelhf8zORVHJ3ziHG6ACGgfiiejFOVIuq8pmG-WAXoNA1nsn5fxdT49YFsFImX0NUnSGFVy8iKzGiGc8QNna1zXnjhfpWXgn1fbbvs83qEkDM727WGs1m56W491Ma1c7v-pBOyyGAdjj8_6l2tKIg/SZVhyzPC_BCVaBxSyZm3TbjWN1QpAmhCHkkpHVSLOUQ),Discover a wide range of Kids' Clothing within our Apparel &amp; Accessories selection. Browse the best Kids' Clothing available.,Shop Kids' Clothing | Latest Trends & Affordable Prices,"Browse our premium collection of kids' clothing. Shop top styles, quality brands, and exclusive deals online today!","kids' clothing,buy kids' clothing,kids' clothing online"
Footware,Apparel & Accessories,shoes Clothing.png (https://v5.airtableusercontent.com/v3/u/43/43/1753113600000/uBWDK3IFFvVgyGUyxKb0Vw/25BZ79E9s3uO6m56xjp-6R82bx80XwWDz8q7fsRm6orTHGcgrvHpNQnX7gKoRmymmnSUD8aRG40725PKw8ztbwvVHBWiLi50lYCC_GThEz1EhwNyxpwyqLOnk95BfqRN0NbcS5rP8yqfyrbQNgGWt07BsxcpZWpkARZRNgMdbkM/GM-siItaPse-itD-K0aVIsm4cdeF7TbtQKyKpiQ8DGk),Discover a wide range of Shoes within our Apparel &amp; Accessories selection. Browse the best Shoes available.,Shop Shoes | Latest Trends & Affordable Prices,"Browse our premium collection of shoes. Shop top styles, quality brands, and exclusive deals online today!","shoes,buy shoes,shoes online"
TV & Home Theater,Electronics,TV & Home Theater.png (https://v5.airtableusercontent.com/v3/u/43/43/1753113600000/R-9La3YyY3Gvp4HbgGuJ4w/p_aVvqI_NGgJnzafnUIECGyo_46hVtmJ5uEqwIGFI7AsVlEu_0lmVxoNmr9BxcoDSe-L9aKMpwS8AKe98YWW0xg5_XLKSC1d86j2bSxb_K2Kl5zz9YGUe6POBq0uAm6gipX_v7VEaTAky1eNCDCvAWmoBKetglU34WqvZpdUULA/T5LLCWZmt-0rkwwvpuef5mgdeC0IS4jqZ8URFUFS9w0),Discover a wide range of TV &amp; Home Theater within our Electronics selection. Browse the best TV &amp; Home Theater available.,Shop TV & Home Theater | Latest Trends & Affordable Prices,"Browse our premium collection of tv & home theater. Shop top styles, quality brands, and exclusive deals online today!","tv & home theater,buy tv & home theater,tv & home theater online"
Audio,Electronics,Audio.png (https://v5.airtableusercontent.com/v3/u/43/43/1753113600000/rP1Xulm6IJkFO8elbhbyCg/ep8I3Ky7MJDYSgLVJ5lxFVedVWCx1v6FkAMgHUGqlaok2RAk3AKyVd6YRyT3L6NBYVnzR7w2w-FTKYUjtchKeUOH5cjR3H293u_XDNcsGE3zOYnBTeFx71zvxI6NVJxXNctn-UVqYfw7rcWBtXAW8w/Fini2eK8X8_rmXTu9Km-WSGTu6m5_p8l6Yj-uzdgoDg),Discover a wide range of Audio within our Electronics selection. Browse the best Audio available.,Shop Audio | Latest Trends & Affordable Prices,"Browse our premium collection of audio. Shop top styles, quality brands, and exclusive deals online today!","audio,buy audio,audio online"
Cables & Adapters,Electronics,Cables.png (https://v5.airtableusercontent.com/v3/u/43/43/1753113600000/ohEOacJ7OsEzIRNZfNSowA/LO5poVqtdYwkvrsZHJdXkI5OAdeu811E7sDGXn4-WwuDUd7cmGK9F4cV3XfjrwvdqbgbtZhJZsZnll5wx88j9qAKHZh2GEvkP4VpcIKfgvlAppljxh3EMd1XoJt6HybUMZ1R8SRotYfa8TGsJODLb6rYrwS2ywdTa_D-yOzkzRo/99BdQght-C7bfLv7Gfp2C_r9twEWyUa2i13_birBfXs),Discover a wide range of Cables &amp; Adapters within our Electronics selection. Browse the best Cables &amp; Adapters available.,Shop Cables & Adapters | Latest Trends & Affordable Prices,"Browse our premium collection of cables & adapters. Shop top styles, quality brands, and exclusive deals online today!","cables & adapters,buy cables & adapters,cables & adapters online"
Computer Accessories,Electronics,Computer Accessories.png (https://v5.airtableusercontent.com/v3/u/43/43/1753113600000/ReZjYcsxw94HBrf8Qr0feg/sXvcTtzmrRzqlZ3K65vRzPNVHs8WiwvGVpEV9TseSfWt1pDdUITyKhQYPZ811bJIi1h2KUKt3kh4uG2FFNd0NjlnvwQsiYcRFyfiZNZRvzxntPlUwcnL3YFIZHqmtt1CLzvvmHXkXaT5pJq9HUVFHvaJaMdcCSIB7QIr-qqAPDQ/Eh90Fv3MMk_IsIwt6EdmLYKWNsvUFUmDF7ogMQeUNnQ),Discover a wide range of Computer Accessories within our Electronics selection. Browse the best Computer Accessories available.,Shop Computer Accessories | Latest Trends & Affordable Prices,"Browse our premium collection of computer accessories. Shop top styles, quality brands, and exclusive deals online today!","computer accessories,buy computer accessories,computer accessories online"
Batteries,Electronics,Batteries.png (https://v5.airtableusercontent.com/v3/u/43/43/1753113600000/hgI9PoK4Bv0W68mgBIfWkg/qOC7rHvZfDQZWwICx7py06U8S4KY452--JaSJJWJUY4gWPUTB7NAPRA13OTkyfvVIWbqpAd7CqyFMCzALoA1sycUC-gwLAryBUo4iwQOpYTlDudY-6baFmGXNltztE3u66T2Ov_08_7fnm_1fCK0VPoVSwLN655R6JbVd2Fb5Fg/O9QYZczIsNYHYcOILbSZQ1pPG05qxJVv4rl4Ne_5ALo),Discover a wide range of Batteries within our Electronics selection. Browse the best Batteries available.,Shop Batteries | Latest Trends & Affordable Prices,"Browse our premium collection of batteries. Shop top styles, quality brands, and exclusive deals online today!","batteries,buy batteries,batteries online"
Computers & Laptops,Electronics,Computers & Laptops.png (https://v5.airtableusercontent.com/v3/u/43/43/1753113600000/cEN5q5_Avl0WCbxN1hpTmw/g_LZwyjwNtmwFPi8XW7DIfF2V1wKH_ZatcZXmmWq066wcDL1Ykst1krfJoANbhcs9Y_QTzdueENNDU2Hx0fv7yAfBAKQ4WQKTHP9cZusVSTT4-gDoaeanM9SWwOV4-FCx5ynsXQXDoSF9l-_TpxFdF00k_mZzFPzPsveFY6zijw/1R3STP021CS5800yl291BMMaCsaJwKsFEaBSvvHYnl8),Discover a wide range of Computers &amp; Laptops within our Electronics selection. Browse the best Computers &amp; Laptops available.,Shop Computers & Laptops | Latest Trends & Affordable Prices,"Browse our premium collection of computers & laptops. Shop top styles, quality brands, and exclusive deals online today!","computers & laptops,buy computers & laptops,computers & laptops online"
Storage Devices,Electronics,Storage.png (https://v5.airtableusercontent.com/v3/u/43/43/1753113600000/1Vye1BSFnS6EITabvxDxPw/iRVvJPCQskT0b7iuso1Zj2Me-5n7-QK8eJ4AsQoSYLFD8kYM_D-0EZDmpe22i7gt2XC7eLXNeJBPOtqRGP8RUiWfhhmB3X-ZkwH8X9EFS_HtNBWA01i9sL_ZH13Rc2FMBYdKfu05fWvbw26IPutZjgGRTc_Q3BhYTv7bpU6_S4U/Ok2r4ql5RWyA0ExwGo-CKiaDFJSl5I6QHivYjy8dM4k),Discover a wide range of Storage Devices within our Electronics selection. Browse the best Storage Devices available.,Shop Storage Devices | Latest Trends & Affordable Prices,"Browse our premium collection of storage devices. Shop top styles, quality brands, and exclusive deals online today!","storage devices,buy storage devices,storage devices online"
Gaming,Electronics,Gaming.png (https://v5.airtableusercontent.com/v3/u/43/43/1753113600000/9cT6KX9D9v9VoxBipS4crQ/WtdIATFhrthNuUEpn2MMetIHqDKYhXZhH7h8AMsOods1eJ_rY26X0JQdpUTsf0x3pRZKvxxgiFuWIWO6FXYiiSqseuSkcXZYqC3NWDS36t8mhLHlvqr3TyQFctONJXnYBWE7LhwRtppeVBdZIBxrnihJ7cPIp0sDGexxu6agNP4/fx6MD_2Ae5UkcNbxMKrZ_nDWGbgVezNfYQ9qG91POPw),Discover a wide range of Gaming within our Electronics selection. Browse the best Gaming available.,Shop Gaming | Latest Trends & Affordable Prices,"Browse our premium collection of gaming. Shop top styles, quality brands, and exclusive deals online today!","gaming,buy gaming,gaming online"
Smartphones & Accessories,Electronics,Smartphones & Accessories.png (https://v5.airtableusercontent.com/v3/u/43/43/1753113600000/x-Z4H-7xE2wthFXdHlmZfA/kFnsxiZTTInrVepBUaV2TqhITDNqTKnuFRt3ZmnGFj-WbkgTS7_nUXetMd-JvSbjx5HooTUUyC72k_o-NA1wV4Yh4NLLyEBKiLwJMMHomge4IUGPvKQvGfoNxZA-cYVgdbfRRUejqYtegSUjUU_HKduPmnPokiN4RKhYmfaIQSZ8WYQpTA_SI9HxwMI_gd53/YWoE-a2GeQ6F_lJ7TrL-Ro7KYojmXOrDBhAYKAXBDeA),Discover a wide range of Smartphones &amp; Accessories within our Electronics selection. Browse the best Smartphones &amp; Accessories available.,Shop Smartphones & Accessories | Latest Trends & Affordable Prices,"Browse our premium collection of smartphones & accessories. Shop top styles, quality brands, and exclusive deals online today!","smartphones & accessories,buy smartphones & accessories,smartphones & accessories online"
Cameras & Photography,Electronics,Camera.png (https://v5.airtableusercontent.com/v3/u/43/43/1753113600000/iahRkNFU4LQ1IXUXdM19cQ/DHmp9DHikAafMtSeAUxbvPykFbiH1JJUuYTqPcjRMrts7iQViAMD-EtI5wgrdEJ5idfEwVTtKJL6MHk6pnPqczxtUcp88AcZcGO416UlcJ_PVH4Z5pSLMKLmdjG-onyuHf_4m2kJGAD58wzuMgLCU-B21MoJtH6Uz_MtValnExI/TR-Ax6lkklMpSJpyI92gmIIwf6uyIq0PWGK0xrrv8i4),Discover a wide range of Cameras &amp; Photography within our Electronics selection. Browse the best Cameras &amp; Photography available.,Shop Cameras & Photography | Latest Trends & Affordable Prices,"Browse our premium collection of cameras & photography. Shop top styles, quality brands, and exclusive deals online today!","cameras & photography,buy cameras & photography,cameras & photography online"
Smartwatch,Electronics,smartwatch.png (https://v5.airtableusercontent.com/v3/u/43/43/1753113600000/GbO3bB5L6Vi3s0vVzLfs9w/ZKdTaTPkq4CLmWBILoAFqS-f7lj2K5vXUXBTTdstNFiNAcuduFOjmpukbBfLyqNUpi6WaZqrhk_enYM2K3NsFOyxLZFuX0KUynRbH1OCh8hsU1Suo8uPPHzm8wc3kW9lQf_G_fzHpGN1zV4udOh2DbJlRzWi3DnbjKxxBXJKGB0/1Tq-6LYWDpdcw8q6BBSIMJ2XDX7BpOyWSEuxJzQRHq8),"Stay connected, active, and informed with our collection of cutting-edge smartwatches. Track your fitness goals, receive notifications on the go, and access your favourite apps, all from your wrist. With sleek designs from top brands, advanced health monitoring features, and long-lasting battery life, the perfect smartwatch is waiting to streamline your day.","Latest Smartwatches | Apple, Samsung & More","Discover our wide range of smartwatches from leading brands. Track fitness, get notifications, and stay connected. Find your perfect smartwatch today!","Smartwatch,fitness tracker,Apple Watch,Samsung Galaxy Watch,Fitbit,GPS watch,wearable technology,smartwatch for men,smartwatch for women."
Outdoor Furniture,Home & Furniture,72.png (https://v5.airtableusercontent.com/v3/u/43/43/1753113600000/UxMIJTPUkV8z1trOQQHbOg/YDjhdlsMbs0pXrdaHhEItyCG0qjY0TSLPIBMVT7oNS66a25AdLcnfAx0iYHjScYdfvkm36KACCP0fsDlnvM1nMrchBlZwMiQYA-KSdQbwW5cGPEcNnfwZ7nuSCSoinwg80LAHPvsnT3QJhH2-b3t8g/lj7PpHGUStWL5SgN-kmqqZzVe7mO8Z78tGKk-XWBt8M),Discover a wide range of Outdoor Furniture within our Home &amp; Furniture selection. Browse the best Outdoor Furniture available.,Shop Outdoor Furniture | Latest Trends & Affordable Prices,"Browse our premium collection of outdoor furniture. Shop top styles, quality brands, and exclusive deals online today!","outdoor furniture,buy outdoor furniture,outdoor furniture online"
Mirrors,Home & Furniture,Mirrors.png (https://v5.airtableusercontent.com/v3/u/43/43/1753113600000/o6akXAfZkV9GhuMl6ERobQ/iiDQ8dx0zx6421o3pFQLyFI42aNUeTghHUxpTgoYRQthkKbRaobj7k82f10ys4fE33z4LIBa2l3lmP7XU5xegZ10o1RUIqZ8Pzyx90RgqSlxMHyMF6p6ZTDYu3eB3Y85YWVS-JFcK1EJXH4V8Rm9wb1ql5UX9066KTvAuesvoTw/pnz0QElgSVP3U0KjlEYiF2AttWUyC-tIPX86ws8k8D0),Discover a wide range of Mirrors within our Home &amp; Furniture selection. Browse the best Mirrors available.,Shop Mirrors | Latest Trends & Affordable Prices,"Browse our premium collection of mirrors. Shop top styles, quality brands, and exclusive deals online today!","mirrors,buy mirrors,mirrors online"
Kitchen & Dining,Home & Furniture,Kitchen and dinnning.png (https://v5.airtableusercontent.com/v3/u/43/43/1753113600000/q0wDNKjX8-lQiWFAIoRjAA/EBEvKsPxxorg6sPnzjwjXGrTmBbwA8FkKUz-ABWumAGsVR40eTnwt9_tgi-8BnDGAaBDWubFT0K8EfEM0FBJA70NWK9mwuK2QTqHnvmUfmasrpqpxLxklUNMiAAZY_KAXPpKpufXJnl25705Bw2WWBdBhUsO03DR9eFjVzMS4wQ/6LqEhvIqzABGHO_n8ejLfpeCTOW8XOnMq04LwalnCFU),Discover a wide range of Kitchen &amp; Dining within our Home &amp; Furniture selection. Browse the best Kitchen &amp; Dining available.,Shop Kitchen & Dining | Latest Trends & Affordable Prices,"Browse our premium collection of kitchen & dining. Shop top styles, quality brands, and exclusive deals online today!","kitchen & dining,buy kitchen & dining,kitchen & dining online"
Living Room,Home & Furniture,Living Room.png (https://v5.airtableusercontent.com/v3/u/43/43/1753113600000/bV33xnAGVTgJ7j6dHlg-iQ/i1Ab50a2s_omQoDyM0y_HpRsiAi0PQU1GNBz3mBdVJax0CTnEf6YItBHC5Nod1ndmbxtm8Rrr3pTTHQ1ZQGdQdNhAa5Lq564rvoXqledQoU-bXm5cxxGtuzw1POwY7HDqbb1gnTlVPBah5Xc0q9TutcxXLV-Aq2mfcYe4cCnvFU/p0YFrrXLpAFHUF7PPkPU4Tb8j2Q6jpAVQ4Tf-xUgAb8),Discover a wide range of Living Room within our Home &amp; Furniture selection. Browse the best Living Room available.,Shop Living Room | Latest Trends & Affordable Prices,"Browse our premium collection of living room. Shop top styles, quality brands, and exclusive deals online today!","living room,buy living room,living room online"
Bedding,Home & Furniture,Bedding.png (https://v5.airtableusercontent.com/v3/u/43/43/1753113600000/i9EDDzbudcG8JlE4fVSf1w/1LRlM8RQVcyA3eT7DLUFf1oje0EumfzgvjwAa3aCzy13J1ymEZ8L99TwNJKRABfksWXB8w5MgXNqhOnIpSExp3CkSZfn3cONV6njieTFJjf3a-NIiwsun88b_IpG0PnPEYzH0vqER1cyMz2tbTm-tOVP6_55tQq3wIBB71tWDC0/nV8JBdiyYE6mxTvW3bfKYSVWyx91UhU00jH2hhmOKn4),Discover a wide range of Bedding within our Home &amp; Furniture selection. Browse the best Bedding available.,Shop Bedding | Latest Trends & Affordable Prices,"Browse our premium collection of bedding. Shop top styles, quality brands, and exclusive deals online today!","bedding,buy bedding,bedding online"
Bakeware,Home & Furniture,Bakeware.png (https://v5.airtableusercontent.com/v3/u/43/43/1753113600000/IwR4VFioNVcY1rUQHUvQzA/TKRlhEjw1bDW5P4NWdEvhWds3uB2VjMLbh40W7CDbdVVoXYetS7PYPKKugEtZICpgrMJkRg2uFIAyewwDox-Tq0oFRJmm3Oc5lGBC4_MfFKjr8hltY4XTf2-6uY3owyWDqyUwkAISCYq73GOdgYLLQ0JW5dqa8FqDdsRhs23Rg0/4AyAA3tMdNJTUf0Q9X3eRInEpClwYnRlmKLUY2yRj1c),Discover a wide range of Bakeware within our Home &amp; Furniture selection. Browse the best Bakeware available.,Shop Bakeware | Latest Trends & Affordable Prices,"Browse our premium collection of bakeware. Shop top styles, quality brands, and exclusive deals online today!","bakeware,buy bakeware,bakeware online"
Dinnerware,Home & Furniture,Dinnerware.png (https://v5.airtableusercontent.com/v3/u/43/43/1753113600000/QqoWDMZQnAggrRP8c6pnYQ/BcoSXQ6NQ6J029uvlnxfv_xY-XAXAll3b8nf9vtToNVmbETmRp6snJ-JUJXbypjFclLrXTCJj_OZMn8lVzLlhUCZTBt_6S-X3NiScmhJS0t-Cyp4OmrxLfmw8nIdzHE3_IbsUElt3cC22kvbt1yKBa13xv2lVA131tYtBpaUPGo/XWCO1G6tCMEZVrb0lMY-l6tSxVSjd5rQ6N1Ftx6gZVE),Discover a wide range of Dinnerware within our Home &amp; Furniture selection. Browse the best Dinnerware available.,Shop Dinnerware | Latest Trends & Affordable Prices,"Browse our premium collection of dinnerware. Shop top styles, quality brands, and exclusive deals online today!","dinnerware,buy dinnerware,dinnerware online"
Storage,Home & Furniture,Storage.png (https://v5.airtableusercontent.com/v3/u/43/43/1753113600000/niJcojjfHJutcmYy44OmUw/BWB-hCpOTLTkiPZ4a9vazVWAQutKtN4uvjB2HDFO-0F_aVmMuKMf1Y9BQwnC0xf6dOQIWpUVwj_DUXpr6VU1wa4EFLPgTWAxi3fU9c0-xFYErV1WAUjX5SHtCl7CYPDS9JIIuDj6QHCRoqhaM_DnwPqPAaTB-5ykcaCnGryP5v8/abQMZ4qQGZWxSGSZTRusQfAVugBEAZ1LMrzD0ufsdwE),Discover a wide range of Storage within our Home &amp; Furniture selection. Browse the best Storage available.,Shop Storage | Latest Trends & Affordable Prices,"Browse our premium collection of storage. Shop top styles, quality brands, and exclusive deals online today!","storage,buy storage,storage online"
Wall Art,Home & Furniture,Wall aRt.png (https://v5.airtableusercontent.com/v3/u/43/43/1753113600000/N3fl_joB3TWyk4hzAnxAWA/2AMXTXPtsfARwKtRalWnIjZ-3GjEfDAzv5A7YRdFm4b06bJeLvm0SjRktdUttWaLzvdbZR5D8Di8p2iKGd5w8SBlmDA16UqIW0o64CFp7fE-WCdsuOHv3Amub1d1Vl1Ea7CxUajByJA0MqF0KUGWL0HlZl3ODwW98eOMtbZbrds/Jgwj67VLf8__jUjseXcGhB8QaLXA9Kncg0LMx-iBJAI),Discover a wide range of Wall Art within our Home &amp; Furniture selection. Browse the best Wall Art available.,Shop Wall Art | Latest Trends & Affordable Prices,"Browse our premium collection of wall art. Shop top styles, quality brands, and exclusive deals online today!","wall art,buy wall art,wall art online"
Cookware,Home & Furniture,Cookware.png (https://v5.airtableusercontent.com/v3/u/43/43/1753113600000/aFH6jFSVRQ9RnrR01bJBfQ/b0Ut6S7s2-tZ43jx2tbd4DfIF6A6hW8T1GhgESAD1CyRqs5nZAv4XH5V60g0tP9Ot_AKtMwihB_8OksVYoKKwAwCd03JsvfZ9v9oyNeUV82QLbs2SyA3LX33e2RqqPFs_lCH8Pz3svlCQbgSsN54wYx2uCxpMwiV9c-rbrGIVZY/DjHV-iBiYPk92idAxnjgcGX3MUt1qmcdwDFWQgguHIE),Discover a wide range of Cookware within our Home &amp; Furniture selection. Browse the best Cookware available.,Shop Cookware | Latest Trends & Affordable Prices,"Browse our premium collection of cookware. Shop top styles, quality brands, and exclusive deals online today!","cookware,buy cookware,cookware online"
