Category,Parent Category,Photo,Description,SEO Title,SEO Meta description,Focus keyword
Sun Protection,Sports & Outdoors,camping-tents-shelters.png (https://v5.airtableusercontent.com/v3/u/43/43/1753113600000/6lzdGIIq0P1aAFsyCTSNiA/H1Xr-ftl8mdsJMxzzgBClCQu1CrnEm396JZou5cb7G1AkrJWecF8wqU77Xm7lIUgrlSkHvsYmcDp_b6GSPsnQBagQXOQneFfO0fhnwrb0xupFImU1RucXcJ64dmhCOEyizAWxrzc55k_a4Fq0XmPce9-OuUmIGKB8dCkUfPuXhzCjw37E-65_YMfYDPgPgl7/ycvFsH0pWylNBV7bH6wITQu24ZJimFudzCK-erUDlMg),"The sun is shining high over Mississauga, and it's the perfect day to be outside. Whether you're heading to a park, relaxing by Lake Ontario, or just enjoying your backyard, shielding your skin is the most important thing you can do. Our curated collection of sun care essentials provides complete, dermatologist-recommended protection for you and your entire family.",Sunscreen & SPF Sun Care | UVA/UVB Protection | 4more,"Enjoy the summer sun safely! Shield your skin with our top-rated UVA/UVB sunscreens. Find lightweight, mineral & water-resistant options for the whole family at 4more. Fast shipping across Canada.","Sunscreen,Sun Protection,Sun Care,SPF,Sunscreen Canada,4more Sun Care"
Movies & TV,Books & Media,Movies.png (https://v5.airtableusercontent.com/v3/u/43/43/1753113600000/4djXnBgiNr4T5dI9EKY82w/z6sPyGZupZ30XJy74-s_yH3buKSldKD569UXhJzZhRHlCLL4dDzFsGyLpMIkW3f7A5vavT-G60718vZCuBlsRLxl5k9lzpYD_iurEYOLCOuW320J6xyamtW-5upK6WLToY2XXCJqq0UR60mT7P90MhYKPPSWOZIpoRqqLHHcJaA/sxcLoQq7H9Mel_kHPb6z0Fn1uVOs9UqZb5wpIkAxkFE),Discover a wide range of Movies &amp; TV within our Books &amp; Media selection. Browse the best Movies &amp; TV available.,Shop Movies & TV | Latest Trends & Affordable Prices,"Browse our premium collection of movies & tv. Shop top styles, quality brands, and exclusive deals online today!","movies & tv,buy movies & tv,movies & tv online"
Music,Books & Media,Music.png (https://v5.airtableusercontent.com/v3/u/43/43/1753113600000/QIMk-3nC0b6gAEgi9HcBiw/Se2ejc4W-v6VF3qnDJALgOV2vfJuAjZZDBC1pXxvjpH7x5-WGJHLOEvf1Rcmos-U3Ua_xDvsnFpim3Hb7APsGr7FH45g2re-14nEtNu0M6ANhIKhVhZ16Se07tL5f_rlns3RMNbjO-ddtnIM3Ztozg/XScUYG5nfW5wt6--in3PW3CZS3VZFLajn8z2deKOj0A),Discover a wide range of Music within our Books &amp; Media selection. Browse the best Music available.,Shop Music | Latest Trends & Affordable Prices,"Browse our premium collection of music. Shop top styles, quality brands, and exclusive deals online today!","music,buy music,music online"
Books,Books & Media,Books.png (https://v5.airtableusercontent.com/v3/u/43/43/1753113600000/YqJn6E9MGXoGPDHGXbE9Hg/x3wBvq1cGNPCuLu0VCF90OFogqmNmgfst4XOqOO3l76OxEUX_TvDj7RJrF8Ff0CFewyN1W-Et4pzOY2oFJoO4-ubUoKbU-1_ebQZQI9EG9llyNMTBL2sMVAjiQv5Lg_dZMVSiMLyW8yCs-SQnhw9WQ/uV3_PFkWoOunfVLKybMqVhiVQ2Fwkhyx7D5ENjuBxq4),Discover a wide range of Books within our Books &amp; Media selection. Browse the best Books available.,Shop Books | Latest Trends & Affordable Prices,"Browse our premium collection of books. Shop top styles, quality brands, and exclusive deals online today!","books,buy books,books online"
Video Games,Books & Media,Viedeo Games.png (https://v5.airtableusercontent.com/v3/u/43/43/1753113600000/hJ19HUol4u-zTmd6j7L_Qw/aSvZDSQyuYi09XsbwDUkB-WpxKwvAWLkYYt9qsn-0Bn5zq_f0_DBgALGH5Dpf7ZDMrhjBKYB1_k_JyJws45jOFcY7ZARyy_P-K0zJo5bWVVfuLGAfWvAwcbz6bWeN4bghXPtPjGI_Bx2r6yUAt9Qwb9OGbbhZN8PAIEwQYAcoDQ/n4VR38S0oONodD194_fY06kERG9ug1hvIYAByWUiWUE),Discover a wide range of Video Games within our Books &amp; Media selection. Browse the best Video Games available.,Shop Video Games | Latest Trends & Affordable Prices,"Browse our premium collection of video games. Shop top styles, quality brands, and exclusive deals online today!","video games,buy video games,video games online"
Building Toys,Toys & Games,Toys.png (https://v5.airtableusercontent.com/v3/u/43/43/1753113600000/WkUst4Ii7PWF70GEuhefEA/ufkCXv3cqm89skeh6bpg2m4gZB2TRYW4ZJZqowu-hZa7xFb_3sh87cUzvEjQlJpsO_TTh2dikaZ29YndwoJ5SX2pPkFR4QFAeUmnPNRVG7LUPZsbACNcAxaGRYsCJYt9XRXCMVj4CYeiO6jhOos1_Q/Q84MRtO_1gwkPMZnbsvRsgDDsolXwCQF9IxutaM6g8Y),Discover a wide range of Building Toys within our Toys &amp; Games selection. Browse the best Building Toys available.,Shop Building Toys | Latest Trends & Affordable Prices,"Browse our premium collection of building toys. Shop top styles, quality brands, and exclusive deals online today!","building toys,buy building toys,building toys online"
Action Figures,Toys & Games,Action Figures.png (https://v5.airtableusercontent.com/v3/u/43/43/1753113600000/nvu4JTLK3PQzypzQNjsU6g/PIs2cWzC9NxzP69oNObq3Wm4cSUS00UJacOumlCYbbExFzwIN1PVdc1oI-ZW9h8VMFZvQrew_PVc7_u8c00jPyvIwnCOFYvdwG4HqqFdT4Axo7GdTWE40QpXvJQSNSfbQTuIt42VwYX4OC_Hwu0wuM8Yw93jwjtDGx7qC-DAB_U/dYXJYFFuZKRdaOieLz-yQLR_NL9NAbqsGGHt3uIwGRM),Discover a wide range of Action Figures within our Toys &amp; Games selection. Browse the best Action Figures available.,Shop Action Figures | Latest Trends & Affordable Prices,"Browse our premium collection of action figures. Shop top styles, quality brands, and exclusive deals online today!","action figures,buy action figures,action figures online"
Card Games,Toys & Games,CArd Toys.png (https://v5.airtableusercontent.com/v3/u/43/43/1753113600000/Khw72I-a9QFmYuHFRztmXw/sb7ILqGGNG_ed8iyqm_z3NjbOMVqF4VCkj65p_CwvkeiIG8UtRNr2jJCm4YoWaJ2nGVW877nNpPjJPdCtT_UauXWHq5197rf9z2pE4Bb4aeHjJJmnpFjfQgxHOE4t18FBa-w5Xf66CRC7fLvRMnJd9mhk-Lkhes6OwrzqVN3O_k/m8e_TYVrrZvx_48UZ57m3d2hX_jkGFMRuj6n7NRmN8c),Discover a wide range of Card Games within our Toys &amp; Games selection. Browse the best Card Games available.,Shop Card Games | Latest Trends & Affordable Prices,"Browse our premium collection of card games. Shop top styles, quality brands, and exclusive deals online today!","card games,buy card games,card games online"
Puzzles,Toys & Games,Puzzles.png (https://v5.airtableusercontent.com/v3/u/43/43/1753113600000/jpSBvQk6TkgqWKKzOCHN8w/2SY16uyRHWuL-Ppu2hJz6PGUOU2SD6AtNckEWOWH0dDxAqnMS-I-atFykMamN4Hb9YJF34PvW-TaMv9LGCvxYng1rEJpnAsLrRNA7opIwLOkE6vee7RCuPNjdDUb73aKh04e4K94NfP1ceMcRij0LEbOYrw6TAgH_yWOBzgsmZY/JU-jg2SgPqkG4rhUdZw0R1xcQ65D4Cbh2lUPFMSynqg),Discover a wide range of Puzzles within our Toys &amp; Games selection. Browse the best Puzzles available.,Shop Puzzles | Latest Trends & Affordable Prices,"Browse our premium collection of puzzles. Shop top styles, quality brands, and exclusive deals online today!","puzzles,buy puzzles,puzzles online"
Vehicles Toys,Toys & Games,car toys.png (https://v5.airtableusercontent.com/v3/u/43/43/1753113600000/oXXjSiyFnvOe8n7P2MEcUA/MSsgFUYrUDYNhFTZaGPTEjs3glrIXd4x2N-GJEKIVF0bZGlooVQ0-D65NvaYWddF2j33ERffZlKckWOL0Q_Kk7Hd6owtLKfCiNCAyIwQmljtsgVbcg7Rb-Y1Sl0kB1O8O9fC49oZcbp97OvykeOAeXfJoG1dtuh0ex_MjqBBUGs/l0-BWtuy2OnzeWNwpxuuTX1naNtiJyk0VaNjrymdk9s),Discover a wide range of Vehicles within our Toys &amp; Games selection. Browse the best Vehicles available.,Shop Vehicles | Latest Trends & Affordable Prices,"Browse our premium collection of vehicles. Shop top styles, quality brands, and exclusive deals online today!","vehicles,buy vehicles,vehicles online"
Educational Toys,Toys & Games,Educational.png (https://v5.airtableusercontent.com/v3/u/43/43/1753113600000/lfjhBI6tz_Y1ZC3U8V9I_g/t6lmWMd1G7S5pJouNTT_W33hdHRKPpfIXC_295N2i4cMrIV1mbApWrf_WP9tQKJwBg7nkg5oloGRwrd5T_ZfXVLvsM7IH2_V7iTxDLHyYxLiF3GtvUlBBm6e0otDuLKV5Ph0n9XkOA4BoRcUyCwiJ-loXBon25GtH_8kaPMatSU/fjnF5e2mD9BC_qg63glnqNHpVKlOi2IECk6J5dhMefg),Discover a wide range of Educational Toys within our Toys &amp; Games selection. Browse the best Educational Toys available.,Shop Educational Toys | Latest Trends & Affordable Prices,"Browse our premium collection of educational toys. Shop top styles, quality brands, and exclusive deals online today!","educational toys,buy educational toys,educational toys online"
Stuffed Animals & Plush,Toys & Games,plush toys.png (https://v5.airtableusercontent.com/v3/u/43/43/1753113600000/6Z34koyEMUcNWQeXZ7SiGw/t4Cxtja23dOW8IZjlp7JAsF25kxak6c0Vlisq-mcSN5H0VRnfWiPBXqSwUefrTrp13JWrnuywm9QaAN8hOjjSwQ68MJklYZECdjM_TZw4pDsmZJFfUHTWqQDC_-MopTItlX_GdDi_c_tXkUhUGssjWi43eyi7dSuaoEDrhWpdtI/x5nyc4ydv8rg3cIKYcl0yfNLF_DmlB17MvYtsXBuek8),Discover a wide range of Plush Toys within our Toys &amp; Games selection. Browse the best Plush Toys available.,Shop Stuffed Animals & Plush | Latest Trends & Affordable Prices,"Browse our premium collection of stuffed animals & plush. Shop top styles, quality brands, and exclusive deals online today!","stuffed animals & plush,buy stuffed animals & plush,stuffed animals & plush online"
Board Games,Toys & Games,Board games.png (https://v5.airtableusercontent.com/v3/u/43/43/1753113600000/O2zkNA7usyX9yXT0J8JDvg/mTbzGpbmnOUARANaonh0UcmlIyjHl5q_Yj1bTQ0V_2KLamnbEVZm9NxxLunjBc5rWy1MEKJp6ynkJLvDmj4J_RKVHAdBBbovlTHvnK63_xtP55XBVDbOPcvzdqJw7loTb3mIHBitBMO59rkdSMNeNhp6kRl__Gzoc1KnrIfl4io/FOHkJbRS3zoqq3hA7ugz0v80rvYZUGjK2K_w-27FcAw),Discover a wide range of Board Games within our Toys &amp; Games selection. Browse the best Board Games available.,Shop Board Games | Latest Trends & Affordable Prices,"Browse our premium collection of board games. Shop top styles, quality brands, and exclusive deals online today!","board games,buy board games,board games online"
Outdoor Play,Toys & Games,Outdoor Play.png (https://v5.airtableusercontent.com/v3/u/43/43/1753113600000/r_oxECMPjynrJTJ3UikFLA/HOxKl_TJCqcZ2XWgWdlNxZExzZdTGCked59A_0VZxXBQKntmlNAg5TYLbvf9YvZr6yBJEbOeikLf_4wauM9yrdu29O-rqKFglOpCBEgskZsdnhKHG9BhNkD788lp-vQ0A0vOLKfB15j7f2B1K_6lksw01jw5X0NAjjhP8KY236E/y8zIVofB2I_CUPt400fbxUpWDYndJlHXYuc-C8q5hZE),Discover a wide range of Outdoor Play within our Toys &amp; Games selection. Browse the best Outdoor Play available.,Shop Outdoor Play | Latest Trends & Affordable Prices,"Browse our premium collection of outdoor play. Shop top styles, quality brands, and exclusive deals online today!","outdoor play,buy outdoor play,outdoor play online"
Dolls & Accessories,Toys & Games,Dolls.png (https://v5.airtableusercontent.com/v3/u/43/43/1753113600000/G0Jnx8So13e3MJgjfK8MpA/GlKakOv6CsnY-R6vjqoYRe8kOdTmPZqXHycOaDIfgAtnRuHsZJyXwTOnvLz0ZuihsGpjy4pU-zBZ-nACQsuy_8yQ6y9T_Vh6h2amG7H6GUaDhEpaZHYKhpZDwfRcAal6Jf9aSAyR0hF8dFQ3TqpRwQ/NhmoCpJZCJ-0TAt61PG6k7-xat_mmUzixy8q8y2pPtU),Discover a wide range of Dolls &amp; Accessories within our Toys &amp; Games selection. Browse the best Dolls &amp; Accessories available.,Shop Dolls & Accessories | Latest Trends & Affordable Prices,"Browse our premium collection of dolls & accessories. Shop top styles, quality brands, and exclusive deals online today!","dolls & accessories,buy dolls & accessories,dolls & accessories online"
Dress Up & Pretend Play,Toys & Games,Dress Up & Pretend Play.png (https://v5.airtableusercontent.com/v3/u/43/43/1753113600000/phbkb0i3hoU7pzNob6tEmQ/krB60Nw8-mw6UvhZOAhxX1tcoW04CM94cpEPOxTWY_Mn1TRFn4jl8yg3uR31n__nAvrc7zOUhcRovWutq6APz_Tsbuma2qmuytXDxFBuf1X0LUoeKqxLJUkJMqvKtUHKg8AG_GoAi3DSpQ8feS5RemPWZQ3nnFCxzoi9XXFVGSc/-N0Mzrmp7iXWV4jhKZ5flP5DnVy1LsqH0d-Ti-veZi0),"Unlock a world of imagination with our enchanting collection of dress-up and pretend play costumes and accessories. From brave superheroes and magical princesses to dedicated community helpers, our outfits spark creativity and endless adventures. Perfect for parties, playtime, or any day that needs a little magic, these high-quality costumes are designed for comfort and durability. Watch your child's confidence and storytelling skills grow as they step into new roles and create their own worlds.",Kids' Dress Up Costumes & Pretend Play Sets,"Spark your child's imagination with our fun dress-up and pretend play collection. Find costumes, accessories, and play sets for hours of creative fun.","Dress up costumes,pretend play,kids costumes,princess dress,superhero costume,career costumes,imaginative play,costume accessories,play food,kitchen set."
Collectible Toys,Toys & Games,Collectible Toys.png (https://v5.airtableusercontent.com/v3/u/43/43/1753113600000/Ve1zZpSl2cVUhjuGSgL2NQ/vRtvPPO7FZRTF-sp0ptZcHqiu4toawEN00V2oztGPu9C7Rp6_eGCyQqVBNkJFO2b-b1_OD9r9Gc-7TWRIYDIwM0CMqjg9HoFmiNTbtODp-4MVRmdPPSgO9TNqmiihGoYVmGpibvAQ2ZTIkrX1am3uJ1XkBGslUWMxsc5OPB6HcY/T1rS-MjaKB08Jj1-aVVhERoOnP-MFZdKVu2C2u02oKk),"For the passionate fan and the dedicated collector, our selection of collectible toys is your ultimate destination. Discover rare finds, limited editions, and the latest releases from the most sought-after brands and franchises. From meticulously detailed action figures and vinyl art toys to blind boxes full of surprises, each item is a treasure waiting to be unearthed. Build your collection and celebrate the characters and stories you love.","Collectible Toys, Action Figures & Limited Editions","Find rare and exclusive collectible toys and figures. Shop the latest Funko Pops, action figures, and limited edition items to complete your collection.","Collectible toys,action figures,vinyl toys,Funko Pop,limited edition toys,blind box toys,anime figures,movie collectibles,designer toys,trading figures."
Electronics for Kids,Toys & Games,Electronics for Kids.png (https://v5.airtableusercontent.com/v3/u/43/43/1753113600000/Rpkkkfdw-hzzu5yRbG_vCA/TA2mBwU0_g3sCTjniOZ-ufDSWqXs85vSWZKrtMrNIt7Zy4UTmcfyxH-DjofEof3u-X6LOOB8kNqIwNF7lIX4pOAE4ZFytGEDTnkDk-F7TC4dMrsJtfcBeMULlMjbPrZXPvH8C0Rjgc8_SuSbK9go77oeGKPbSui6efCC00pYxn4/sg8LAkWrZ53ntjJFbqEUO9eReDsvE7CzXDQ-Zy8fmPk),"Introduce your child to the world of technology with our curated selection of fun and educational electronics for kids. From interactive learning tablets and first cameras to kid-safe headphones and smartwatches, our gadgets are designed to be engaging, durable, and parent-approved. These toys blend fun with foundational STEM skills, encouraging curiosity and creativity in a safe environment. Power up their playtime with electronics they'll love and you'll trust.",Educational & Fun Electronics for Kids | Tablets & Toys,"Shop safe and engaging electronics for kids. Discover learning tablets, cameras, smartwatches, and STEM toys that make learning fun.","Electronics for kids,kids tablets,educational toys,VTech,LeapFrog,kids camera,kids smartwatch,STEM toys,robots for kids,walkie talkies."
"Bikes, Scooters & Ride-Ons",Toys & Games,"""Bikes, Scooters & Ride-Ons.png (https://v5.airtableusercontent.com/v3/u/43/43/1753113600000/kPoAkGZBf5z6VLAv2sm0vQ/tUYriZrrSWj6jSVkmCleTGg_c5mI0O-hdSZ_RzV6Pbh3561mGMzDmJ1ZNVCY6EVPlGkVHX_pvDhWwGtk2hfjgYMmYwQ3nG9EXWAd0jQ4TD62BYz1bopWPGms4jg4aYeyowvmIveC3L728beIcYAi6AU08kLCU8HI_lLRK4Nh_14/v2zm3lBL87FmbCnit_cPXZU6d0p4RPHdI3hdXu-puJw)""","Get ready to roll! Our collection of bikes, scooters, and ride-ons is all about powering outdoor adventures and active fun. From their very first balance bike to rugged mountain bikes and zippy electric scooters, we have the perfect ride for every age and stage. Featuring trusted brands, top safety features, and cool designs, our ride-on toys are built for making memories. Give them the keys to exploration and watch them go!","Kids' Bikes, Scooters & Ride-On Toys","Find the perfect ride for your child! Shop a wide selection of kids' bikes, scooters, and ride-on toys. Safe, durable, and built for adventure.","Kids bikes,scooters for kids,ride-on toys,balance bike,tricycle,electric scooter,kids helmet,wagons for kids,go-karts,ride-ons."
Musical Instruments,Toys & Games,Musical Instruments.png (https://v5.airtableusercontent.com/v3/u/43/43/1753113600000/rmGLENyO7dauKJGk793oRw/OrHntETndUaftPFiGNUEEtcuUqVbwWgtQHRc65P0e2du7VxX3uafWpdTFxzLv-380V7lUeIdWjoGXzLtd_nIQq2d1GSztGvHbtIggDwGtMsYu-QoBU0sKW2znpVOeOiSAklannv0y2WL3ZhlrjFrcHySeicSXRcCpCsyChhbvkg/E3ZknoPqwq1O6VA5y3EYJw08gX72PtGpQkF5CJfd3mE),"Discover the joy of music with our wide array of musical instruments for all ages and skill levels. Whether you're a budding musician or looking for the perfect first instrument for your child, our collection has you covered. Explore everything from acoustic guitars and digital keyboards to ukuleles and drum kits. Made with quality craftsmanship, our instruments are the perfect way to begin a lifelong journey of creativity and rhythm.",Shop Musical Instruments for Beginners & Kids,"Unleash your musical talent! Explore our collection of quality and affordable musical instruments for all ages, including guitars, keyboards, and drums.","Musical instruments,beginner guitar,keyboard piano,ukulele for beginners,kids musical instruments,drum set,violin,digital piano,acoustic guitar,music accessories."
Water & Pool Toys,Toys & Games,Pool Toy.png (https://v5.airtableusercontent.com/v3/u/43/43/1753113600000/Uam5YOpIlgDN9t6iXMTCvg/AMBkFYvkKPtJr9VUfDvrzkymZT7KHvX6QYz6-8WOBIPIi0yWZE0xLAq-HQXOhrbXF9aDlGDmheqITBJZ2DEW_oqudOomYfGKrcuZvkVWWxYDfVE-AkWxxUrUoP2fSBVgWzGEzguJnujsP1pu5mQqTtMZnDnXCM6rrKgOtEoyNjo/cMYGfAqUNZRrNvNv45hj0oCqvmuXKjaWzUAo7VjtDN8),"Make a splash and beat the heat with our exciting selection of water and pool toys! Perfect for the pool, lake, or backyard, our collection includes everything from thrilling water blasters and dive rings to floating games and inflatable sprinklers. Turn any sunny day into a wet and wild adventure with toys designed for endless summer fun.","Fun Water & Pool Toys | Blasters, Sprinklers & Games","Get ready for summer with our awesome water and pool toys! Find water blasters, inflatable sprinklers, dive toys, and more for hours of fun in the sun.","Water toys,pool toys,water guns,inflatable pool toys,dive toys,water sprinklers,floating games,kids pool toys,summer toys."
Bubble & Pool Toys,Toys & Games,bubbles.png (https://v5.airtableusercontent.com/v3/u/43/43/1753113600000/XbZpfZGEl71w-kN4j-78Lg/zo5urN9ClKhADBmCRDzK0L_Qr1kxKApsc5C0kYtHOqf8NXGaKQcdNozN_M0HmU2o7GLlTwXyZcTxOX44jC9FGmMqnUN7FuIj4AvFiBbO0d6WpHhopqPt3sxkXtR4gYhPKpLDl4Rtluo6in04sIMwiiqsaI13BHbBdcjqT4jSeVQ/UK6KjaBDtOI3nSMCRcpUExBr7-X13Eb6EZXFAJWiIoQ),"Make a splash and fill the air with fun! Our collection of bubble and pool toys is all about creating joyful moments and unforgettable summer memories. From giant bubble wands and machines to diving rings, water blasters, and floating games, we have everything to turn a simple day at the pool or in the backyard into an epic adventure.",Fun Bubble Machines & Pool Toys for Kids,"Turn up the fun with our awesome selection of bubble and pool toys! Find bubble machines, dive sticks, water squirters, and more for endless summer fun.","Bubble toys,pool toys,water toys,bubble machine,diving toys,pool games,water blaster,inflatable toys,kids pool toys."
Water & Dive Toys,Toys & Games,Dive Toys.png (https://v5.airtableusercontent.com/v3/u/43/43/1753113600000/6nIeYdoXSF4O2bZ3CUYWnQ/YFKNk1LBzRGhZ1EfahC46KwE0fHJQSOPPVynt0ql3jaE8ZfMxw27Y5YMtx3tBd4kBxe_qFzSHxAlcSfyU-_tjVNAmJi1SmmdpZAANE7U8e-pJItviA3BVcMPX6c2jHHatpdpVus9SBcAOSTLj0Tipq4qhMxgcL0bjh-Vt1hzg3s/AAlPYizrAeAWdBg3uUSMkQf2XIbIDlex9EJQ2xrcitQ),"Encourage underwater exploration and exciting pool games with our fantastic selection of water and dive toys. Perfect for building swimming confidence, our collection includes classic dive rings, torpedoes, and underwater obstacle courses. From casual backyard fun to competitive swim practice, these toys are a must-have for any water enthusiast.",Water & Dive Toys | Underwater Games & Rings,"Make pool time more exciting with our water and dive toys! Great for games and improving swim skills. Shop dive rings, torpedoes, and more.","Dive toys,water toys,pool diving toys,underwater toys,swim-thru rings,dive sticks,torpedo bandits,pool games for kids."
Remote Control Toys,Toys & Games,RC.png (https://v5.airtableusercontent.com/v3/u/43/43/1753113600000/l-HkVD7CfzA8gxDD5k4JCg/AuwaacRcAXOrrbSxDphDGdHmuIGQUK0msZw90vRc42l5KC6ZFo8mS1I4dKVKxk9Bci5YdLveN35sKas5G9XbjphxitD_Klib1ScD14lkhtfGyrkfGIsSGT2AwoSZ6UR5o-SgHYAwehI-MsrKc-9dfw/ZQGSNnBoMQe-9YQbn4bBMDZvauEnAr16R2uzkRvFqVw),"Take control of the action with our thrilling lineup of remote control toys! From high-speed RC cars and all-terrain trucks to acrobatic drones and speedy boats, we have the perfect vehicle for every aspiring driver and pilot. Featuring responsive controls and durable designs, our remote control toys deliver high-octane excitement for kids and hobbyists alike.","Remote Control Toys | RC Cars, Drones & Trucks","Experience the thrill with our remote control toys. Shop a huge selection of high-speed RC cars, flying drones, and rugged trucks. Fun for all ages!","Remote control toys,RC car,drone for kids,RC truck,remote control boat,RC helicopter,hobby RC cars,stunt drone."
Beach Toy,Toys & Games,Beach Toy.png (https://v5.airtableusercontent.com/v3/u/43/43/1753113600000/f1yHisuZ6BQ91qoByK4c7Q/epLxCP3p57BA8LDnNQv6yVJzbt5VZAz-0qL_eDwtFmE1uK7ypGljvxWCw0xBztvxUsIo0aCzNEql0Ha714QHq-y6OXcjXISz1-oIC9RD4SjNaeeHsHeB-sh5b1sokZfpLRZp81AI5leIvu3iEZ91Zu2ZS4k3Q3fETubWZlNRQuE/oo1-or7cu9j7_NqcfnudhMQPrMReGJGJvdfU7PA6d3k),"Get ready for a perfect day of sun, sand, and creativity with our collection of classic beach toys. Build magnificent sandcastles with our durable pails, shovels, and mold sets, or enjoy a classic game with our frisbees and beach balls. Perfect for family vacations and sunny afternoons, our beach toys are essential for making seaside memories.",Shop Beach Toys | Sandcastle & Sand Toy Sets,"Make your beach trip unforgettable with our fun beach toys! Find durable bucket and spade sets, sandcastle molds, and games for kids.","Beach toy,sand toys,bucket and spade set,sandcastle toys,beach games,frisbee,beach ball,kids beach toys,sand molds."
Dairy & Eggs,Grocery & Food,Dairy & Eggs.png (https://v5.airtableusercontent.com/v3/u/43/43/1753113600000/TNrDat4xvHMsXBphALiPHA/7c2ha2so3W5om7I3HFAraqJqWvZP2mPstKx21Cz1_PrXLm2OXKwVkgOcBv5QS4h3nnzAyHA_RW_DP-y21T6RPT67-FLraPCq0qcJWCjE7R6J8uwe8svsVMRjkB5FW8Nm75hWuXoVM26ZgsoSwJddqazKQ4r_tVzSNQtA3UsIiik/KCo8M7l-Ch88AjJK1iRXInBoJkSoEU2oZWRabWvSbJA),Discover a wide range of Dairy &amp; Eggs within our Grocery &amp; Food selection. Browse the best Dairy &amp; Eggs available.,Shop Dairy & Eggs | Latest Trends & Affordable Prices,"Browse our premium collection of dairy & eggs. Shop top styles, quality brands, and exclusive deals online today!","dairy & eggs,buy dairy & eggs,dairy & eggs online"
Beverages,Grocery & Food,Beverages.png (https://v5.airtableusercontent.com/v3/u/43/43/1753113600000/3-VZ3WkJkbXW632QCQmLjA/P8anKjkobt2HtBJV0P6IyL2iafN3GFEn5bnIp680w2Iuaviea5gszo-aUTUmqN3fleGgHyAlaMkS1uOeMNr82fFNFq3hg9CmkMPd_1BUxEl_A5YPkz-22kRqFo4MZiGccCeO_RD72eQ8e1uyFtG0x7bRQuJRyPXDDJt4tkG4prc/nWzBFgxVAWa8YtQFF8cg94dGhAe6iDqbm8JtWUeTZzA),Discover a wide range of Beverages within our Grocery &amp; Food selection. Browse the best Beverages available.,Shop Beverages | Latest Trends & Affordable Prices,"Browse our premium collection of beverages. Shop top styles, quality brands, and exclusive deals online today!","beverages,buy beverages,beverages online"
Pantry,Grocery & Food,Pantry (3).png (https://v5.airtableusercontent.com/v3/u/43/43/1753113600000/6u_hDUFlb0k6KO7Na_BOxQ/Cg5mp89iPytGqcLoEo60h3PBTqwOo8aavE6WVT5zbbts9u9tomNmNK07pX8qSUp5NHcNCHO4qIE2JkTAbAQ81IQYxrXFnrdxoETaEytQwKe1du0gTJzHw0iEADZb89Hs4XWZ6-PD7sChhdS7wVEgN4fWWYi1CgBWnG3JFE6YOtw/lJWCPt3rjoJDEsCa40mfgKc8zdk3lAimD_ow2N-bHbk),Discover a wide range of Pantry within our Grocery &amp; Food selection. Browse the best Pantry available.,Shop Pantry | Latest Trends & Affordable Prices,"Browse our premium collection of pantry. Shop top styles, quality brands, and exclusive deals online today!","pantry,buy pantry,pantry online"
Fresh Produce,Grocery & Food,Fresh Produce.png (https://v5.airtableusercontent.com/v3/u/43/43/1753113600000/QnuegUWA8-9x-qbDd09H9A/CrHVzAEsoa_9lyQCU7iYsCsrXxn7NRqAMvyg1kfVf2m-fc2f4AIqGQfRcELquZPUpi-esQPIGULIIf866piB58A8GWfi9xTNLPmQL65YBKuoSroRFKWYlcDzAfu9akUMBq7gIJYwp2FsI934X7jzbyukuO62t1FFZBFJZwtb6J0/EIhjYHlNqQpI8TJjrU80PCmOJPtui8F_sj3XQkcp7hA),Discover a wide range of Fresh Produce within our Grocery &amp; Food selection. Browse the best Fresh Produce available.,Shop Fresh Produce | Latest Trends & Affordable Prices,"Browse our premium collection of fresh produce. Shop top styles, quality brands, and exclusive deals online today!","fresh produce,buy fresh produce,fresh produce online"
Snacks,Grocery & Food,snacks-plates.png (https://v5.airtableusercontent.com/v3/u/43/43/1753113600000/FTG_eI-zjF7qbo1eyhJjjw/GqqTVZ6Q52Re-mVkNTXozmLjkEQLKNHFfUu82eCzFdIOMIivfM7grYd3Ij_iVA67mxylobuma6WNwTh5WFuER8BDUdKNZdG13-xxROGRbhuANc7vrhJVceKGWmBBz5hDs6kzG_SeIQxV-xtKZFwXvwoVgiv7dPclZuHT4Ny98gk/Frkj2LNQk4HicKjVCABWhEs8dOarmTI7yzb4Dd03n0g),Discover a wide range of Snacks within our Grocery &amp; Food selection. Browse the best Snacks available.,Shop Snacks | Latest Trends & Affordable Prices,"Browse our premium collection of snacks. Shop top styles, quality brands, and exclusive deals online today!","snacks,buy snacks,snacks online"
Spices,Grocery & Food,Spices.png (https://v5.airtableusercontent.com/v3/u/43/43/1753113600000/rkPvhTVvEsZndf_CMK5xjg/5iTpSr9pE7WM3nhH-Dfp2eaDrd4I-4bc2g6S2qj-f07pjRQjEScEWBF5MwFtu9qQOOgUDAUk8f2CRe3Yz1k-z85qsItARl-gLNOWZi3z4n6iTXOE8A2ls4vcgnz_Nw8zW9wAHIiV3kW-lT4MFm1Dz44RowmPbeYX9kXMAFydxmw/mdkvJCFqcVtOFuZqW03xV25MgEKnVS9V8IfEQF0GWVc),"From the aromatic curries of South Asia to zesty Caribbean jerk and savory European classics, the heart of Toronto's incredible food scene is flavour. We believe the best meals start with the best ingredients, which is why we've curated this collection of the world's finest, freshest spices, herbs, and seasonings.",Spices & Seasoning Blends | Shop Global Flavours | 4more,"Transform your cooking with vibrant spices from 4more! Find fresh, authentic flavours—from rich curries to zesty BBQ rubs. Fast shipping in Toronto & across Canada. Get 4more flavour in every dish.","Spices,Herbs and Spices,Seasonings,Buy Spices Online,Spice Store Toronto,4more Spices"
