Category,Parent Category,Photo,Description,SEO Title,SEO Meta description,Focus keyword
Saws,Tools & Accessories,Saws.png (https://v5.airtableusercontent.com/v3/u/43/43/1753113600000/kqTfEeFAV4wXtnrNDzUZkQ/aHMrAl66ztCEEKWUpXeKtqMt7nSxL9rbfNGOG9Zb1e5UtOdXB7jkYg3dhxInbHpS4e_02YqKCCEN1lLqJlLvpUmcM5BtOVjwgKWWQQCMGvH_c3bLJF5Ojpjs_mhx1ITTcsOEICJpz28mf-ltpwQb5Q/_mOzFBzmeZErQQKOIAWWiS7DQlgRT2FouHqazgESrGg),Discover a wide range of Saws within our Tools &amp; Accessories selection. Browse the best Saws available.,Shop Saws | Latest Trends & Affordable Prices,"Browse our premium collection of saws. Shop top styles, quality brands, and exclusive deals online today!","saws,buy saws,saws online"
Fasteners & Adhesives,Tools & Accessories,Fasteners & Adhesives.png (https://v5.airtableusercontent.com/v3/u/43/43/1753113600000/w0gKWIibsc9j8_vQTkStlA/-ITYLlMc6_fggZshrs69CNQ17X13QDWOH4Q5BJtWsU2LB7H-xyROoSIfiARNcQHAK4btB_nRyjBUW3d9KS2Skqcu5RlJjKeyhir8v9TdLtQl6mOo_V_sPAXjImeOLDha5zaF4d0vHlF_KowC9ZRLXQsbluRWSE9JqEs3yGXvFN0/KOJceNzDmC3OBPk4iq85ms3gvy6Oun1C0NhHnM_3xSc),Discover a wide range of Fasteners &amp; Adhesives within our Tools &amp; Accessories selection. Browse the best Fasteners &amp; Adhesives available.,Shop Fasteners & Adhesives | Latest Trends & Affordable Prices,"Browse our premium collection of fasteners & adhesives. Shop top styles, quality brands, and exclusive deals online today!","fasteners & adhesives,buy fasteners & adhesives,fasteners & adhesives online"
Power Tools,Tools & Accessories,Powertools.png (https://v5.airtableusercontent.com/v3/u/43/43/1753113600000/tL3iv0VuhSroCuRtwGahVg/zg6yhalx2cGUBUtpwbwOXnbSys_hc0J7cHQGVgfIYlvZpMSTJ8jhMY_YbBfo-RcTLGh9mt09hACHTJ2R88CqCtkZpz5OWIBbo75kQgneBINybgzXA2IKMOdHtmvlb6go2_ymtD5pSqbFKUF0D410TimwVoCRxkt8mBIQ39oiXM8/pTTOv93v31pacCGvJwDnc2vsIDBIWZXi2ho-LAZbPpU),Discover a wide range of Power Tools within our Tools &amp; Accessories selection. Browse the best Power Tools available.,Shop Power Tools | Latest Trends & Affordable Prices,"Browse our premium collection of power tools. Shop top styles, quality brands, and exclusive deals online today!","power tools,buy power tools,power tools online"
Tools Storage,Tools & Accessories,Tool Storage.png (https://v5.airtableusercontent.com/v3/u/43/43/1753113600000/pIUCZTw4qMhAy-s3bZUVKg/gfr2KT128BfidgufeqO0ckwcxYhxFm_R8Bomy6xlI6KNMmUjLosFPOIrLLIVXNzaklvuD-aH8SFiYo61iIfkMZoTpio9PJpxIHLBb-pouG9O4_9cCzD4ItGTOHjDELOBzsVHHWSz67xzbDn26SEoTUm9jEJjW2smJQr5eM5R0cY/bSzDEP1buPQwrIQWZDm4TU-bnfP29WilX-54T7mkO-0),"Bring order to your workspace with our robust and reliable tool storage solutions. From portable toolboxes and durable rolling chests to wall-mounted organizers and complete garage cabinet systems, we have everything you need to keep your tools secure, organized, and easily accessible. Maximize your efficiency and protect your investment with high-quality storage built to withstand the toughest environments.","Durable Tool Storage | Toolboxes, Chests & Cabinets","Organize your workspace with our heavy-duty tool storage solutions. Shop toolboxes, rolling chests, and garage cabinets. Built to last. Order now!","Tool storage,tool box,tool chest,rolling tool cabinet,garage storage,wall mount tool organizer,tool bag,portable toolbox,tool organizers."
Exterior Paint,Paint & Primers,Exterior Paint.png (https://v5.airtableusercontent.com/v3/u/43/43/1753113600000/glXg368JVWjSOf1v1Kl8JA/k_3bZGT2lUaRn4h56dwi7VipHjsTcKlKW4NJ9Y3L4UNUgEUUtYN3oktGXyU31-7vqVIrEv4BYuDe3uK7nSXpWzAt2lpCKm4sLPg8n-rurp4KlnOdMsW6iXJm9ixCK9MvGGH87nd40B3rEyxCuEC8d_kJwo3UEN1kWx7twqkrFmY/PzQYqABV9WYl7bqBgow-qFb7v-3xK8Zdal8BjlGk3ak),Discover a wide range of Exterior Paint within our Paint &amp; Primers selection. Browse the best Exterior Paint available.,Shop Exterior Paint | Latest Trends & Affordable Prices,"Browse our premium collection of exterior paint. Shop top styles, quality brands, and exclusive deals online today!","exterior paint,buy exterior paint,exterior paint online"
Primers,Paint & Primers,Primers.png (https://v5.airtableusercontent.com/v3/u/43/43/1753113600000/YdUQ4LUZ8UBGkom880HJmQ/LYHR-hxjDi_NrfzCGQp0guj8AFSIMM-q60VyLmUwm6x9d-jgsKDRBH1kKhnziSDUtQLoP55qa5Yh9UDEDIBL91plPtL2Q0_x0jIwVX61I4qnfi_cZ7fwWPhHQ_prMdJ1ySOtdmc3Y92aygotA34_a4YLdnZiDLUQkgEqGMlA51s/GmH1_1alsdstLCWx8HHO31O1OGTQ_2XLCcbykSceUyU),Discover a wide range of Primers within our Paint &amp; Primers selection. Browse the best Primers available.,Shop Primers | Latest Trends & Affordable Prices,"Browse our premium collection of primers. Shop top styles, quality brands, and exclusive deals online today!","primers,buy primers,primers online"
Interior Paint,Paint & Primers,Interior Paint.png (https://v5.airtableusercontent.com/v3/u/43/43/1753113600000/AQL4YzCSYlKLaK76BhKVqQ/m4OwMm8xtqydWpR2VpeMAqF_HksMPtnMseEBoSp3yfS8cVXOQSZvBckItfM62zNQri1DVZuyqr2SfdiENnImDkKSSzxlFG7iVhgMNTMjKiRAZCcSwX2Tn8ya3Scju3FuuotZr7yy_GPCvfSiJb52yQTgRtvB4skBpKbKr8fFFVg/nAPsX2bldv5e0v9rNtRsACOGhkKUKnmRihz-2UkGf4A),Discover a wide range of Interior Paint within our Paint &amp; Primers selection. Browse the best Interior Paint available.,Shop Interior Paint | Latest Trends & Affordable Prices,"Browse our premium collection of interior paint. Shop top styles, quality brands, and exclusive deals online today!","interior paint,buy interior paint,interior paint online"
Paint Supplies,Paint & Primers,Paint Supplies.png (https://v5.airtableusercontent.com/v3/u/43/43/1753113600000/QayQJRXILkniEwlifO7SAg/NrLXbcYPC0Hvm9VsU7bUaGIWxZYRcI46v2DXzsBMoQmlAtvg6XKC8dZkJKm23inGP8vwHUpKyA1XdZLp6NbpqIZLz7nbg9laJ7pXD_3y_5-LMJ3Ubo68lWB5OlQDDLTaZp9Wq-YgwGKLqyjqYqlikhCrcmf2ISNLIKOicWfot-Q/BYr6P8_qSZIQPXpOQf5r2y3wLhKaEAXHlFapqLEIBvA),Discover a wide range of Paint Supplies within our Paint &amp; Primers selection. Browse the best Paint Supplies available.,Shop Paint Supplies | Latest Trends & Affordable Prices,"Browse our premium collection of paint supplies. Shop top styles, quality brands, and exclusive deals online today!","paint supplies,buy paint supplies,paint supplies online"
Door Hardware,Hardware,Door Hardware.png (https://v5.airtableusercontent.com/v3/u/43/43/1753113600000/7DzyoCCR0gCCxM-WJJc_dw/txQ9RP9ZemjpdpLYGKwoiUt60cZfQuRelqZqolVDHYiZ0EoQvEDNAt9GOCAhVxKZKYGSNQ4e1xPE2FiEGzQMWElMZmWGb0mHR3MAunc7d0aeuyhRx4IlqQ4DToXP_-kEXC4pqd_goOzJTSvqwemDLUb39myrIkWLDVKCS2AW1O4/7Szqx6-asZGTyQ9zkp7ymxbw7tOwld-rxtwsJUjUWjg),Discover a wide range of Door Hardware within our Hardware selection. Browse the best Door Hardware available.,Shop Door Hardware | Latest Trends & Affordable Prices,"Browse our premium collection of door hardware. Shop top styles, quality brands, and exclusive deals online today!","door hardware,buy door hardware,door hardware online"
Cabinet Hardware,Hardware,Cabinet Hardware.png (https://v5.airtableusercontent.com/v3/u/43/43/1753113600000/K87QtqRI2n1vW7nALZy8vg/rrkvBswtjLSkoQLwzYoWxt4_Sv03PYE2pSVgctmWFWOC2Vm7gbhJERqApMXYx8mMifW-O0o0SSmwneirofoF1MQuoqPQ9C5v-_vpqd1kFz2cLxdJeR6TVw5ab4XYwDW28l2-Nox5oN8WTCpq7IVq-stw2KZV9ibpsfs5VAA7Qw0/Q2hpIlfN9p3KvB_A68DQLlmF9ajESGmTAILGDG52EXc),Discover a wide range of Cabinet Hardware within our Hardware selection. Browse the best Cabinet Hardware available.,Shop Cabinet Hardware | Latest Trends & Affordable Prices,"Browse our premium collection of cabinet hardware. Shop top styles, quality brands, and exclusive deals online today!","cabinet hardware,buy cabinet hardware,cabinet hardware online"
Shelf Hardware,Hardware,Shelf Hardware.png (https://v5.airtableusercontent.com/v3/u/43/43/1753113600000/QcBAWHAubdi4myVKs0B1lw/wN4QZheVJBI4LkpY96gGlfxFB8VX_DEALOcTHRf8UlvuQuK1vfhvvJYSZVP3fx5jN1cDSsjqo2kT3hqyhwfqWmOvUeRutphrzAM5nbWRm8jsQj0CNcydq6MKjy9N4kP1_r0uYrzqyaYJsOqQmf4rDzKsHgZwshtYMVC4_websik/pWTOHosifxjnhvrWyr0P1tSBQuQavJn7RvpsCY289XE),Discover a wide range of Shelf Hardware within our Hardware selection. Browse the best Shelf Hardware available.,Shop Shelf Hardware | Latest Trends & Affordable Prices,"Browse our premium collection of shelf hardware. Shop top styles, quality brands, and exclusive deals online today!","shelf hardware,buy shelf hardware,shelf hardware online"
Fasteners,Hardware,Fasteners.png (https://v5.airtableusercontent.com/v3/u/43/43/1753113600000/-LulTjgUALJZP6OXHomsDA/i8uY5CHufAFchY764ly8Q3tXpfQG2Ft9HpVi39qtiovrWm5KTCNFLqNgudELa9vYiJ2EiZsbHwfGUpNbwsRyzZkUWPfb05Fnhp1vcxwv1IRMMN0bWqHcdB95AylvUvklGPVe9b0MconYrMZa9MMtMRNBd1vSG9EHL0xpLeGBfo4/fay-Bpjx3SPJcWS2Im9jh4LEctcLXVuORtFJYPdwsfA),Discover a wide range of Fasteners within our Hardware selection. Browse the best Fasteners available.,Shop Fasteners | Latest Trends & Affordable Prices,"Browse our premium collection of fasteners. Shop top styles, quality brands, and exclusive deals online today!","fasteners,buy fasteners,fasteners online"
Construction Hardware,Hardware,Construction Hardware.png (https://v5.airtableusercontent.com/v3/u/43/43/1753113600000/aWo9VImgFnKbqlDl7kYqMA/y6Zh9RPg6MwX7arKkgEbGSWHdD2L9QSImIuWkwAQPOV9Gx81ni12yYlz-1r-0JJm11XBmfKNpkSVHZmGdHI5wJQm2PO6P0QAUvjE8cdEr1EsTeaeu6We67nq-si-4hYcI9YZCWMdXmeDiTxTKLXxkxPU3uATSjivcwJVn0QgFds/qL1Q02Wc8Vu6ofJyGnmj67PJouywk7bHebpTgHi9QhA),Discover a wide range of Construction Hardware within our Hardware selection. Browse the best Construction Hardware available.,Shop Construction Hardware | Latest Trends & Affordable Prices,"Browse our premium collection of construction hardware. Shop top styles, quality brands, and exclusive deals online today!","construction hardware,buy construction hardware,construction hardware online"
Picture Hanger,Hardware,Picture Hanger.png (https://v5.airtableusercontent.com/v3/u/43/43/1753113600000/YXuF8kruSyT8a25Z7KhLlw/gi3c3e7mPPIFhZ7wsEdJn9_Py_vxvKpya-UG9gjybkZtG39ZiMvLOYRPk2KCYlI8RvPVsirCUfgUoqRHDNORWxhaDJHWSYfW8GbwZL7nsi4rX3L-bL7WkLdwsH3xCKkItGCLJ-zOU-pNLu1HwJ_Y0SokZs5TY0ZDmQbf-GVj28I/khybhgwNXg05W0P7QGgMuBWx7hWuhcr42qsj1aA9EH8),"Display your favorite memories and artwork with confidence using our reliable picture hangers. Our collection includes a solution for every wall and frame, from traditional hooks and nails to heavy-duty wires and damage-free adhesive strips. Hang your pictures securely and perfectly level with our easy-to-use and durable hardware.",Picture Hangers & Wall Hanging Kits,"Hang your art and photos perfectly with our picture hangers. We have hooks, wires, and damage-free strips for every type of wall and frame.","Picture hanger,picture hanging kit,wall hooks,frame hangers,damage-free hangers,heavy-duty picture hangers,sawtooth hanger,picture hanging wire."
Toilets & Bidets,Plumbing,Toilets & Bidets.png (https://v5.airtableusercontent.com/v3/u/43/43/1753113600000/qeGZLeyVm1FjBKG6R15EbA/t1v9oXGhEUHSx1CUmBIdKKhLDx8UNyoNOqR93JbQQ5sspQKxFsyjgo3RLLzYM4pnaBKy-IdVC2DcofHUEIXrGdVDedL7KiB6TP_r5USUpyE_sbuMfobMYhbIpA2t7lh128ZFBLix8i9MYdaHHyZG7OfNxwLUksdQ2b5GPugtedg/VZGpBACGeZKSgpBQvCXADXtsLslE6ZWSv_8uBi-LJMM),Discover a wide range of Toilets &amp; Bidets within our Plumbing selection. Browse the best Toilets &amp; Bidets available.,Shop Toilets & Bidets | Latest Trends & Affordable Prices,"Browse our premium collection of toilets & bidets. Shop top styles, quality brands, and exclusive deals online today!","toilets & bidets,buy toilets & bidets,toilets & bidets online"
Faucets & Sinks,Plumbing,Faucets & Sinks.png (https://v5.airtableusercontent.com/v3/u/43/43/1753113600000/MwQ4gFeXuNEAkqFiQ5FwTg/HLEqaMU0AK0RMJpXbac0aPAeGrvid1tN2oU1CHhK-ZcPME4DUiDLYoq-1e3iCj_okv6bkHqSo8wqWH28Mf1rVPF5Zen41Ns7sLoSy8E3L_AP7OMjIY--a1gOFLVsgw_9Mke192xWlVExCG-8CDiotDrq4SMbJsIWObjLAN-Mdzo/My5vcM1_th8e8ygN4Csrn9urhC7aa9ZRJnVcMnP4wRM),Discover a wide range of Faucets &amp; Sinks within our Plumbing selection. Browse the best Faucets &amp; Sinks available.,Shop Faucets & Sinks | Latest Trends & Affordable Prices,"Browse our premium collection of faucets & sinks. Shop top styles, quality brands, and exclusive deals online today!","faucets & sinks,buy faucets & sinks,faucets & sinks online"
Plumbing Supplies,Plumbing,Plumbing Supplies.png (https://v5.airtableusercontent.com/v3/u/43/43/1753113600000/ClCpLFF8NQMxG4RBvsbAUw/7ki6wB-BDkGQMs2wStWP2045ok-jZC2_PRYQd1nd3XbS5qnbFODWRRtOIuoNEggU0lbiOLtF09G2jkN988pvoIZbtyJ1A9Q7HqQ6wc1DmyZWswLDPAFFm-eRDpZaBev-AIuwxTU_jAgpydzsYn0ryFw9G5kYn00BpvRokb4QLak/3uqVTMBVJ07d1-k8fkw5YT_KMhXK8vfxo5aJTPFbPeg),Discover a wide range of Plumbing Supplies within our Plumbing selection. Browse the best Plumbing Supplies available.,Shop Plumbing Supplies | Latest Trends & Affordable Prices,"Browse our premium collection of plumbing supplies. Shop top styles, quality brands, and exclusive deals online today!","plumbing supplies,buy plumbing supplies,plumbing supplies online"
Water Heaters,Plumbing,Water Heaters.png (https://v5.airtableusercontent.com/v3/u/43/43/1753113600000/RlR7VjTCAeIfRMIJIfNKxQ/J_YeDopvK572W6lPfHsK1RNI5i2bysXgXFy830ayyp0RGSLAQAbIPZ4h50wTUAmPGBnbfNm9klNaCpz2p98qetJm8iUK9UzzsxdVYJ-pn6Te1ZbhXo5FZc78fhQ9-vVFUF12QaFNMO3LRyCBhcjZ5qOKiPGxip51PY7lpBumhOk/56ExnLshmYyHrDwFlICIZeeAEfqwWkKezCwRbjCFV3s),Discover a wide range of Water Heaters within our Plumbing selection. Browse the best Water Heaters available.,Shop Water Heaters | Latest Trends & Affordable Prices,"Browse our premium collection of water heaters. Shop top styles, quality brands, and exclusive deals online today!","water heaters,buy water heaters,water heaters online"
Pipes & Fittings,Plumbing,Pipes & Fittings.png (https://v5.airtableusercontent.com/v3/u/43/43/1753113600000/4ksCRD7YM_sDKvV8H1B6fQ/3-Enx-ifoVQxx0lhdCiEfeMR3Bq0znvaGv2xk3KozrtYgnxxlb0FxYvK9729fiRNfrSssjuxLuWYRZOjjn-fRw28_h7AW4M5SetD-U8ZxWrTjhENraaCrd0mqiZswaUrJqkq9b5lO-sOHoPNSDa_142fQRpbmmhZ6ul2QOe2LEo/KRQfbkNOVJc40Vkjzu2Ntbvosbt3pn8ov8uXufdef1s),Discover a wide range of Pipes &amp; Fittings within our Plumbing selection. Browse the best Pipes &amp; Fittings available.,Shop Pipes & Fittings | Latest Trends & Affordable Prices,"Browse our premium collection of pipes & fittings. Shop top styles, quality brands, and exclusive deals online today!","pipes & fittings,buy pipes & fittings,pipes & fittings online"
Wiring & Cables,Electrical,Wiring & Cables.png (https://v5.airtableusercontent.com/v3/u/43/43/1753113600000/9lET1te59sxL4HpKe_8zEw/0esntbSF11KnzPcx0SxRQTvuGodm2hphTobkonWu4vLyczUeTVjlEjH3dk7Z1UbG9-OQvLxGwbSeHa5ClGDFUJV2kq3q7_on6OuXnRuVi9IcELFDQ9auhcnWEcfqPp0PP-rjs3jRS_FCNi83s6ZITBnHPiShQVgHarY_ahd5CL4/VxcMaA4ynWQ6er5TYTdJ5xdU3Wg6-39BBnBVe5fwa5c),Discover a wide range of Wiring &amp; Cables within our Electrical selection. Browse the best Wiring &amp; Cables available.,Shop Wiring & Cables | Latest Trends & Affordable Prices,"Browse our premium collection of wiring & cables. Shop top styles, quality brands, and exclusive deals online today!","wiring & cables,buy wiring & cables,wiring & cables online"
Electrical Supplies,Electrical,Electrical Supplies.png (https://v5.airtableusercontent.com/v3/u/43/43/1753113600000/WIbEaI0Y8k7-NJvgE5Y02g/duZt7oEjOqe26v1LrkPQevnz70CcG-d637ohh1T-tQhbKkwwm0pI9r1b4m_WAWL4f2SI8l1BgfS2AfY8IzhbuHLubm5V_vpbeTdxbadHYF5NMgKIuwGZb0x4fU46j_auIclfvPiJMXnX2qV-OJ5A-g-SkBnpbnUBjIdtV0QVISA/cF_4PvGyBRTxPc3YxMhTUlWXgT-DPYCKgaPTA5t1wog),Discover a wide range of Electrical Supplies within our Electrical selection. Browse the best Electrical Supplies available.,Shop Electrical Supplies | Latest Trends & Affordable Prices,"Browse our premium collection of electrical supplies. Shop top styles, quality brands, and exclusive deals online today!","electrical supplies,buy electrical supplies,electrical supplies online"
Circuit Breakers & Panels,Electrical,Circuit Breakers & Panels.png (https://v5.airtableusercontent.com/v3/u/43/43/1753113600000/vi4hWYyALnR_hxGjvHYFQg/4_Qzq2Sdjrix-EzPLI_8C4F52p-lTQogMEWEaTgyqnIN67LlA28WdhuNJtdsRAChRBpbZI1PZvX1U2Q-VFhvQAkr0Cd2-gxnXtep4z_wewQZAwwGEKSiQE5ckpB2o3rpXE4YY-l7Hm98Vg71_z8SgTyh_7RoFLxEjb-uiaSveBU/hLGJ37gLwpPdVEO4WEo0WMKp0VRgHMbEYYiu1QCnBNs),Discover a wide range of Circuit Breakers &amp; Panels within our Electrical selection. Browse the best Circuit Breakers &amp; Panels available.,Shop Circuit Breakers & Panels | Latest Trends & Affordable Prices,"Browse our premium collection of circuit breakers & panels. Shop top styles, quality brands, and exclusive deals online today!","circuit breakers & panels,buy circuit breakers & panels,circuit breakers & panels online"
Lighting Fixtures,Electrical,Lighting Fixtures.png (https://v5.airtableusercontent.com/v3/u/43/43/1753113600000/TtUUde3-vP1tNYiOHcNB0A/BQ_gFBQHrSpg81WgLFp7YO7O78e9DXPPXPVWmN_wct-tU21Hg9x8AvCjmXpAkQmmIoP1nGkQde4fXfVrEo5sNgUpMIo_ipoIpdHR1AYrkZ5opmgPr4XtpC8psnXHhVkInasc3wiib-LEBxRFTSCia8Tq-XIMAzArhxRHGPEeGcM/G7MlrltuJyg3yZ8VnR_Lih9CnvxTdmyYFXyk_1nQvMg),Discover a wide range of Lighting Fixtures within our Electrical selection. Browse the best Lighting Fixtures available.,Shop Lighting Fixtures | Latest Trends & Affordable Prices,"Browse our premium collection of lighting fixtures. Shop top styles, quality brands, and exclusive deals online today!","lighting fixtures,buy lighting fixtures,lighting fixtures online"
Outlets & Switches,Electrical,Outlets & Switches.png (https://v5.airtableusercontent.com/v3/u/43/43/1753113600000/KIgoMbbYk5JuNLf3X9OuQA/yowoZ49CFLqfNrrrXKPal8I6TGczLem342B4MFJupyyXCZfzOBDg1SPsG8bl-lAYP3AUNxfgrsY27ZoP__bHzDlV_2I0joWP1tbTpN8-NUtjb7w6ePmiad2osXVZWxa1EzIK1cbGIajAZSjq3UhJ25eMZkOri6X1OXOp9p8ZKJM/cufVYLm0I3kfZasaJ6MibGZZ2tF3iK_jnI2MNiFC8Xk),Discover a wide range of Outlets &amp; Switches within our Electrical selection. Browse the best Outlets &amp; Switches available.,Shop Outlets & Switches | Latest Trends & Affordable Prices,"Browse our premium collection of outlets & switches. Shop top styles, quality brands, and exclusive deals online today!","outlets & switches,buy outlets & switches,outlets & switches online"
Carpet,Flooring,Carpet.png (https://v5.airtableusercontent.com/v3/u/43/43/1753113600000/wW5hg6XKEBIaYAYBCpdMOA/v4WP6mp009lmIVzrbYfrwacD8FWHXINyYyIxA_iOkUcuFzU0E0olBWW8MD_cINoAdpDf6xpOs2xMM4MRKCgEE1lgU2bpLzYX1_dxIRVhzTQ6g3g1vmSWVQEcsqrQDKrADwpIZa8b61Ud6WVoYrbwMDVb5c04uiM22--Sd4w8T2w/xqP-yXOxT4iHkRDI5Q6tqPetpG8FdV96JCE7eumi2x8),Discover a wide range of Carpet within our Flooring selection. Browse the best Carpet available.,Shop Carpet | Latest Trends & Affordable Prices,"Browse our premium collection of carpet. Shop top styles, quality brands, and exclusive deals online today!","carpet,buy carpet,carpet online"
Hardwood Flooring,Flooring,Hardwood Flooring.png (https://v5.airtableusercontent.com/v3/u/43/43/1753113600000/rQwhDYTZt5K6d8tT02yfeA/c-ZZSfvXhRDhRQdvR5EeAQ_IgrqIYW8uNxwanoExrJkK1efYqb1Z875XqHocqO5Htpyamdv41BuDPaMPRzqyTOIsUzfph9NTfXlNmrviK9luepJfeTOE46eJtkxa8-iFhGCWef_MTNVErX_Kym1KDNLqqS3YYw-zII7BvkIWLaA/ARsYs49r8fjt5LCFsABGOP4V2Nwg4ZtnJBAoJRUnxbs),Discover a wide range of Hardwood Flooring within our Flooring selection. Browse the best Hardwood Flooring available.,Shop Hardwood Flooring | Latest Trends & Affordable Prices,"Browse our premium collection of hardwood flooring. Shop top styles, quality brands, and exclusive deals online today!","hardwood flooring,buy hardwood flooring,hardwood flooring online"
Laminate Flooring,Flooring,Laminate Flooring.png (https://v5.airtableusercontent.com/v3/u/43/43/1753113600000/qsC2_VbGDFdh3PsTK2ie2w/ch6n_IRgHpxwGxSQcCXWj2I3vZGnnPB7Y38OOgRDEP06R4bTPFpa5VCfPjZJGpLFyhwVgRsrUDQxRgfk9xHcWJXT5hNkQoUANFjP0noUsdrbf1Az61UNB4M6HbSNq_-GuDZgPPSzcTIuPf06jkOw4xLNRZs6nakLxhxNEyAcwYM/Scma58ie3LWR2pomWZ_6HouMMLmyYRP1mVcN2WzorbQ),Discover a wide range of Laminate Flooring within our Flooring selection. Browse the best Laminate Flooring available.,Shop Laminate Flooring | Latest Trends & Affordable Prices,"Browse our premium collection of laminate flooring. Shop top styles, quality brands, and exclusive deals online today!","laminate flooring,buy laminate flooring,laminate flooring online"
Tile Flooring,Flooring,Tile Flooring.png (https://v5.airtableusercontent.com/v3/u/43/43/1753113600000/JkLPPq3P3nyRjGb-CpX-mA/e66OUQCfZzLjdOgmoZAPhcDDU6YZApGxBl4oCVq8GwYd6rmkc1skyg21b2JF668DkRU6OGe7fnF-n2qR1RIYp0kumA5qPHhAc6PgcIDgGiWFBtZMs8gjyQPUdhksMVNcrEIRbT7bIH2B45YJF3_tbUjvI23_7LUF922Z-evxmG0/GpASaTvn459hpXcIeKmUbRxmDpJDhIT1XLChA0EJcgM),Discover a wide range of Tile Flooring within our Flooring selection. Browse the best Tile Flooring available.,Shop Tile Flooring | Latest Trends & Affordable Prices,"Browse our premium collection of tile flooring. Shop top styles, quality brands, and exclusive deals online today!","tile flooring,buy tile flooring,tile flooring online"
Flooring Supplies,Flooring,Flooring Supplies.png (https://v5.airtableusercontent.com/v3/u/43/43/1753113600000/_QpkHan9q5J0g3JK-QwzqQ/-Tq2xCmGX4M-woStC2GFBmlijRTxkC9pGp58Tw0fkCqU6nbbboQkpxkY6aB4k6m1uAbboJch-I4bI_oJkcMXecMhJb_iGBn-lSKxepG3DvhZn-bS2q0l6zCN7dFjn7kNiPMXGU_xbcTqEmMBI_uNNyuGR8CZoLOtmySXVDGf0yE/1yFr_uK-rAtDsB5ASywUomJZjuwvdQd1-xcKO6pGem4),Discover a wide range of Flooring Supplies within our Flooring selection. Browse the best Flooring Supplies available.,Shop Flooring Supplies | Latest Trends & Affordable Prices,"Browse our premium collection of flooring supplies. Shop top styles, quality brands, and exclusive deals online today!","flooring supplies,buy flooring supplies,flooring supplies online"
Kitchen Appliances,Kitchen & Bath,appliances.png (https://v5.airtableusercontent.com/v3/u/43/43/1753113600000/AyVy1Mg6aDLLZ7Q7ihTL6A/Ka8qDaxULvMFUl8Au8BVfhYCu8H8rOfb4BEFcnWKbo3akWWbHjbSrjoLPWDzcYkSbBirjAz8Ptn9HddLB6ppqxqaatdAFVQZ1I0Lp6rnbrU9vAJV-O-Zbs_kSbEwHZkAbCrZvjW72PjhZ8fv9P8HA4wbQj_3F0AlnMVBk0vdYTs/U7NtdDNFxRrWBIiheI86HCkoFP4Ol4zg_7_sECtohwc),Discover a wide range of Appliances within our Kitchen &amp; Bath selection. Browse the best Appliances available.,Shop Appliances | Latest Trends & Affordable Prices,"Browse our premium collection of appliances. Shop top styles, quality brands, and exclusive deals online today!","appliances,buy appliances,appliances online"
Cabinets,Kitchen & Bath,Cabinets.png (https://v5.airtableusercontent.com/v3/u/43/43/1753113600000/WjzO26gbqjGJi62Rn-boCw/e7foc8UVToLbAmMK73JC5aAkxlhdtElMPSBiLcg9q4RH4JYGvUZlmYj7ZMMK3TUrgdPibGlP0xv5oxmulCjxnqPaokMLvBISH9iQ56k6VvGQueFjvq3eXU0gPEpGlulB0QU5PS-4p8bsOvjlPevvKM5HW3vtEL9yvYi-Vwp_ZC0/p1aDVAftzAHEMo3JH-tAf8UzCID3UDJUGniKRbeG7Fk),Discover a wide range of Cabinets within our Kitchen &amp; Bath selection. Browse the best Cabinets available.,Shop Cabinets | Latest Trends & Affordable Prices,"Browse our premium collection of cabinets. Shop top styles, quality brands, and exclusive deals online today!","cabinets,buy cabinets,cabinets online"
Showers & Tubs,Kitchen & Bath,Showers & Tubs.png (https://v5.airtableusercontent.com/v3/u/43/43/1753113600000/oIA3A4By999Tbb8Y9eWyFw/XmQf49OnbJgtEVBkoSCX2oPtmueI6ZJWad1HxM_ytTf964_kyUzDVIQlSyE1UM_jxn5FgnpJzkpQSAVIBRk_ClwSDT6geU0oKvgNQY3BGbUWAZ7q7lmuw-U1Wy94WXJ4A5XW-_Q7Bc7rq-ZHjtjybPtmbHbV5kpXdRco2qKXBuQ/g8DUwwEzrM0D8vIzSzAUYS4Be0iffROmmOWEcHVADzs),Discover a wide range of Showers &amp; Tubs within our Kitchen &amp; Bath selection. Browse the best Showers &amp; Tubs available.,Shop Showers & Tubs | Latest Trends & Affordable Prices,"Browse our premium collection of showers & tubs. Shop top styles, quality brands, and exclusive deals online today!","showers & tubs,buy showers & tubs,showers & tubs online"
Countertops,Kitchen & Bath,Countertops.png (https://v5.airtableusercontent.com/v3/u/43/43/1753113600000/tw_RtLQIhpx3RVzvUgzKTA/IVOA8QaH0dxVfQguCSKberFUWIbNXeRt1XHgH26l4ER_a2F6_9ORTqlD9jzYukMp-VAX83AlN_fNLaO4Xr1M5JcdA2Ezof9p3zvDJv-gjv2kFID1m64bgbFGqW5OKukSnWRZYs4uF40lemTgTGYtZXmnbVD0DgqplcERr1vfq2M/Br5ylPbpnvfrWQwBmaAaKSYKOtsKNVxoOB-VSWRyw1o),Discover a wide range of Countertops within our Kitchen &amp; Bath selection. Browse the best Countertops available.,Shop Countertops | Latest Trends & Affordable Prices,"Browse our premium collection of countertops. Shop top styles, quality brands, and exclusive deals online today!","countertops,buy countertops,countertops online"
Sinks & Faucets,Kitchen & Bath,Faucets & Sinks.png (https://v5.airtableusercontent.com/v3/u/43/43/1753113600000/NTjchHnTit7r9nqAaguWig/nRaMyXQKD9FscXsRC_OyfjVpwCEmm9RcKxexfWxLfQGITG1juViZ0Jb_e3eXND_HBLqh7t2LPA-2gIenGDjMuHzUlkSJtnZ77qO7edPbdJnF8KcFfgJkaez1jKbREqrcEWha5Ip6-BdG0PSHXR9vVY8EeDgAHUeLS5t5vzQG1BE/1RUC0hVLG18C6dleiO9bp5CF_SBkKZ2SMCWV8r5G5To),Discover a wide range of Sinks &amp; Faucets within our Kitchen &amp; Bath selection. Browse the best Sinks &amp; Faucets available.,Shop Sinks & Faucets | Latest Trends & Affordable Prices,"Browse our premium collection of sinks & faucets. Shop top styles, quality brands, and exclusive deals online today!","sinks & faucets,buy sinks & faucets,sinks & faucets online"
Ceiling Lights,Lighting,Ceiling Lights.png (https://v5.airtableusercontent.com/v3/u/43/43/1753113600000/41gAY4Lfm-jk85hSfIuI2w/9xdYXRt7Y8MgnDZq2CHgvfXgLh5bQUTqWUM9vKCLlDvxxycbzOtIi-cQ0TVt2b2TCeCWrobwnTq0J2kpMlaGk5MS29DLfMLzbI8v-BIgpArvLLH0uI-T3P0gnwiLRtq0_zJKxKyP-1reItwzQBTFBEK6v6PzPAdgaLXxpmSOLFU/KVjHzRD_AJhhIgFUQDmsd-KhC-KydBcVZNlQ0-15SCo),Discover a wide range of Ceiling Lights within our Lighting selection. Browse the best Ceiling Lights available.,Shop Ceiling Lights | Latest Trends & Affordable Prices,"Browse our premium collection of ceiling lights. Shop top styles, quality brands, and exclusive deals online today!","ceiling lights,buy ceiling lights,ceiling lights online"
