Original Name,Optimized Name,SEO Title,Meta Description,Slug,Brand,Category,Focus Keywords,Product Tags,Image Alt Text,Target Location,Promotion,Optimization Score
Wireless Bluetooth Headphones,Wireless Wireless Bluetooth Headphones,Wireless Wireless Bluetooth Headphones | Buy Online in To...,Shop premium Wireless Wireless Bluetooth Headphones in Toronto starting at $79.99 Local Pickup Available with free local delivery & pickup. Key features: Noi...,wireless-wireless-bluetooth-headphones,Wireless,Electronics,wireless bluetooth headphones; buy wireless bluetooth headphones; wireless bluetooth headphones online; best wireless bluetooth headphones; wireless wireless bluetooth headphones; wireless deals; wireless bluetooth headphones oakville; buy wireless bluetooth headphones oakville,"Noise Cancellation, Fast Delivery, Mississauga, Electronics, Toronto, Wireless Bluetooth Headphones, Local Pickup, Best Price, Oakville, 20hr Battery, Wireless, Quality Guarantee, Customer Service",Wireless Wireless Bluetooth Headphones with Noise Cancellation - main view,Toronto,Sale up to 90%,40
Cotton T-Shirt,Cotton Cotton T-Shirt (Red) - Large - Red,Cotton Cotton T-Shirt | Buy Online in Mississauga 2025,Shop premium Cotton Cotton T-Shirt in Mississauga starting at $24.99 Sale up to 90% with free local delivery & pickup.,cotton-cotton-t-shirt,Cotton,Clothing & Fashion,cotton t-shirt; buy cotton t-shirt; cotton t-shirt online; best cotton t-shirt; cotton cotton t-shirt; cotton deals; cotton t-shirt mississauga; buy cotton t-shirt mississauga,"Red, Fast Delivery, Mississauga, Toronto, Local Pickup, Large, Best Price, Oakville, Quality Guarantee, Clothing & Fashion, Cotton, Customer Service, Cotton T-Shirt",Cotton Cotton T-Shirt in Red - main view,Mississauga,Save with 4more,25
Coffee Maker,Hamilton Beach Coffee Maker,Hamilton Beach Coffee Maker Sale | Mississauga Best Price,"Get the best Hamilton Beach Coffee Maker deals in Oakville. Best Deals in GTA starting at $89.99. Fast shipping across GTA. Key features: 12-Cup, Programmable.",hamilton-beach-coffee-maker,Hamilton Beach,Electronics,coffee maker; buy coffee maker; coffee maker online; best coffee maker; hamilton beach coffee maker; hamilton beach deals; coffee maker toronto; buy coffee maker toronto,"Fast Delivery, Mississauga, Electronics, Toronto, Local Pickup, Best Price, Oakville, Customer Service, Quality Guarantee, Programmable, Coffee Maker, Hamilton Beach, 12-Cup",Hamilton Beach Coffee Maker with 12-Cup - main view,Mississauga,Best Deals in GTA,40
Yoga Mat,Yoga Yoga Mat (Purple) - Purple,Shop Yoga Yoga Mat | Oakville Local Store,Buy Yoga Yoga Mat online from Promote Local starting at $39.99. Toronto trusted local store. Sale up to 90%!,yoga-yoga-mat,Yoga,Electronics,yoga mat; buy yoga mat; yoga mat online; best yoga mat; yoga yoga mat; yoga deals; yoga mat mississauga; buy yoga mat mississauga,"Fast Delivery, Yoga, Mississauga, TPE, Electronics, Toronto, Local Pickup, Best Price, Yoga Mat, Oakville, Purple, Quality Guarantee, Customer Service",Yoga Yoga Mat in Purple - main view,Mississauga,Save with 4more,25
LED Desk Lamp,Led LED Desk Lamp,Buy Led LED Desk Lamp Online | Oakville Promote Local,"Shop premium Led LED Desk Lamp in Toronto starting at $59.99 Price Match Guarantee with free local delivery & pickup. Key features: Adjustable, USB Charging.",led-led-desk-lamp,Led,Electronics,led desk lamp; buy led desk lamp; led desk lamp online; best led desk lamp; led led desk lamp; led deals; led desk lamp toronto; buy led desk lamp toronto,"Led, Fast Delivery, Mississauga, Electronics, Toronto, Local Pickup, Best Price, Oakville, Customer Service, Quality Guarantee, LED Desk Lamp, USB Charging, Adjustable",Led LED Desk Lamp with Adjustable - main view,Oakville,Price Match Guarantee,40
